question,answer
What is behavioral finance and why does it matter for investors?,"Behavioral finance studies how psychological biases and cognitive errors affect financial decisions, challenging the classical assumption that investors are fully rational. It emerged from the work of psychologists Daniel Kahneman and Amos Tversky who demonstrated systematic departures from rational decision-making. Understanding behavioral biases helps investors build better systems to counter their own irrationality and potentially exploit predictable irrationalities in markets."
What is loss aversion?,"Loss aversion is the finding that people feel the pain of a loss approximately twice as intensely as the pleasure of an equivalent gain, a core finding of Kahneman and Tversky's research. This means a $1,000 loss hurts about as much as a $2,000 gain feels good. Loss aversion causes investors to hold losing positions too long (avoiding the pain of realizing a loss) and sell winners too quickly (locking in gains before they disappear)."
What is Prospect Theory?,"Prospect Theory, developed by Kahneman and Tversky, describes how people actually evaluate outcomes relative to a reference point rather than final wealth levels, with asymmetric sensitivity to gains and losses. The value function is S-shaped: concave in gains (diminishing sensitivity to additional gains) and convex in losses (greater sensitivity to small losses). It also incorporates probability weighting, where people overweight small probabilities (lottery tickets) and underweight moderate-to-large probabilities."
What is overconfidence bias in investing?,"Overconfidence causes investors to overestimate their knowledge, abilities, and accuracy of their predictions. Studies consistently show that individual investors trade too frequently (excessive trading reduces returns through transaction costs and taxes) because they believe they have better information than the market. Men have been shown to be more overconfident than women in financial contexts, resulting in systematically worse trading outcomes."
What is confirmation bias and how does it affect investment decisions?,"Confirmation bias is the tendency to seek, interpret, and remember information that confirms pre-existing beliefs while ignoring contradictory evidence. An investor who believes a stock is undervalued will seek out bullish research and dismiss bearish analysis, creating a biased information set. Combating confirmation bias requires actively seeking out the strongest case against your investment thesis."
What is anchoring bias in finance?,"Anchoring occurs when investors fixate on an irrelevant reference point—most commonly their purchase price—when making investment decisions. An investor who bought a stock at $100 that has fallen to $60 may anchor to $100 as the reference, making it emotionally difficult to sell at $60 even if the fundamentals justify an even lower price. The purchase price is economically irrelevant to the stock's future prospects, yet it powerfully affects decision-making."
How does herding behavior manifest in financial markets?,"Herding occurs when investors follow the crowd rather than their own analysis, amplifying price trends and creating bubbles and crashes. Professional fund managers face career risk for being different from peers (relative performance pressure), creating institutional herding. Herding is rational for individual incentives but collectively irrational for markets, as it disconnects prices from fundamentals during mania and panic periods."
What is recency bias in investing?,"Recency bias is the tendency to give excessive weight to recent events and extrapolate them into the future. After a bull market, investors expect continued gains and take excessive risk; after a crash, they expect further declines and avoid equity exposure precisely when it is most attractive. Recency bias causes investors to buy high (after recent performance has been strong) and sell low (after recent losses)."
What is the availability heuristic in finance?,"The availability heuristic causes people to assess probability based on how easily examples come to mind rather than actual statistical frequency. After a dramatic market crash is heavily covered in media, investors overestimate crash probability; after a long bull market without major disruption, they underestimate it. This mental shortcut causes systematic mispricing of risk based on what is most memorable rather than most probable."
What is the representativeness heuristic?,"The representativeness heuristic involves judging probability based on how similar something is to a prototype, ignoring base rates and statistical evidence. Investors may assume a great company is also a great stock (confusing quality of the business with valuation), or believe that consistent past earners will continue to grow (ignoring regression to the mean). This bias contributes to overvaluing growth stocks and undervaluing cyclicals and value stocks."
What is mental accounting?,"Mental accounting is the tendency to treat money differently based on its subjective category or source rather than as fungible. Examples include spending a tax refund more freely than earned wages, treating gambling winnings as 'house money' that can be risked, and compartmentalizing a retirement account from a trading account with different risk levels. Rational finance views all money as equivalent regardless of its source or mental label."
How does the sunk cost fallacy affect investor behavior?,"The sunk cost fallacy involves allowing unrecoverable past investments to influence current decisions. An investor holding a down-30% stock may refuse to sell because they've 'already lost so much,' even though the past loss is irrelevant to future performance. The only rational question is: given current information, is holding the stock better than the alternatives, regardless of what was paid?"
What is the endowment effect in investing?,"The endowment effect causes people to value things more highly simply because they own them, leading to reluctance to sell at fair market prices. Investors often require higher prices to sell positions they already own than they would pay to acquire the same position, creating a status quo bias toward holding. The endowment effect reinforces holding underperforming positions and concentration in single stocks particularly when inherited."
How does framing affect financial decisions?,"Framing describes how the presentation of information influences choices, even when the underlying facts are identical. The same portfolio described as 'avoiding a 10% chance of losing $1,000' versus 'having a 90% chance of avoiding a $1,000 loss' elicits different preferences despite identical probabilities. Financial advisors and marketers exploit framing effects; being aware of how information is presented helps investors make decisions based on substance rather than presentation."
What is status quo bias in portfolio management?,"Status quo bias is the preference for the current state of affairs, treating any change from the present as a loss. It causes investors to hold inherited or long-held positions far too long, delay rebalancing portfolios that have drifted from targets, and avoid switching to better investment options due to inertia. Regular calendar-based rebalancing schedules counteract status quo bias by making action the default rather than the exception."
What is the illusion of control in trading?,"The illusion of control causes investors to believe they have more influence over uncertain outcomes than they actually do. Day traders may mistake random success with skill, developing unwarranted confidence in trading systems that happen to work in sample. More frequent trading, complex analysis, and customized strategies all enhance the feeling of control while providing no improvement in actual outcomes."
What is the difference between gambler's fallacy and hot hand fallacy?,"The gambler's fallacy is the mistaken belief that independent random events are influenced by prior outcomes (after a long losing streak, a win is 'due'). The hot hand fallacy believes recent success in skill-based activities predicts future success, sometimes applied incorrectly to random events. In markets, both errors occur: seeing mean reversion in genuinely trending markets (gambler's fallacy) or expecting momentum to continue in random price movements (hot hand fallacy)."
What is the disposition effect?,"The disposition effect describes investors' systematic tendency to sell winning investments too soon and hold losing investments too long—exactly opposite of rational tax-aware strategies. Investors sell winners to lock in the pleasure of gains and avoid realizing losses to escape the pain of acknowledging mistakes. This behavior results in poor tax outcomes (realizing short-term gains) and poor investment outcomes (selling outperformers and holding underperformers)."
What is home bias in investing?,"Home bias is the tendency for investors to hold disproportionately large allocations to domestic investments despite the benefits of international diversification. U.S. investors often hold 70-90% domestic equities despite U.S. stocks representing only about 60% of global market cap. Home bias reduces diversification, leaves exposure to domestic market cycles, and misses international growth opportunities, particularly in emerging markets."
What is familiarity bias?,"Familiarity bias causes investors to favor investments in companies, industries, or geographies they know well. Employees overweight their own company's stock in 401(k) plans, local investors overweight nearby companies, and most investors ignore unfamiliar foreign markets. Familiarity does not reduce risk—it concentrates it—but it reduces anxiety because familiar risks feel smaller than unfamiliar ones."
What is the narrative fallacy in financial markets?,"The narrative fallacy describes the human tendency to create coherent causal stories from random or complex data sequences. Investors construct compelling stories for why stocks rose or fell that feel definitive but are often post-hoc rationalizations of random events. Narrative stories about 'why this time is different' or 'why this company is unstoppable' can override statistical evidence and cause valuation extremes."
What is hindsight bias in investment decision review?,"Hindsight bias causes people to believe, after the fact, that they knew outcomes were predictable. After a market crash, people retrospectively feel they 'saw it coming,' which distorts learning from experience by making mistakes seem more foreseeable than they were. Maintaining investment journals that record real-time reasoning combats hindsight bias by creating an objective record of what was actually known and believed at the time of each decision."
How does regret aversion affect financial decisions?,"Regret aversion causes investors to make choices that minimize anticipated regret rather than expected returns. Commission bias (acting and failing) often feels worse than omission bias (not acting and missing out), causing investors to stick with familiar mediocre investments rather than risk the regret of an unfamiliar failed investment. This leads to excessive caution in some contexts and unwillingness to admit mistakes in others."
What is FOMO (Fear of Missing Out) in financial markets?,"FOMO drives investors into assets that have already appreciated significantly because they fear missing further gains. It was prominently visible during the dot-com bubble, cryptocurrency bull markets, and meme stock frenzies. FOMO typically strikes near market peaks when recent performance is strongest, causing investors to buy at elevated prices with poor risk/reward ratios."
What causes panic selling?,"Panic selling occurs when fear overwhelms rational analysis, causing investors to sell assets indiscriminately at depressed prices to stop the psychological pain of portfolio losses. It is fueled by recency bias (extrapolating recent declines), availability bias (vivid memory of prior crashes), loss aversion, and the social pressure of media coverage emphasizing doom. Investors who sell during panics crystallize losses and often miss the recovery that follows most bear markets."
How do market bubbles form psychologically?,"Bubbles form when self-reinforcing feedback loops of rising prices attract more buyers, whose purchases drive prices higher, creating a narrative that validates further buying. Social proof (others are getting rich) overrides skepticism, new valuation frameworks are invented to justify prices, and skeptics are ridiculed for missing obvious opportunities. The bubble bursts when the marginal buyer is exhausted and the same psychological mechanisms reverse into a crash."
What lessons does Tulip Mania offer for modern investors?,"The Dutch Tulip Mania of 1636-1637 saw tulip bulb prices reach extraordinary levels (a single bulb worth more than a house) before collapsing nearly to zero, serving as history's canonical asset bubble example. It demonstrates that any asset—however absurd—can become a speculative vehicle when social proof, leverage, and narrative combine. The pattern of speculative excess, leverage, and sudden collapse repeats across centuries and asset classes."
What behavioral lessons can investors learn from the dot-com bubble?,"The dot-com bubble (1995-2000) demonstrates how new technology narratives can overwhelm rational valuation, with price-to-sales ratios of 20-100x justified by 'winner-take-all' arguments. Survivorship bias now leads people to remember Amazon and Google while forgetting the thousands of companies that went bankrupt. The lesson is that even correct macro trends (internet was transformative) do not justify any price, and valuation always matters."
What behavioral factors contributed to the 2008 financial crisis?,"The 2008 crisis involved overconfidence (quants believed models had eliminated risk), herding (all major banks held similar mortgage-backed securities), complexity as a shield from scrutiny (few understood CDO-squared structures), and excessive leverage driven by competitive pressure. Regulatory capture and incentive misalignment (originators didn't keep credit risk) amplified the behavioral failures. The crisis demonstrates how behavioral biases at institutional scale create systemic risk."
How has social media changed investing behavior?,"Social media (Reddit, Twitter/X, YouTube) accelerates information and misinformation simultaneously, creating faster sentiment swings and enabling coordinated actions like the GameStop short squeeze. It creates echo chambers reinforcing existing biases and exposes investors to a constant stream of exciting trading ideas that encourage activity over patience. Research shows investors who consume more financial media trade more frequently and earn lower returns."
What was the psychology behind the GameStop and meme stock phenomenon?,"The GameStop/meme stock surge of January 2021 combined FOMO, anti-establishment sentiment, social identity, and the dopamine response of trading gamification on platforms like Robinhood. Reddit's WallStreetBets community created a social movement around squeezing short sellers, providing narrative justification for what was fundamentally speculative buying. Most retail participants who bought at peak prices suffered significant losses when fundamentals ultimately reasserted."
How can investors overcome cognitive biases?,"Overcoming biases requires structural interventions rather than willpower: creating a written investment policy with pre-committed rules, using systematic checklists before buying and selling, seeking out contradicting evidence deliberately, and reviewing past decisions with a journal. Working with an accountability partner or advisor who challenges your thinking helps prevent groupthink. Slowing down the decision process and separating analysis from execution reduces impulsive trading."
Why is systematic investing effective against emotional biases?,"Systematic investing (index funds, automatic contributions, rule-based rebalancing) removes day-to-day decision-making from human emotion. Automatic monthly contributions continue through market declines when emotion would stop them, capturing lower prices. Rules-based rebalancing forces buying of fallen asset classes and selling appreciated ones, implementing a buy-low/sell-high discipline without requiring emotional courage."
What is an investment policy statement (IPS) and why is it valuable behaviorally?,"An IPS documents your investment objectives, time horizon, risk tolerance, asset allocation targets, and decision rules for rebalancing and changing allocations. Writing and signing an IPS during calm markets creates a pre-commitment that reduces emotional decisions during volatile periods. Reviewing the IPS during a market crisis provides an anchor to the rational plan created when emotions weren't elevated."
How does contrarian investing exploit behavioral biases?,"Contrarian investing profits from the predictable overreactions caused by herding, recency bias, and loss aversion: buying deeply out-of-favor stocks others are selling in panic, and avoiding crowded popular trades. The challenge is that the contrarian is uncomfortable—being different from the crowd requires tolerance for looking wrong temporarily and resisting social pressure. Successful contrarians combine structural undervaluation with catalysts that could shift sentiment."
What is the role of a financial advisor in behavioral coaching?,"Research shows the most valuable service financial advisors provide is behavioral coaching: preventing clients from panic-selling during crashes, maintaining diversification despite FOMO in narrow asset classes, and sticking to long-term plans during short-term noise. Vanguard's Advisor's Alpha research estimates behavioral coaching adds approximately 1.5% per year in net return through improved investor behavior. This coaching value alone typically justifies advisory fees for behaviorally-prone investors."
How does dollar-cost averaging work as a behavioral tool?,"Dollar-cost averaging (DCA) automatically invests fixed amounts at regular intervals regardless of market prices, removing the psychological barrier of trying to time the market. It forces purchases during down markets when emotion says to wait, and naturally reduces buying when prices are high (buying fewer shares). Beyond its mechanical effects, DCA reduces decision fatigue and the psychological burden of managing a lump-sum investment."
What are the benefits of automatic portfolio rebalancing?,"Automatic rebalancing systematically sells overweight assets and buys underweight ones to maintain target allocations, implementing a disciplined buy-low/sell-high process without requiring emotional courage. Without automation, investors typically delay rebalancing, especially when it means buying an asset class that has been performing poorly. Behavioral research shows investors with automatic rebalancing maintain more appropriate risk levels and achieve better risk-adjusted outcomes."
How does media consumption affect investment decisions?,"Heavy consumption of financial media (CNBC, financial news, market commentary) is associated with more frequent trading and lower returns due to overreaction to short-term noise presented as meaningful signals. Media has structural incentives to present market events as more significant than they are (drama attracts viewers). A selective media diet focused on long-term analysis rather than daily market commentary supports better investment behavior."
