question,answer
What is authority bias in following financial advice?,"Authority bias is the tendency to attribute greater credibility and accuracy to the opinions of authority figures, regardless of their actual expertise in a specific domain. In finance, investors may uncritically follow the advice of economists, TV personalities, or celebrities who have achieved authority in unrelated fields. Research consistently shows that most financial pundits have prediction accuracy barely above chance, yet they are trusted because of their confident presentation and authority signals (credentials, suits, TV appearances). The antidote is to evaluate financial advice based on the track record and reasoning quality of the source, not credentials or presentation style."
What is the Barnum or Forer effect applied to financial forecasts?,"The Barnum (or Forer) effect describes the tendency to accept vague, general statements as uniquely accurate personal descriptions. In finance, this applies to horoscope-like market forecasts that are sufficiently vague to seem accurate in retrospect ('markets will be volatile,' 'watch for risks in the second half'). Investors gravitate toward analysts and strategists who give confident-sounding but unfalsifiable predictions. The discipline of demanding specific, falsifiable predictions with defined time horizons—and tracking forecast accuracy—exposes the low predictive value of most market commentary."
What is the planning fallacy in financial projects and budgets?,"The planning fallacy is the systematic tendency to underestimate the time, costs, and risks of future plans while overestimating the benefits. Kahneman and Tversky identified it as a manifestation of overoptimism combined with focusing on the inside view (imagining this specific project) rather than the outside view (what similar projects actually cost and took). In finance, the planning fallacy explains why home renovations routinely cost twice the budget, startups underestimate capital needs, and infrastructure projects run billions over budget. The correction is reference class forecasting: look at the actual distribution of outcomes for comparable past projects rather than building from the specific case."
What is scope insensitivity and how does it affect insurance and charitable giving?,"Scope insensitivity describes the finding that people's willingness to pay does not scale proportionally with the magnitude of a problem. People will pay nearly as much to save 2,000 birds as 200,000 birds from an oil spill. In insurance, people are willing to pay nearly as much to insure a $1,000 item as a $10,000 item against loss. This causes systematic underinsurance of large, low-probability risks (catastrophic illness, disability) while overinsuring small, frequent losses. Scope insensitivity combined with availability bias creates a market for extended warranties on small electronics while people skip disability insurance that could protect millions in future earnings."
What is the isolation effect and how does it affect financial choices?,"The isolation effect, identified by Kahneman and Tversky, describes the tendency to simplify a choice between alternatives by focusing on the differences and ignoring common features. When people compare investment options, they tend to ignore shared characteristics and focus on what differentiates them, leading to choices that are inconsistent when the same options are presented differently. For example, a pension presented as 'choose between retiring at 62 with $2,000/month or 65 with $2,500/month' elicits different choices depending on what baseline is treated as the reference point. This inconsistency means the framing of choice architectures powerfully shapes financial decisions independent of underlying economic value."
What is attribute substitution and how does it affect investing?,"Attribute substitution occurs when people answer a hard question by unconsciously substituting an easier related question. When asked 'Is this a good investment?' the mind substitutes 'Does this feel like a good investment?' using emotional response instead of analytical evaluation. Kahneman describes this as System 1 (fast, intuitive) overriding System 2 (slow, analytical) thinking. Investors who rely on how excited or confident they feel about a stock are using attribute substitution—they are measuring their emotional response to the narrative rather than the actual risk-adjusted expected return. Structured checklists force System 2 engagement and prevent attribute substitution from driving decisions."
What is the affect heuristic in investing?,"The affect heuristic means that people use their emotional response to a stimulus as information when making judgments about risk and benefit. Research shows that if people are asked to rate an activity as beneficial, those who associate it with positive feelings rate it as low-risk and high-benefit simultaneously—even though risk and benefit are objectively unrelated. In investing, stocks that generate positive emotional associations (beloved brands, exciting technologies) are perceived as both high-return and low-risk, leading to overvaluation. Conversely, stocks associated with unsexy or socially undesirable businesses (waste management, cigarettes, debt collectors) are perceived as riskier and less rewarding, potentially creating undervaluation opportunities."
What is ambiguity aversion versus risk aversion in investing?,"Risk aversion refers to the preference for certain outcomes over uncertain ones with equal expected value. Ambiguity aversion (uncertainty aversion) goes further: people dislike situations where probabilities themselves are unknown even more than they dislike known risks of equal magnitude. The Ellsberg paradox demonstrates this clearly. In markets, ambiguity aversion causes investors to avoid unfamiliar assets, emerging markets, small companies, and complex instruments—not because the risk is higher, but because the probability distribution is harder to estimate. This systematic avoidance can create persistent underpricing of ambiguous assets as a premium for bearing uncertainty."
What is the Ellsberg paradox and what does it reveal about investor behavior?,"The Ellsberg paradox demonstrates ambiguity aversion through a simple experiment: people prefer to bet on drawing a red ball from an urn with known composition (50 red, 50 black) over an urn with unknown composition, even when both urns could be manipulated to disadvantage the bettor. Rational expected utility theory predicts indifference, but people systematically prefer known risk over unknown risk. In markets, this means investors apply a larger discount to assets with uncertain probability distributions—emerging market stocks, private companies, novel financial instruments—than pure risk calculations would justify. Ellsberg aversion provides a partial explanation for why illiquidity and information premiums exist in asset pricing."
What is probability weighting and how does it affect financial decisions?,"Prospect Theory's probability weighting function shows that people do not treat probabilities linearly. Small probabilities are overweighted (why lottery tickets and out-of-the-money options are overpriced relative to expected value), while moderate-to-high probabilities are underweighted. This creates predictable pricing anomalies: investors pay too much for long-shot investments with small but vivid chances of huge payoffs, and too little for high-probability moderate-return investments. Insurance companies and lottery operators profit from this distortion. The practical implication is that deeply out-of-the-money options and speculative growth stocks tend to be overpriced on an expected-return basis due to probability overweighting."
What is myopic loss aversion and why does it cause under-allocation to equities?,"Myopic loss aversion, developed by Thaler, Tversky, and Kahneman, combines two behavioral features: loss aversion (losses hurt more than equal gains) and myopia (evaluating portfolio performance too frequently). If investors check their portfolios daily, they encounter frequent small losses (stocks decline roughly half of all days) and the cumulative pain of those frequent losses drives them toward bonds and cash despite stocks' superior long-run returns. Research shows that investors who evaluate portfolios annually rather than daily hold significantly more equities, because annual evaluations show positive returns more frequently than daily evaluations. The solution is to deliberately reduce the frequency of portfolio monitoring."
What is the equity premium puzzle and can behavioral finance explain it?,"The equity premium puzzle, identified by Mehra and Prescott, is that stocks have historically outperformed bonds by 5-8% annually—far more than standard risk aversion models predict should be necessary to compensate investors. Traditional finance says this premium implies implausibly extreme risk aversion. Behavioral finance offers a compelling explanation through myopic loss aversion: investors who evaluate portfolios frequently experience the pain of frequent losses and demand a high premium to hold volatile equities. Additionally, loss aversion amplifies the perceived pain of equity drawdowns, causing investors to demand higher compensation than rational expected-utility models predict. This behavioral explanation is more consistent with observed human behavior than extreme structural risk aversion."
What is the January effect and how does behavioral finance explain calendar anomalies?,"The January effect is the historical tendency for small-cap stocks to outperform in January, particularly in the first few days. The traditional explanation is tax-loss selling in December (investors sell losers for tax deductions) followed by reinvestment in January, creating a seasonal demand pattern. Behavioral factors amplify this: year-end window dressing by fund managers (selling losers to clean up reported holdings) and the psychological fresh-start effect of the new year encouraging more active investing. While the January effect has weakened as it became well-known (arbitrage), calendar anomalies in general reflect systematic behavioral patterns around year-end, fiscal reporting cycles, and cultural calendar cues."
What is the small firm effect and the neglect hypothesis?,"The small firm effect is the historical tendency for small-cap stocks to earn higher risk-adjusted returns than large-cap stocks. The neglect hypothesis is a behavioral explanation: small companies receive little analyst coverage, are followed by few institutional investors, and are poorly understood by the market. Less information generates more ambiguity aversion, causing investors to demand a higher return for the uncertainty rather than just the fundamental risk. Additionally, small illiquid stocks are harder to arbitrage, so mispricing persists longer. The neglect premium may be a genuine behavioral anomaly or compensation for legitimate liquidity and information risk—likely both contribute."
What is the winner's curse in auctions and IPOs?,"The winner's curse occurs in common-value auctions: the bidder who wins is likely the most overoptimistic bidder, and the winning bid often exceeds the true value of the item. In IPOs, institutional investors who receive large allocations in hot deals are often getting shares that sophisticated investors passed on, while retail investors who eagerly buy oversubscribed IPOs end up holding overpriced securities. The winner's curse explains why IPOs on average underperform over the 3-5 years following listing—the investors most eager to buy were typically the most optimistic and overpaid. Rational bidders should shade their bids downward to account for the adverse selection implicit in winning."
What is the momentum anomaly and how does behavioral finance explain it?,"Momentum is the tendency for assets that have outperformed recently to continue outperforming, and underperformers to continue underperforming, over the following 3-12 months. Behavioral explanations center on underreaction: investors are slow to update beliefs as new information arrives (anchoring to prior views), so good news is gradually priced in over months rather than instantly. Herding amplifies momentum as fund managers buy recent winners to show clients they owned them. The disposition effect also contributes: investors sell winners too early, capping gains, while holding losers too long, delaying their decline. Together these create the predictable continuation of trends that momentum strategies exploit."
What is the value anomaly and how does behavioral finance explain it?,"The value anomaly is the persistent tendency for cheap stocks (low price-to-book, price-to-earnings, price-to-cash-flow) to outperform expensive growth stocks over long horizons. Behavioral explanations suggest investors extrapolate past growth too aggressively, paying excessive prices for stocks with strong recent earnings growth (representativeness heuristic) and discarding stocks with poor recent performance (recency bias, loss aversion). This creates a systematic overvaluation of glamour stocks and undervaluation of boring, out-of-favor stocks. The value premium is the return for being contrarian—buying what others have sold in disgust and waiting for sentiment to normalize."
What is post-earnings announcement drift and why does it happen?,"Post-earnings announcement drift (PEAD) is the finding that stocks continue to drift in the direction of an earnings surprise for weeks to months after the announcement—good earnings surprises keep rising, bad ones keep falling. This is a clear violation of the efficient market hypothesis, which predicts immediate full price adjustment. Behavioral explanations center on underreaction: investors anchor to prior earnings expectations, are slow to revise their fundamental models, and fail to immediately price in the full information content of the surprise. Institutional constraints (slow position changes, quarterly reporting cycles) and cognitive conservatism both contribute to the gradual price adjustment that creates tradeable drift."
What is the excess volatility puzzle explained behaviorally?,"Robert Shiller demonstrated that stock market prices are far more volatile than dividends, which should drive prices in a rational discounted cash flow model—stocks move too much relative to fundamental news. This excess volatility is difficult to explain with rational models but emerges naturally from behavioral factors: investor sentiment swings, overreaction to short-term news, narrative-driven price movements disconnected from fundamentals, and the amplification effects of leverage and momentum trading. Noise traders who trade on sentiment rather than fundamentals create price movements that persist long enough to be exploited but make markets more volatile than fundamentals warrant."
What is the flight to quality during financial crises explained behaviorally?,"Flight to quality describes the rapid shift from risky assets (stocks, high-yield bonds, emerging markets) to safe assets (Treasury bonds, gold, cash) during financial crises. Behaviorally, it combines availability bias (vivid recent losses make further losses seem highly probable), ambiguity aversion (uncertainty about the magnitude of the crisis), and herding (every institution moves simultaneously). The flight to quality is often rational given genuine uncertainty, but behavioral amplification makes the moves larger and faster than fundamentals justify, creating opportunities for investors who can maintain diversification or add risk during the peak of fear."
What is overreaction and underreaction in markets and how are they related?,"Overreaction (De Bondt and Thaler) refers to investors overweighting recent information, driving prices past fundamental values—followed by mean reversion. Underreaction (PEAD, momentum) refers to investors being slow to incorporate new information—followed by continuation. These seemingly contradictory patterns can both be true simultaneously because they operate at different time horizons. Overreaction to long-term past performance creates the value effect (long horizon mean reversion); underreaction to short-term news creates momentum (short horizon continuation). Barberis, Shleifer, and Vishny reconcile both patterns with a model of investor conservatism (slow updating) combined with representativeness (overextrapolation of sustained trends)."
What is noise trader risk and the De Long Shleifer model?,"De Long, Shleifer, Summers, and Waldmann's noise trader model shows that even if rational arbitrageurs recognize a mispricing, they may not be able to correct it due to noise trader risk—the risk that irrational sentiment drives prices further away from fundamentals before reverting. If noise traders continue buying an overvalued asset, a short seller faces margin calls before the price corrects. Noise trader risk makes arbitrage risky and short-horizon rational investors reluctant to bet against sentiment. The model explains why bubbles persist and why the most egregiously overvalued assets can continue rising for extended periods against the predictions of rational models."
What is limits to arbitrage and why can't smart money always correct mispricing?,"Limits to arbitrage refers to the practical constraints that prevent rational investors from fully eliminating mispricings. Key limits include: fundamental risk (the 'correct' price may be wrong), noise trader risk (sentiment worsens before it improves), synchronization risk (no single arbitrageur knows when enough others will act to correct the price), and capital constraints (losses on a mispriced short may require selling before the correction). Shleifer and Vishny's paper 'The Limits of Arbitrage' showed that arbitrage capital flees precisely when mispricing is most severe, because losses lead investors to withdraw capital from arbitrageurs at the worst moment. This explains why mispricings can persist far longer than rational models predict."
How does wealth change affect risk tolerance psychologically?,"Risk tolerance is not a stable personality trait—it changes systematically with wealth levels and recent experience. People become more risk-seeking after gains (house money effect) and more risk-averse after losses (loss aversion and fear of further declines). This creates pro-cyclical risk behavior: investors take more risk at market peaks when wealth is highest and sentiment most positive, and reduce risk at market troughs when wealth is lowest and sentiment most negative—the opposite of rational diversification behavior. Additionally, as absolute wealth increases, the marginal utility of additional wealth decreases, but behavioral research shows many wealthy individuals remain intensely focused on relative wealth (keeping up with peers) rather than absolute wellbeing."
What is financial wellbeing versus financial wealth?,"Financial wellbeing is a broader concept than financial wealth, encompassing the feeling of security, control, and freedom that financial resources provide rather than just the balance sheet. Research by the Consumer Financial Protection Bureau defines financial wellbeing as having current and ongoing financial security, the capacity to absorb financial shocks, the freedom to make choices that allow you to enjoy life, and confidence that you are on track financially. Critically, the correlation between financial wealth and financial wellbeing is imperfect: people with moderate incomes who feel in control of their finances report higher wellbeing than wealthier people with high financial anxiety. Financial literacy and behavioral interventions that reduce anxiety and increase perceived control improve wellbeing independently of wealth."
What is the psychology of retirement and the shift from accumulation to distribution?,"The transition from accumulating wealth to drawing it down in retirement represents one of the most psychologically difficult financial transitions. After decades of being rewarded for saving and growing the portfolio, retirees must reverse their behavior and spend the balance—which triggers loss aversion and scarcity thinking even for well-funded retirees. Research shows retirees systematically underspend relative to what their wealth and longevity would support, out of fear of running out of money. The 'sequence of returns risk' (poor early returns depleting the portfolio) is a real concern but is often over-weighted psychologically. Strategies that convert part of the portfolio to guaranteed income (annuities, pension) reduce financial anxiety by creating a floor income, allowing more confident spending from remaining assets."
What is the FIRE movement and its psychological dimensions?,"The Financial Independence Retire Early (FIRE) movement advocates extreme savings rates (50-70% of income) to accumulate enough to retire at a young age and live on portfolio withdrawals. Psychologically, FIRE practitioners often report high intrinsic motivation (autonomy, self-determination) for early retirement, but research suggests post-retirement identity crises are common for those who defined themselves by work. The extreme frugality required can create social isolation and anxiety around spending even after achieving the financial goal. Many FIRE practitioners discover they need a purposeful post-retirement structure—whether part-time work, creative projects, or community engagement—to replace the identity and social function that work provided."
What are commitment devices in financial planning and why do they work?,"Commitment devices are mechanisms that people use to restrict their future choices or behavior in ways consistent with their current, cooler-headed preferences. They leverage the insight that future selves often make worse decisions under stress or temptation. In finance, commitment devices include: automatic payroll deductions (money never reaches a spendable account), 401(k) early withdrawal penalties (making it costly to break the commitment), automatic savings account transfers on payday, and certificates of deposit with withdrawal penalties. They work because they remove the need for willpower at the moment of temptation—the commitment was made in advance when reasoning was clearer."
What are implementation intentions and how do they improve financial behavior?,"Implementation intentions, developed by psychologist Peter Gollwitzer, are specific 'if-then' plans that link anticipated situations to intended responses: 'If it is the 1st of the month, then I will transfer $500 to savings.' Unlike vague goals ('I will save more'), implementation intentions reduce the cognitive load required to act and bypass the psychological barriers that prevent goal-directed behavior. Studies show implementation intentions increase follow-through on financial behaviors by 2-3x compared to goals alone. Applied to investing, specific pre-commitments like 'if the market drops 10%, I will rebalance according to my IPS rather than selling' help investors maintain discipline during stressful market conditions."
What is choice architecture and how do nudges improve retirement savings?,"Choice architecture refers to the design of the environment in which people make choices, with the recognition that defaults, framing, and option presentation powerfully influence outcomes independent of economic incentives. Richard Thaler and Cass Sunstein's concept of 'nudges' uses choice architecture to steer people toward better outcomes without restricting freedom. The most powerful retirement savings nudge is automatic enrollment: making participation in the 401(k) the default rather than requiring active opt-in. Studies show automatic enrollment increases participation rates from 40-50% (opt-in) to 80-90% (opt-out), with minimal opt-out rates. The design of the default option matters enormously—a good default target-date fund outperforms the chaotic allocations naive investors construct on their own."
What is the Save More Tomorrow SMarT program?,"Save More Tomorrow (SMarT), developed by Thaler and Benartzi, is a behavioral savings escalation program that addresses the difficulty of immediately increasing savings by linking increases to future pay raises. Employees commit in advance to allocating a portion of each future salary increase to their retirement savings until a target rate is reached. This design exploits loss aversion (the increase is never felt as a current income reduction since it comes from a raise), present bias (the commitment is in the future so present-self agrees), and automatic escalation (no willpower required at each raise). Companies implementing SMarT saw average savings rates increase from 3.5% to 11.6% over 40 months—a more than tripling without requiring employees to feel any current pain."
What is default bias in 401k contribution rates?,"Default bias is the tendency for people to accept default options without changing them, even when changing would clearly benefit them. In 401(k) plans, whatever contribution rate is set as the default becomes a powerful anchor: employees who are automatically enrolled at 3% tend to stay at 3% even when evidence shows they should be saving 10-15%. Similarly, the default investment option receives the largest share of assets regardless of its quality. Understanding default bias has led to the redesign of 401(k) plans: higher default contribution rates (6% instead of 3%), auto-escalation built into defaults, and target-date funds as the default investment. Each of these changes harnesses default bias to improve outcomes rather than fighting human tendency."
