question,answer
How do hedge funds use derivatives?,"Hedge funds use derivatives extensively across strategies. Global macro funds use currency forwards, interest rate futures, and commodity futures to express large directional bets on economic trends. Long/short equity funds use put and call options to hedge market exposure, construct targeted sector tilts, and leverage directional bets. Merger arbitrage funds use options to manage the risk that a deal falls through. Volatility arbitrage funds trade options and volatility swaps, profiting from differences between implied and realized volatility. Credit hedge funds use CDS to take short or long positions on corporate creditworthiness. Convertible arbitrage funds delta-hedge convertible bonds using equity options or short stock. The common thread is using derivatives to achieve specific risk exposures that are difficult to construct with cash securities alone, or to access leverage without using traditional margin. Derivatives allow hedge funds to precisely calibrate their risk."
What is the CME Group and what role does it play?,"The CME Group (Chicago Mercantile Exchange Group) is the world's largest and most diverse derivatives exchange, operating CME, CBOT, NYMEX, and COMEX exchanges. It provides a marketplace for futures and options on interest rates (Treasuries, Eurodollar), equity indexes (S&P 500, Nasdaq, Dow), currencies, commodities (oil, gas, gold, silver, agricultural), and weather derivatives. CME Group operates the CME Clearing clearinghouse, which acts as the central counterparty for all CME-traded futures and options, guaranteeing performance and eliminating bilateral counterparty risk. CME Group sets contract specifications, margin requirements, position limits, and rules for delivery. It provides price discovery for global commodity and financial markets. The CME's S&P 500 futures (ES contract) are among the most traded financial instruments in the world, used by institutions globally for portfolio management."
What is the role of clearinghouses in derivatives?,"A clearinghouse (central counterparty, or CCP) interposes itself between the buyer and seller of a derivatives contract, becoming the buyer to every seller and the seller to every buyer. This eliminates bilateral counterparty risk — traders face the clearinghouse (which is highly capitalized and regulated) rather than an unknown counterparty. Clearinghouses require initial margin from all participants (protecting against potential future loss) and call variation margin daily (settling mark-to-market gains and losses). If a member firm defaults, the clearinghouse uses the defaulter's margin, default fund contributions from all members, and its own capital to absorb losses, preventing contagion. Post-2008 Dodd-Frank and EMIR regulations mandated central clearing for most standardized OTC derivatives, dramatically reducing systemic risk. Major clearinghouses include CME Clearing, LCH (London Clearing House), and ICE Clear."
What is initial margin in derivatives?,"Initial margin is the amount of collateral that a trader must deposit when opening a derivatives position, as a good-faith deposit against potential future losses. It is set by the clearinghouse or broker at a level designed to cover potential 1-day losses with high confidence (often 99%). For exchange-traded futures, initial margin is a small percentage of the contract's notional value (typically 2%–15% depending on volatility). For OTC cleared derivatives, ISDA's SIMM model calculates initial margin based on risk sensitivities. Initial margin is dynamic — it increases when volatility rises (during market stress, clearinghouses raise margin requirements, forcing traders to post more collateral or reduce positions). The need to post initial margin creates a liquidity demand: even profitable positions require ongoing collateral. Initial margin held at clearinghouses is invested in high-quality liquid assets and earns interest for the margin poster."
What is variation margin in derivatives?,"Variation margin is the daily settlement of gains and losses on a derivatives position — the actual mark-to-market profit or loss is transferred in cash between the winner and loser each day. If a futures contract moves against your position by $5,000 today, you must pay $5,000 in variation margin to the clearinghouse, which transfers it to the position holder on the other side. This daily settlement prevents the accumulation of large, uncollateralized losses — by the time expiration or exercise arrives, gains and losses have already been substantially settled. Variation margin ensures that all participants' accounts reflect current market values at all times, making default less catastrophic because losses are already realized incrementally. For OTC cleared swaps, variation margin is also exchanged daily. Bilateral (uncleared) swaps also require variation margin under post-crisis regulations."
What is mark-to-market in futures trading?,"Mark-to-market (MTM) is the daily revaluation of a futures position to the current market price, with gains or losses settled in cash the same day via variation margin. Unlike stocks (where paper gains or losses are unrealized until you sell), futures positions are settled daily — profits are credited to your account immediately, and losses are debited. This means futures holders never accumulate large unrealized losses without paying them in real time. The settlement price (typically the closing price or a volume-weighted average of the day's last trades) is used for daily MTM. MTM keeps futures accounts current and limits the clearinghouse's credit exposure to a single day's price movement (which is why initial margin is set to cover roughly one day's potential loss). MTM can create cash flow demands during adverse price moves that must be met even if the trader's underlying business hedge is profitable overall."
What is the difference between physical delivery and cash settlement in futures?,"At expiration, futures contracts settle by either physical delivery or cash settlement. Physical delivery means the short position holder actually delivers the underlying commodity (barrels of oil, bushels of wheat, bars of gold, Treasury bonds) to the long position holder at the contract price. Physical delivery is used for most commodity futures, ensuring the contract's price is anchored to the actual commodity market. Cash settlement means no physical asset changes hands — instead, the final profit or loss is settled in cash based on the difference between the futures price and a defined reference price (such as a stock index closing value). Stock index futures, VIX futures, and most interest rate futures are cash-settled. Most commodity futures traders close positions before delivery — only a small fraction result in actual physical delivery. Knowing the settlement mechanism is critical for futures traders approaching expiration."
What is a portfolio of options and how is combined risk analyzed?,"Analyzing a portfolio of options requires understanding the net Greeks — the combined delta, gamma, theta, and vega across all positions. Net delta tells you the overall directional exposure (positive delta means you profit if the underlying rises; negative delta means you profit if it falls). Net gamma tells you whether the portfolio is long or short convexity — long gamma means you benefit from large moves, short gamma means large moves hurt you. Net theta shows the daily time decay across the portfolio — positive theta portfolios earn from time passing (like an iron condor), negative theta portfolios lose from time passing. Net vega shows the volatility exposure — positive vega benefits from rising implied volatility, negative vega suffers. Sophisticated options traders run scenario analysis (P&L at different price levels and volatility levels) and stress tests to understand the full range of portfolio outcomes across different market conditions."
What is regulation and oversight of derivatives markets?,"Derivatives markets are regulated by a patchwork of national and international authorities. In the U.S., the CFTC (Commodity Futures Trading Commission) regulates futures markets, commodity options, and most OTC derivatives. The SEC regulates security-based swaps (those based on a single security or a narrow index). After 2008, the Dodd-Frank Act gave both agencies expanded authority. In Europe, EMIR (European Market Infrastructure Regulation) and MiFID II govern derivatives. Key regulatory requirements include: mandatory central clearing for eligible OTC derivatives, mandatory reporting to trade repositories, margin requirements for non-cleared derivatives, position limits to prevent manipulation, registration requirements for swap dealers and major swap participants, and real-time trade reporting for transparency. The Financial Stability Board (FSB) coordinates global derivatives reform, ensuring that regulatory gaps do not allow regulatory arbitrage across jurisdictions."
What is options assignment and how does it work?,"Options assignment is the process by which an options seller (writer) is obligated to fulfill the terms of the contract when the buyer exercises. For a short call, assignment means the seller must sell shares at the strike price to the exercising buyer. For a short put, assignment means the seller must buy shares at the strike price from the exercising buyer. Assignment can occur at any time before expiration for American-style options, though it typically only happens when an option is in-the-money. The OCC (Options Clearing Corporation) randomly assigns exercise notices to broker-dealers, who then randomly assign to customers with short positions. Sellers of options should always monitor positions for early exercise risk — especially around dividend dates (calls) or when interest rate advantages make early exercise rational for deep ITM puts. Unexpected assignment can create margin requirements or unwanted stock positions overnight."
How do speculators use options for leverage?,"Options offer speculators tremendous leverage because a small premium controls a large notional position. A call option on a $100 stock with a $5 premium gives exposure to 100 shares ($10,000 notional) for only $500 — 20:1 leverage. If the stock rises 10% to $110, the option may rise 100%–200% due to delta and gamma. This leverage magnifies both gains and losses. The speculator's maximum loss is limited to the premium paid — a defined-risk bet on direction. Strategies include: buying calls to bet on price increases, buying puts to bet on declines, buying straddles to bet on a large move in either direction (without predicting direction), and buying strangles (cheaper than straddles, requiring a larger move to profit). The key risks for speculators: time decay (theta erodes value daily), implied volatility crush after events like earnings (IV drops, reducing option value even if direction was correct)."
What is implied volatility crush after earnings?,"Implied volatility crush occurs when options prices fall sharply after a major known event — most commonly earnings announcements. Before earnings, traders buy options to speculate or hedge, pushing implied volatility (and option premiums) higher as demand rises. After the earnings are released — even if the stock moves significantly — the uncertainty that justified elevated premiums disappears and implied volatility collapses rapidly. This IV crush means that a speculator who bought a call or put before earnings hoping to profit from the move may actually lose money even if they correctly predicted the direction — the drop in IV deflates the option's value faster than the directional move inflates it. Experienced options traders account for earnings IV crush by trading spreads (buying and selling options simultaneously), which are less sensitive to overall IV level changes, or by selling options before earnings to capture the elevated premium."
What is the cost of carry in derivatives pricing?,"The cost of carry is the total cost of holding an asset over a period of time — including financing costs (interest), storage costs, and any income generated by the asset (dividends or convenience yield). In derivatives pricing, the cost of carry determines the relationship between spot prices and futures prices. For a financial asset, cost of carry = risk-free rate minus dividend yield. For commodities, cost of carry = risk-free rate plus storage costs minus convenience yield (the benefit of holding physical inventory). The futures price is approximately: Futures = Spot × e^(cost of carry × time). A positive cost of carry (financing costs exceed income) leads to contango (futures priced above spot). A negative cost of carry (income exceeds financing costs, or convenience yield is high) leads to backwardation (futures priced below spot). Understanding cost of carry is fundamental to futures pricing, arbitrage, and basis analysis."
What is delta hedging?,"Delta hedging is the practice of constructing a position that is insensitive to small price changes in the underlying asset by offsetting the delta of an options position with an opposing position in the underlying. For example, if an options trader is short a call with a delta of 0.50 on 10 contracts (representing 1,000 shares), the position has a total delta of -500 (the trader loses $500 for each $1 rise in the stock). To delta hedge, the trader buys 500 shares of the underlying, making the net portfolio delta approximately zero. As the stock price changes, delta changes (due to gamma), requiring continuous rebalancing — buying shares as the stock falls and selling as it rises. This creates a cost (the bid-ask spread and commissions on repeated trades). Market makers delta hedge their entire options inventory, converting directional risk into pure volatility risk. Delta hedging is imperfect (gamma risk remains) but eliminates first-order price risk."
What is the difference between hedging and speculation in derivatives?,"Hedging and speculation are the two primary uses of derivatives, but they have opposite motivations. Hedgers use derivatives to reduce or eliminate an existing risk they face in their business or portfolio. A farmer who will harvest wheat in three months sells wheat futures today to lock in the price — the derivative reduces exposure to price risk. The farmer is not trying to profit from the derivative itself; the derivative is protection against an adverse outcome. Speculators take on risk deliberately, hoping to profit from price movements. They have no underlying exposure — they are purely making directional or volatility bets. Speculators are essential to well-functioning derivatives markets: they provide the liquidity that allows hedgers to transact at reasonable prices. Without speculators willing to take the other side of a farmer's hedge, the hedger might not be able to find a counterparty. Markets need both participants."
What is the role of commodity price hedging for farmers vs government subsidies?,"Commodity price hedging and government farm subsidies are two different mechanisms for addressing agricultural price risk. Commodity futures and options allow individual farmers to lock in prices before harvest, protecting against a collapse in market prices. This market-based solution is efficient — only farmers who choose to hedge pay the cost (option premiums or basis risk). Government price support programs (subsidies, price floors, crop insurance programs) provide a safety net for all farmers regardless of hedging activity, funded by taxpayers. They address not just price risk but also catastrophic events like drought or flood. The debate centers on whether market-based hedging is sufficient and whether subsidies distort agricultural production decisions. In practice, most large commercial farms combine both — they use futures and options for operational price risk management and participate in government insurance programs for catastrophic tail risk."
What is the VIX futures market and its structure?,"VIX futures allow investors to directly take positions on the future level of the VIX (the CBOE Volatility Index). Unlike equity futures, you cannot replicate the VIX spot index with a portfolio of assets — VIX futures are priced based on expectations of future volatility rather than current VIX levels. VIX futures are almost always in contango — the longer-dated futures trade at a premium to the near-term VIX, because uncertainty about future volatility increases with time. This persistent contango creates a severe structural drag for products that hold long VIX futures (like VXX and UVXY ETNs), which consistently lose value over time through roll costs. Inverse VIX products (short volatility) benefit from this contango but face catastrophic risk in a volatility spike. VIX futures expiration occurs 30 days before the corresponding S&P 500 options expiration, which creates a specific calendar structure."
What are leveraged buyouts and how are interest rate derivatives used in them?,"Let's think through this. Step 1: In a leveraged buyout, a private equity firm acquires a company using mostly debt — typically 60%–80% borrowed capital. The acquired company takes on this debt and must service it from operating cash flows. Step 2: Most LBO financing uses floating-rate leveraged loans (based on SOFR plus a spread). These create interest rate risk — if rates rise, debt service costs increase and can threaten the company's ability to service its obligations. Step 3: To mitigate this, LBO companies (often required by lenders) use interest rate caps or swaps. A cap guarantees the floating rate never exceeds a ceiling. A fixed-rate swap converts the floating-rate loan into a predictable fixed cost. Step 4: These derivatives reduce earnings volatility and protect the company's debt service coverage ratio. Step 5: Therefore, interest rate derivatives are a core risk management tool in LBO capital structures, protecting the highly leveraged entity from rate shock."
What is the options expiration calendar and why does it matter?,"Options expire on specific dates, and understanding the expiration calendar is critical for position management. Standard monthly equity options expire on the third Friday of each month. Weekly options (weeklys) expire every Friday. Quarterly options expire at the end of each calendar quarter. Index options (like SPX) use AM settlement (based on Friday morning opening prices), while equity options use PM settlement (Friday closing prices). The period approaching monthly expiration — especially the final week — is often called 'options expiration week' or 'op-ex.' During this period, large institutional option positions are closed or rolled, which can create unusual price dynamics. 'Max pain' theory (the stock price where the most options expire worthless) is sometimes cited as a gravity point near expiration. The quadruple witching day (quarterly expiration of stock options, index options, stock futures, and index futures simultaneously) can create elevated volume and volatility."
What are the risks of selling naked options?,"Selling naked (uncovered) options — selling calls or puts without a hedging position in the underlying — offers the premium as income but exposes the seller to potentially unlimited losses. A naked call seller profits if the stock stays below the strike but faces unlimited loss if the stock rises sharply (there is no ceiling on how high a stock can go). A naked put seller profits if the stock stays above the strike but faces a loss up to the full strike price if the stock collapses to zero. Unlike covered calls (where shares back the short call) or cash-secured puts (where cash backs the short put), naked options require only margin, not the full collateral. This creates the risk of losses far exceeding the initial margin posted. Brokers require a high options approval level and substantial account size to sell naked options. Famous blowups from naked short calls include the 2021 meme stock events and numerous individual trader accounts wiped out in GameStop."
What is the gamma squeeze phenomenon?,"A gamma squeeze occurs when heavy call options buying forces market makers into aggressive stock purchases, accelerating the underlying stock's rise in a self-reinforcing feedback loop. When retail traders buy large quantities of out-of-the-money call options, market makers who sold those calls must delta hedge by buying the underlying stock. As the stock rises, the calls move closer to in-the-money, increasing their delta — meaning market makers must buy even more stock to maintain their hedge. This additional buying pushes the stock higher, which again increases delta, triggering more buying. This feedback loop can create explosive, rapid moves in a stock's price far beyond what fundamentals justify. The January 2021 GameStop short squeeze was amplified by a gamma squeeze — massive call buying by retail traders forced market makers and short sellers into frantic buying activity. Gamma squeezes are more powerful in stocks with high short interest and limited share float."
What is the role of options in merger arbitrage?,"Merger arbitrage is a strategy that buys the stock of a company being acquired after a deal is announced, profiting from the spread between the current stock price and the deal price. Options are used to enhance or hedge merger arbitrage positions. When a deal is pending, the target stock's implied volatility is elevated — option premiums are rich — because the key uncertainty is binary: the deal closes (stock goes to deal price) or breaks (stock falls to pre-announcement levels, often 20%–40% lower). Merger arb traders sometimes sell puts on the target to collect premium while also holding the stock. Buying put options hedges the catastrophic downside if the deal breaks. Analyzing options positioning in merger targets — particularly skew and put open interest — provides signals about the market's assessment of deal completion probability. The option-based 'deal break' hedge is essential risk management in professional merger arbitrage."
What is options open interest and what does it signal?,"Open interest in options is the total number of outstanding (not yet closed or expired) contracts at a given strike and expiration. It is a measure of market participation and commitment. High open interest at a specific strike indicates significant institutional or retail positioning at that level — which can act as a magnet for price (the 'max pain' concept) or as a support/resistance level as market makers delta hedge those positions. Rising open interest combined with rising price suggests new bullish positions opening. Rising open interest with falling price suggests new bearish positions. Falling open interest suggests existing positions are being closed. Options traders monitor unusual spikes in open interest at specific strikes (particularly in OTM options) as a signal of institutional positioning or informed speculation ahead of a major catalyst. The put/call ratio of open interest (more puts than calls) also serves as a sentiment indicator — elevated put open interest often signals hedging demand or bearish sentiment."
What is a straddle and when is it used?,"A straddle is an options strategy that simultaneously buys a call and a put at the same strike price and expiration date. The buyer profits if the underlying moves significantly in either direction — large upside or large downside both generate profit. The maximum loss is the total premium paid (both premiums combined), which occurs if the stock stays exactly at the strike price at expiration. The breakeven requires the stock to move enough (up or down) to cover the total premium cost. Straddles are used when a trader expects a large move but is uncertain about direction — typically before a major catalyst like earnings, an FDA drug decision, a court ruling, or an economic policy announcement. The risk is that implied volatility is typically highest just before such events — meaning premiums are expensive. If the move occurs but is smaller than the market expected (priced into the IV), the straddle can lose money despite a significant price move."
What is the difference between European and American options?,"European and American options differ in when they can be exercised. American options can be exercised at any time before expiration — any day the market is open. European options can only be exercised on the expiration date itself. Most exchange-listed equity options in the U.S. are American style. Most index options (SPX, RUT, VIX) are European style. The early exercise flexibility of American options makes them theoretically worth at least as much as otherwise identical European options, though in practice the difference is small — early exercise is rarely optimal except in specific circumstances (calls before ex-dividend dates, or deep in-the-money puts when interest rate benefits outweigh time value). European options are easier to price analytically (Black-Scholes applies directly) because there is no need to model the early exercise decision. American options require more complex models (binomial trees, finite difference methods) to price accurately."
