question,answer
What is the Black-Scholes model and what are its limitations?,"The Black-Scholes model, developed in 1973 by Fischer Black and Myron Scholes, is a mathematical formula for pricing European-style options. Inputs are: stock price, strike price, time to expiration, risk-free rate, and volatility. The model produces a theoretical option price and the Greeks. It won the Nobel Prize in Economics in 1997. Assumptions include: the stock follows a log-normal random walk, volatility is constant, no dividends, continuous trading, no transaction costs, and no early exercise. In practice, these assumptions are violated: volatility is not constant (it smiles and skews), stocks can jump discontinuously, and markets are not continuously liquid. The model systematically misprices deep OTM options and underestimates tail risk (fat tails). Despite its limitations, Black-Scholes remains the industry standard because it provides a common language for quoting options — implied volatility — and a framework that practitioners know how to adjust."
What happens at options expiration?,"At options expiration, several outcomes are possible depending on whether the option is in-the-money or out-of-the-money. Out-of-the-money options expire worthless — the buyer loses the entire premium paid, and the seller keeps the premium as profit. In-the-money options are typically exercised automatically by the broker if they are at least $0.01 in-the-money at expiration (OCC auto-exercise rule). For equity options with physical delivery, exercise means the call buyer receives shares (and pays the strike) or the put buyer delivers shares (and receives the strike). Cash-settled index options (like SPX) settle in cash for the difference between the settlement price and the strike. Option sellers face assignment risk on short in-the-money positions — they may wake up having bought or sold shares they didn't intend to hold. Managing positions before expiration avoids unwanted assignments."
What is early exercise of American options?,"American options can be exercised at any time before expiration, unlike European options which can only be exercised at expiration. Early exercise of a call is rarely optimal because holding the call preserves time value (the optionality) — it is generally better to sell the call than to exercise early and give up time value. The exception: early exercise of a call may be rational just before a large dividend payment, since the call holder doesn't receive the dividend but could capture it by exercising and owning shares. Early exercise of a put can be rational when the put is deep in-the-money and interest rates are high — the holder may prefer to receive the cash from selling shares now rather than waiting. The early exercise premium is why American options are technically worth more than identical European options, though in practice the difference is usually small."
What are synthetic positions using options?,"Synthetic positions use combinations of options and/or the underlying stock to replicate the payoff of another instrument. Common synthetics: a synthetic long stock (buy a call + sell a put at the same strike) mimics owning shares; a synthetic short stock (sell a call + buy a put) mimics being short. These allow replicating stock exposure without the capital required to own shares, using put-call parity. A synthetic long call (buy stock + buy put) creates the same payoff as a call option — this is effectively a protective put. A synthetic bond (long stock + short call) mimics fixed income. Synthetic positions are used when the direct instrument is unavailable, illiquid, or tax-inefficient. Market makers use synthetic relationships to hedge their books and identify arbitrage opportunities when market prices deviate from put-call parity."
What is a collar option strategy?,"A collar combines a protective put with a covered call to create a defined-risk, defined-return range. The investor owns shares, buys a put to establish a floor (protecting against large downside), and sells a call to generate premium that offsets the put's cost. The result is a position whose value is bounded: maximum loss is limited by the put floor, and maximum gain is capped by the call strike. Zero-cost collars are structured so the call premium exactly offsets the put premium — providing downside protection at no net cost but capping upside. Collars are widely used by executives and insiders who hold large concentrated stock positions and cannot immediately sell (due to lockup restrictions or tax considerations). They allow locking in a range of outcomes while deferring taxes. Collars are also used by portfolio managers to protect gains before an uncertain earnings announcement or market event."
What is the role of market makers in options markets?,"Market makers are professional trading firms or bank dealers that continuously provide two-sided quotes (bid and ask) for options contracts, ensuring liquidity. They stand ready to buy or sell options even when no natural counterparty exists, earning the bid-ask spread as compensation for this service. Market makers immediately hedge their resulting positions (primarily through delta hedging — buying or selling the underlying stock to offset the directional risk), focusing on capturing volatility premiums rather than directional bets. Their continuous hedging activity in the underlying market creates a feedback loop: when volatility rises and they are net short gamma, they must buy the underlying as it rises and sell as it falls — amplifying moves (this is called 'negative gamma hedging'). In 2021, the meme stock phenomenon was partly driven by the market maker dynamic: massive short gamma positions in GameStop forced continuous buying as the stock rose."
What is open interest vs volume in options?,"Volume is the number of options contracts traded during a single day — it resets to zero at the start of each trading session. Open interest is the total number of active (outstanding, not yet closed) contracts at any given time — it accumulates over time as new positions are opened and decreases when positions are closed. Rising open interest with rising volume suggests new money entering a trend (confirming the move). High volume with flat or declining open interest may indicate rolling (closing old positions and opening new ones without a significant change in overall conviction). Options traders analyze open interest at specific strikes for clues about where large institutional positions are concentrated, identifying potential support/resistance levels (called 'max pain' — the strike where the most options expire worthless, maximizing losses for option buyers)."
How do you read an options chain?,"An options chain is a table displaying all available options contracts for a given underlying asset, organized by expiration date and strike price. Calls are typically on the left side and puts on the right. For each strike, the chain shows: the bid price (what buyers will pay), the ask price (what sellers want), the last traded price, volume (contracts traded today), open interest (total active contracts), implied volatility (IV), and the Greeks (delta, gamma, theta, vega). Reading the chain: select the expiration date of interest, find the strike nearest to the current stock price (at-the-money), and scan up for higher strikes (out-of-the-money calls) and down for lower strikes (in-the-money calls). Wide bid-ask spreads indicate low liquidity — trading at midpoint is often difficult. High open interest at a specific strike signals significant institutional positioning."
What do in-the-money, at-the-money, and out-of-the-money mean?,"These terms describe the relationship between an option's strike price and the current market price of the underlying asset. In-the-money (ITM): a call is ITM when the stock price is above the strike price (has intrinsic value); a put is ITM when the stock is below the strike. At-the-money (ATM): the strike price equals or is very close to the current stock price; ATM options have the highest time value and gamma. Out-of-the-money (OTM): a call is OTM when the stock is below the strike; a put is OTM when the stock is above the strike. OTM options have no intrinsic value — only time value. Deep ITM options behave most like the underlying stock; deep OTM options are cheap lottery tickets. Option liquidity and bid-ask spreads are typically best for ATM and near-ATM options."
What are exotic options?,"Exotic options are non-standard option contracts with more complex payoff structures than plain vanilla puts and calls. Types include: barrier options (activate or extinguish if the underlying reaches a certain price level — knock-in or knock-out), Asian options (the payoff depends on the average price of the underlying over a period rather than just the final price — used to hedge average commodity exposure), lookback options (the payoff is based on the maximum or minimum price reached during the contract life), binary (digital) options (pay a fixed cash amount or nothing if the underlying is above/below the strike at expiration), and rainbow options (depend on multiple underlyings). Exotic options are OTC instruments primarily used by corporations, banks, and sophisticated hedge funds to precisely match specific hedging needs that standard options cannot meet. They are not available on standard exchanges."
What are structured products using derivatives?,"Structured products are pre-packaged investments that combine traditional securities (bonds, notes) with derivatives to create customized risk-return profiles for investors. Examples: principal-protected notes (zero-coupon bond + call option, guaranteeing return of principal plus market upside); reverse convertibles (high coupon notes where the investor bears the downside if the stock falls — they receive stock instead of full principal); autocallable notes (automatically redeem early if the underlying rises above a trigger level, returning principal plus a fixed return); and capital-protected products tied to a basket of assets. Investment banks manufacture structured products for retail and institutional investors. Risks: the guarantee depends on the issuer's creditworthiness, products are typically illiquid during the holding period, complexity obscures true costs, and upside participation is often limited or capped."
What is the role of derivatives in leveraged buyouts?,"In leveraged buyouts (LBOs), private equity firms use derivatives primarily for interest rate risk management. Because LBOs are financed with large amounts of floating-rate debt (typically based on SOFR), companies are exposed to rising interest rates that increase their debt service burden. Interest rate caps and swaps are used to manage this risk. An interest rate cap guarantees that the company's floating rate borrowing cost never exceeds a set ceiling, providing protection against rate spikes. Lenders often require interest rate hedges as a condition of LBO financing. Currency derivatives are used in cross-border LBOs to hedge transaction and operating currency risk. Derivatives in LBOs are tools for risk management rather than speculation — they protect the highly leveraged structure's solvency during periods of rate or currency volatility."
What is the Dodd-Frank Act's impact on derivatives regulation?,"The Dodd-Frank Wall Street Reform and Consumer Protection Act of 2010 fundamentally reformed derivatives regulation in response to the 2008 financial crisis. Key provisions: mandatory central clearing for most standardized OTC derivatives (swaps), requiring them to be cleared through regulated clearinghouses rather than bilaterally — reducing counterparty risk; mandatory reporting to swap data repositories for transparency; mandatory exchange or SEF (Swap Execution Facility) trading for cleared swaps — improving price transparency; higher capital and margin requirements for non-centrally cleared derivatives; and the Volcker Rule, limiting banks' proprietary trading in derivatives. The reforms significantly reduced systemic risk by eliminating the web of bilateral counterparty exposures that amplified the 2008 crisis. Cross-border application of Dodd-Frank (with Europe's EMIR framework) created regulatory coordination challenges but ultimately moved most derivatives toward central clearing."
What is counterparty risk in derivatives?,"Counterparty risk (also called credit risk or default risk) is the risk that the other party in a derivatives contract fails to fulfill its contractual obligations — potentially because of bankruptcy or financial distress. Before 2008, most OTC derivatives were bilateral contracts — if one party failed, the other bore the full loss. AIG's failure to pay CDS obligations was a prime example of counterparty risk crystallizing. Post-2008 reforms address counterparty risk through: central clearing (a clearinghouse steps between both parties, guaranteeing performance if one side defaults), initial margin (collateral posted upfront), variation margin (daily settlement of mark-to-market gains and losses), and bilateral margin requirements for non-cleared swaps. Even with these protections, residual counterparty risk exists in exotic, non-cleared derivatives. Ratings and financial strength of derivatives counterparties remain important considerations."
How do banks use derivatives for risk management?,"Banks are among the largest users of derivatives for managing risks inherent in their core businesses. Interest rate swaps hedge the duration mismatch between long-term fixed-rate assets (mortgages) and short-term floating-rate liabilities (deposits). Credit default swaps allow banks to hedge credit exposure to corporate clients without selling loans and damaging client relationships. Currency forwards and swaps hedge foreign exchange exposure from international operations and cross-border lending. Options are used to hedge embedded optionality in banking products (mortgage prepayment options, loan prepayment, deposit optionality). Banks also use derivatives for client facilitation — making markets in derivatives requested by corporate clients and hedging the resulting inventory risk. Banks' derivatives books are the largest in the world (JPMorgan alone has over $50 trillion in notional derivatives exposure), managed by large global markets teams with sophisticated risk systems."
What are mortgage-backed securities and how are they derivative-like?,"Mortgage-backed securities (MBS) are bonds created by pooling thousands of individual home loans and issuing securities backed by the cash flows from those mortgages. While technically a securitized bond, MBS have derivative-like characteristics due to the prepayment option embedded in most U.S. mortgages. When interest rates fall, homeowners refinance and prepay their mortgages early — returning principal to MBS investors faster than expected when reinvestment rates are lowest. When rates rise, prepayments slow and the MBS extends in duration precisely when investors want shorter duration. This optionality makes MBS valuation complex. Options-adjusted spread (OAS) analysis is used to strip out the prepayment option. Agency MBS (guaranteed by Fannie Mae, Freddie Mac, Ginnie Mae) are among the most liquid bond markets. Non-agency MBS (without government backing) carry credit risk, as seen in 2008."
What are collateralized debt obligations (CDOs)?,"A CDO (Collateralized Debt Obligation) is a structured finance instrument that pools various debt instruments (mortgages, corporate bonds, loans) and divides the cash flows into tranches with different risk and return profiles. Senior tranches get paid first (lowest yield, highest rating); mezzanine tranches bear intermediate risk; equity tranches absorb losses first (highest yield, lowest rating). CDOs allow banks to repackage and sell credit risk off their balance sheets, freeing up capital to make more loans. In the years before 2008, CDOs were filled with subprime mortgage-backed securities — often with inflated credit ratings from rating agencies that misunderstood the correlation risk. When housing prices fell, CDO losses cascaded through the financial system, triggering the 2008 financial crisis. Synthetic CDOs used CDS rather than actual bonds, allowing virtually unlimited leverage in exposure to the housing market."
Why did Warren Buffett call derivatives 'weapons of financial destruction'?,"In Berkshire Hathaway's 2002 annual letter, Warren Buffett called derivatives 'financial weapons of mass destruction, carrying dangers that, while now latent, are potentially lethal.' His concerns: derivatives create chains of counterparty risk that are invisible until a crisis triggers simultaneous failures; notional values are enormous compared to actual capital in the system; complexity and opacity make systemic risk impossible to fully quantify; derivative contracts can survive regulatory scrutiny while hiding leverage; and 'mark-to-model' valuations (when no market exists) can obscure losses for years. Buffett's prediction proved accurate in 2008, when interconnected AIG CDS positions, CDOs, and OTC derivatives nearly collapsed the global financial system. Ironically, Berkshire Hathaway itself uses derivatives extensively — equity put options, credit derivatives — when Buffett believes they are mispriced in Berkshire's favor."
How do businesses hedge commodity price risk with derivatives?,"Businesses with significant commodity exposure — food manufacturers, airlines, utilities, mining companies — use derivatives to stabilize input costs or revenue. A food manufacturer facing wheat price risk can buy wheat futures, locking in today's price for future purchases. If wheat rises, the futures gain offsets higher procurement costs. If wheat falls, the futures loss is offset by lower actual procurement costs. The hedge converts uncertain commodity prices into predictable, budgetable costs. Businesses choose between futures (standardized, exchange-traded, requires margin management), forwards (customized OTC, no margin but counterparty risk), options (pay a premium for protection but retain upside if prices fall), and swaps (periodic settlement of floating vs. fixed commodity prices). Effective hedging requires matching the notional amount, timing, and specific commodity to the actual business exposure — poorly designed hedges can create as much risk as they eliminate."
How do airlines use fuel hedging?,"Airlines are among the most active commodity hedgers because jet fuel accounts for 20%–30% of operating costs and fuel price volatility directly impacts profitability. Southwest Airlines became famous for its aggressive fuel hedging program in the 2000s — by locking in oil prices below $30/barrel, it saved hundreds of millions while competitors paid market prices of $80–$150/barrel during the 2003–2008 oil spike. Airlines typically hedge using crude oil or jet fuel futures and swaps, purchasing call options to cap fuel costs while retaining some benefit if prices fall. The hedge ratio (what percentage of projected fuel consumption to hedge and how far forward) is a strategic decision. Hedging too aggressively can create massive liabilities if oil prices fall sharply (as happened to Southwest in 2008–2009). Airlines balance fuel cost certainty against the cost and risk of the hedge itself."
What are weather derivatives?,"Weather derivatives are financial instruments whose payoff depends on weather outcomes — temperature, precipitation, snowfall, wind speed — rather than financial asset prices. They allow businesses with revenues or costs that depend on weather to hedge that risk. Utilities hedge the risk of a warm winter (lower heating demand) with temperature-based derivatives. Ski resorts hedge the risk of low snowfall. Energy companies manage the risk of unusually mild weather reducing electricity demand. The underlying is typically a temperature index (like HDD — Heating Degree Days, or CDD — Cooling Degree Days) accumulated over a period. Weather derivatives are pure insurance instruments — there is no speculative intrinsic value, only risk transfer. They are traded OTC and at the CME. They are distinct from traditional insurance because they pay based on objective index measurements, not actual measured losses."
What are catastrophe bonds (cat bonds)?,"Catastrophe bonds are high-yield debt instruments issued by insurance companies and reinsurers to transfer tail-risk (catastrophic loss) to capital markets. Investors receive high coupon payments; in exchange, if a defined catastrophic event occurs (hurricane exceeding a specified intensity, earthquake above a magnitude threshold, etc.), the principal is forfeited or reduced to pay insurance claims. Cat bonds allow insurers to access the capital markets for catastrophic risk that would overwhelm traditional reinsurance capacity. Investors are attracted by high yields (typically 5%–15% above Treasuries) and low correlation with financial market risk — a hurricane doesn't care about stock market conditions. The trigger may be based on actual losses (indemnity), industry loss indexes, or parametric measures (wind speed, earthquake intensity). Cat bonds have grown into a multi-hundred-billion-dollar market used by major (re)insurers globally."
What are credit spread options?,"A credit spread option is a derivative whose payoff depends on the change in credit spread — the difference in yield between a corporate or sovereign bond and a risk-free benchmark. A credit spread call profits if the spread narrows (credit quality improves); a credit spread put profits if the spread widens (credit quality deteriorates). They are used by bond portfolio managers to hedge credit spread risk on specific positions or portfolios, and by hedge funds to take directional positions on credit quality without buying or selling bonds. Credit spread options are OTC instruments and are most common in the institutional market for investment-grade and high-yield corporate debt. They allow more precise credit risk management than CDS because they can target specific spread levels with an options payoff profile rather than a linear exposure."
What are interest rate caps and floors?,"An interest rate cap is a series of call options (caplets) that protect a floating-rate borrower from interest rates rising above a specified ceiling rate. If rates exceed the cap rate in any period, the cap seller pays the borrower the difference — effectively capping the borrowing cost. An interest rate floor is the mirror image: a series of put options that guarantee a minimum return to a floating-rate investor. If rates fall below the floor rate, the floor seller pays the investor the shortfall. Corporations with floating-rate debt buy caps to limit their maximum interest cost. Banks and fixed-income investors buy floors to protect income if rates fall. A collar combines a cap and a floor — buying a cap and selling a floor at a lower rate creates a range of possible borrowing costs, with the floor premium offsetting cap cost. Caps and floors are OTC instruments and are ubiquitous in corporate finance."
What is a swaption?,"A swaption (swap option) is an option that gives the buyer the right, but not the obligation, to enter into an interest rate swap at a predetermined rate on or before a specified date. A payer swaption gives the right to pay fixed and receive floating (used by borrowers who want the option to lock in a fixed rate). A receiver swaption gives the right to receive fixed and pay floating (used by investors who want to lock in a fixed receipt rate). Swaptions are used by corporations planning future bond issuance (locking in a maximum financing cost), mortgage servicers managing prepayment risk, and institutions restructuring swap portfolios. Swaptions are OTC derivatives, typically traded between banks and large institutional clients. They combine the complexity of swap valuation with options pricing, requiring sophisticated models like Hull-White or LIBOR Market Model for accurate pricing."
What is a quanto option?,"A quanto option is an exotic option that settles in a different currency than the underlying asset, with the exchange rate fixed at inception. For example, a quanto call on the Nikkei index settles in U.S. dollars at a fixed yen/dollar rate — the investor gains exposure to Japanese equity performance without any currency risk. Quanto options are used by international investors who want pure foreign market exposure without currency overlay complexity, or who want to bet on foreign equity market direction without taking a view on the exchange rate. The pricing is complex because the option writer must hedge both the equity risk and the embedded currency risk. Quanto options are OTC instruments used primarily by institutional investors, derivatives desks, and structured product manufacturers. They are common in equity-linked notes marketed to investors in different currency zones."
