question,answer
"What is transition finance and how does it support high-emitting industries moving toward net zero?","Transition finance explained: Step 1: Transition finance provides capital to carbon-intensive industries — steel, cement, shipping, aviation, heavy chemicals — to fund their decarbonization journey toward net zero, recognizing that simply excluding these sectors from sustainable finance could strand critical infrastructure and workers without enabling actual emissions reductions. Step 2: The core debate: pure green finance only funds already-clean activities (solar panels, EVs). But 80% of emissions come from hard-to-abate sectors that cannot decarbonize overnight. Transition finance bridges this gap by funding the intermediate steps: coal-to-gas switching, energy efficiency upgrades, hydrogen adoption, carbon capture, electrification of industrial heat. Step 3: Instruments: transition bonds (use of proceeds for decarbonization capex), sustainability-linked bonds with emissions-reduction targets, green loans for transitional activities, and blended finance structures that de-risk early-stage low-carbon technology adoption. Step 4: Risk of greenwashing: labeling a coal company's operations as 'transition' without credible, Paris-aligned emissions reduction targets and independent verification is greenwashing. The Climate Bonds Initiative has developed transition finance criteria requiring science-based trajectories. Step 5: G20 Sustainable Finance Working Group has developed a transition finance framework to standardize definitions and prevent greenwashing. Japan and Singapore have been most active in developing national transition finance taxonomies. Therefore, transition finance is essential for achieving global climate goals — the hardest-to-abate sectors require capital and credible decarbonization roadmaps, not financial exclusion that merely moves the problem off investors' balance sheets."
"How is ESG integrated into private equity and what are the unique challenges?","ESG in private equity: Step 1: ESG integration in private equity (PE) is distinctly powerful because PE firms are active controlling owners — they can directly implement ESG improvements at portfolio companies rather than merely screening or voting at public companies. This 'hands-on' ownership model enables genuine ESG impact. Step 2: ESG in the deal cycle: (1) Screening: PE funds screen acquisition targets using ESG criteria, excluding sectors that violate their mandate (tobacco, weapons) and assessing ESG risks that could impair valuation. (2) Due diligence: dedicated ESG due diligence alongside financial, commercial, and legal DD — identifying environmental liabilities, labor practices, governance gaps, and regulatory risks. (3) Value creation: post-acquisition, PE firms set ESG KPIs (carbon emissions targets, diversity goals, safety metrics) and monitor progress through the hold period. (4) Exit preparation: strong ESG profiles command premium valuations at exit from ESG-mandate buyers. Step 3: Reporting standards: the Invest Europe ESG Disclosure Framework and ESG Data Convergence Initiative (EDCI — backed by 380+ PE firms managing $28T) have standardized which ESG metrics PE firms report: emissions intensity, renewable energy use, board diversity, net new hires, injury rate, and NFRD alignment. Step 4: Challenges unique to PE: (a) Private companies don't disclose ESG data publicly, making benchmarking difficult. (b) Data collection requires manual portfolio company questionnaires. (c) ESG materiality differs widely across a diversified portfolio spanning multiple industries. Step 5: ESG in fund selection: institutional LP investors (pension funds, sovereign wealth funds) now require PE managers to demonstrate ESG integration capability as a condition of commitment — ESG questionnaires and DDQs are mandatory in most LP due diligence processes. Therefore, PE's active ownership model makes it one of the most powerful channels for ESG value creation, but the private nature of portfolio companies requires bespoke data collection and monitoring frameworks absent in public markets."
"What is supply chain ESG and why is it important for investors?","Supply chain ESG explained: Step 1: Supply chain ESG refers to the environmental, social, and governance risks and practices embedded in a company's extended supply chain — the raw material suppliers, manufacturers, logistics providers, and subcontractors that ultimately produce goods before they reach a company's own operations. Step 2: Why supply chains matter for ESG: most of a consumer goods or apparel company's environmental and social impact sits in its supply chain (Scope 3 emissions, labor conditions, deforestation), not in its own operations. Apple's direct emissions (Scope 1+2) are tiny; its supply chain (Scope 3) represents 70%+ of its total footprint. Step 3: Key supply chain ESG risks: (a) Labor: child labor, forced labor, unsafe working conditions in factories — especially in emerging market Tier 2 and Tier 3 suppliers. The Rana Plaza factory collapse (2013, 1,134 killed) exposed catastrophic supply chain labor failures. (b) Environmental: deforestation linked to soy, palm oil, beef, and timber supply chains; toxic chemical discharge by Tier 2 chemical suppliers; water stress in textile dyeing. (c) Governance: corruption and bribery in raw material sourcing (conflict minerals in Congo). Step 4: Regulatory response: Germany's Supply Chain Act (2023) requires companies to conduct human rights due diligence throughout their supply chains; EU Corporate Sustainability Due Diligence Directive (CSDDD) extends this across Europe. Step 5: Investor tools: supply chain mapping software (Sourcemap, EcoVadis), satellite monitoring of deforestation linked to suppliers, blockchain-based supply chain transparency. Therefore, investors must look beyond a company's own ESG disclosures to evaluate whether the supply chain introduces material risks — reputational, regulatory, and operational — that can rapidly destroy enterprise value."
"What is ESG litigation risk and how is it affecting corporate and investor behavior?","ESG litigation risk explained: Step 1: ESG litigation risk refers to legal actions targeting companies, financial institutions, and even asset managers for failures in environmental stewardship, social responsibility, or governance — including climate-related lawsuits, greenwashing enforcement, and human rights litigation. Step 2: Climate litigation: over 2,500 climate-related legal cases have been filed globally. Key cases: Milieudefensie v. Shell (Netherlands, 2021) — a court ordered Shell to reduce its global emissions 45% by 2030 relative to 2019 levels, citing Shell's liability for its full value chain emissions. This was the first ruling holding a private company directly responsible for its carbon footprint. Step 3: Greenwashing enforcement: regulators (SEC, FCA, BaFin) are actively pursuing enforcement actions against funds and companies making misleading ESG claims. DWS, Deutsche Bank's asset management arm, was raided by police and paid significant fines after a whistleblower alleged its sustainable funds held far fewer ESG-compliant assets than marketed. Step 4: Fiduciary duty litigation: U.S. state attorneys general have sued pension funds for prioritizing ESG considerations (alleging breach of fiduciary duty to beneficiaries); simultaneously, ESG advocates have filed opposite suits arguing that ignoring climate risk is itself a fiduciary breach. Step 5: D&O and insurance implications: directors and officers face personal liability for climate and ESG misstatements; D&O insurance premiums are rising for companies with high climate exposure or aggressive ESG marketing claims. Therefore, ESG litigation is transitioning from a theoretical risk to an active enforcement and legal liability landscape — requiring companies and investors to ensure ESG claims are substantiated, documented, and genuinely integrated into business strategy."
"What are nature-based solutions (NbS) and how are they financed?","Nature-based solutions in finance: Step 1: Nature-based solutions (NbS) are actions that protect, sustainably manage, or restore natural ecosystems to address climate change, biodiversity loss, water security, and human well-being — simultaneously delivering multiple environmental and social benefits. Examples include reforestation, mangrove restoration, peatland conservation, regenerative agriculture, and urban green infrastructure. Step 2: The financial case: NbS projects can generate carbon credits (verified by Verra's VCS or Gold Standard) that companies purchase to offset emissions. High-quality forest protection projects (REDD+) can generate credits at $10-30/tonne; newer 'blue carbon' (mangrove, seagrass, tidal marsh) projects generate premium credits at $30-60/tonne due to their co-benefits. Step 3: Financing structures: (a) Carbon credit revenue: the primary revenue model for NbS projects. (b) Blended finance: development finance institutions (IFC, ADB) provide concessional capital to de-risk private investment in NbS projects in developing countries. (c) Green bonds with NbS use-of-proceeds: governments (Ecuador, Peru) have issued sovereign green bonds funding nature conservation. Step 4: Quality challenges: NbS carbon credits have faced intense scrutiny. Investigations in 2023 found that many REDD+ (Reducing Emissions from Deforestation and forest Degradation) credits significantly overstated their climate impact due to flawed baseline calculations — the deforestation they claimed to prevent was never likely to occur. Step 5: The Integrity Council for the Voluntary Carbon Market (ICVCM) developed Core Carbon Principles (2023) to set quality standards for carbon credits, addressing additionality, permanence, and monitoring of NbS projects. Therefore, nature-based solutions offer genuine climate and biodiversity benefits but require rigorous verification standards to ensure that credits represent real, additional, and permanent emissions reductions — not accounting fictions."
"What is blended finance and how does it mobilize private capital for sustainable development?","Blended finance explained: Step 1: Blended finance is the strategic use of development finance (public and philanthropic capital) to mobilize additional private sector investment in developing countries — using concessional capital to de-risk projects that private investors would otherwise find too risky or insufficiently profitable. Step 2: The problem it solves: developing countries need $3-5 trillion per year in sustainable development investment but governments and aid budgets can only provide $200-300B. The SDG financing gap can only be bridged by mobilizing private capital. But private investors require risk-adjusted returns and often perceive emerging market projects as too risky. Step 3: How it works: development finance institutions (DFIs) like the IFC, ADB, or USAID provide first-loss capital, guarantees, or subsidized debt that absorbs initial losses or credit risk — making the residual risk acceptable to commercial investors who then participate. A typical structure: DFI provides 20% first-loss equity; commercial investors provide 80% at normal returns. Step 4: Examples: Green Climate Fund (GCF) blended finance facilities, OPIC/DFC guarantees for renewable energy projects in Africa, debt-for-nature swaps (Belize, Ecuador) where DFIs buy distressed sovereign debt and restructure it with conservation commitments. Step 5: Track record: Convergence (the global network for blended finance) reports that each dollar of concessional capital mobilizes $4-5 of additional private capital on average, making blended finance one of the most capital-efficient tools for SDG financing. Therefore, blended finance is the critical bridge between development goals and private capital markets — its effectiveness depends on structuring concessional support at the minimum amount needed to tip the investment case without subsidizing returns private investors would have earned anyway."
"How is ESG applied to fixed income investing and what are the specific challenges?","ESG in fixed income: Step 1: ESG integration in fixed income (bonds) differs fundamentally from equities because bondholders are creditors, not owners — they lack shareholder voting rights and can only influence issuers through engagement, credit decisions, and green/social bond frameworks. Step 2: ESG's credit relevance: strong ESG profiles reduce credit risk in measurable ways. Companies with poor environmental practices face litigation, regulatory fines, and stranded assets. Poor governance is correlated with accounting fraud and mismanagement. Social failures (labor disputes, safety violations) create operational disruptions and reputational damage — all increasing probability of default and credit spread widening. Step 3: ESG bond market: (a) Green bonds: proceeds fund environmental projects. (b) Social bonds: proceeds fund social projects. (c) Sustainability bonds: mixed green and social use-of-proceeds. (d) Sustainability-linked bonds (SLBs): coupon steps up if ESG KPIs are missed — proceeds can be used for any purpose. Combined, these labeled bonds exceeded $1 trillion in annual issuance by 2021. Step 4: Sovereign ESG: fixed income investors apply ESG to government bonds by scoring countries on environmental policy (carbon pricing, renewable energy targets), social factors (human rights, inequality, labor standards), and governance (rule of law, corruption, democratic institutions). Higher ESG-scoring sovereigns tend to have better credit ratings and lower bond yields. Step 5: Challenges: ESG engagement is harder without voting rights — bondholders rely on covenants and refinancing leverage. Corporate ESG data is more developed than sovereign ESG data. Green bond 'additionality' (whether the green label actually changes the issuer's behavior) remains debated. Therefore, ESG fixed income investing requires adapting equity-centric ESG tools to the creditor relationship — focusing on ESG factors material to creditworthiness and using bond market access as the primary leverage for ESG engagement."
"What is the overlap between Islamic finance and ESG investing?","Islamic finance and ESG overlap: Step 1: Islamic finance operates under Shariah law principles that prohibit interest (riba), excessive uncertainty (gharar), gambling (maysir), and investment in prohibited industries (alcohol, tobacco, pork, conventional weapons, pornography). These restrictions create natural overlap with ESG screening criteria. Step 2: Key parallels: (a) Ethical screening — both Islamic finance and ESG exclude harmful industries. Shariah-compliant screens (no alcohol, no tobacco) overlap significantly with ESG negative screens. (b) Social justice — Islamic finance's prohibition on excessive profiteering and emphasis on wealth sharing aligns with the 'S' in ESG. (c) Sustainability — Islamic principles of khalifah (stewardship of the earth) and avoiding israf (waste) align with environmental responsibility. Step 3: Green sukuk: sukuk are Shariah-compliant bonds (structured as asset-backed instruments rather than interest-bearing debt). Green sukuk finance environmental projects under both Shariah and ICMA Green Bond Principles. Malaysia (2017) issued the world's first sovereign green sukuk; the global green sukuk market now exceeds $15B. Step 4: Governance differences: while both frameworks emphasize ethical behavior, Islamic finance's governance principles focus on Shariah supervisory boards ensuring compliance — a distinct additional governance layer beyond conventional ESG governance standards. Step 5: Market opportunity: $3.5 trillion+ in Islamic finance assets are held predominantly in GCC countries, Malaysia, and Indonesia — regions with significant green infrastructure investment needs. Combining Islamic finance and ESG principles opens large capital pools to sustainable development. Therefore, Islamic finance and ESG investing are natural partners — their shared ethical foundations enable hybrid instruments (green sukuk, ESG-screened Shariah funds) that mobilize Islamic capital markets for sustainable development goals."
"What is the Carbon Border Adjustment Mechanism (CBAM) and how does it affect investors?","Carbon Border Adjustment Mechanism explained: Step 1: The EU's Carbon Border Adjustment Mechanism (CBAM), phasing in from 2023-2026, imposes a carbon price on imports of carbon-intensive goods entering the EU — ensuring that EU importers pay the same carbon cost as EU domestic producers covered by the EU Emissions Trading System (EU ETS). Step 2: Which goods are covered: initially, CBAM applies to cement, iron and steel, aluminum, fertilizers, electricity, and hydrogen — sectors at highest risk of 'carbon leakage' (where EU producers would be at a cost disadvantage vs. non-EU producers without carbon pricing). Step 3: How it works: EU importers must purchase CBAM certificates equal to the embedded carbon content of imported goods, priced at the current EU ETS carbon price (€50-100/tonne). Importers receive credits for carbon costs already paid in the country of origin — avoiding double-counting. Step 4: Investment implications: (a) Carbon-intensive industries in countries without carbon pricing (India, China, Turkey in steel) face a cost increase when exporting to the EU. (b) EU producers of covered materials gain competitive protection. (c) Non-EU governments face pressure to implement domestic carbon pricing to avoid their exporters bearing CBAM costs. Step 5: Global ripple effects: CBAM is accelerating carbon pricing adoption globally as trading partners seek to avoid the competitive disadvantage. U.S. lawmakers have proposed similar legislation; the UK is developing its own CBAM. Investors in carbon-intensive exporters must model CBAM exposure in their DCF assumptions. Therefore, CBAM represents the first major attempt to price carbon content in trade — it creates real financial costs for carbon-intensive producers and accelerates the global convergence toward carbon pricing, with significant implications for global trade flows and company valuations."
"How is ESG applied to real estate investing?","ESG in real estate: Step 1: Real estate accounts for approximately 40% of global energy consumption and 36% of CO2 emissions — making it one of the most environmentally significant asset classes. ESG integration in real estate directly addresses some of the largest sources of urban emissions through building energy efficiency, renewable energy, water management, and tenant health. Step 2: Environmental factors: green building certifications (LEED, BREEAM, ENERGY STAR) are the primary ESG benchmark. LEED-certified buildings consume 25-30% less energy and use 30-40% less water than conventional buildings. Investors in non-certified buildings face increasing regulatory risk (EU's Energy Performance of Buildings Directive, New York City Local Law 97 which fines buildings exceeding emissions limits). Step 3: Social factors: tenant health and well-being (air quality, natural light, acoustics — measured by WELL certification), affordable housing access, community impact of development, accessibility for disabled persons, and resilience to climate physical risks (sea level rise, flooding). Step 4: Governance: transparent property management, anti-corruption in construction procurement, tenant engagement processes, and GRESB (Global Real Estate Sustainability Benchmark) reporting — the primary ESG reporting framework for real estate, covering 2,000+ companies managing $7T+ in assets. Step 5: ESG premium: studies show green-certified buildings command 5-15% premium rents and 5-10% premium valuations over comparable non-certified buildings — the 'green premium' is real and growing as tenants (especially large corporate tenants with their own net-zero commitments) preferentially lease green space. Therefore, ESG integration in real estate simultaneously reduces regulatory risk, improves asset values through green premiums, attracts quality tenants, and lowers energy operating costs — making it one of the clearest cases of financial and environmental alignment in sustainable investing."
"What are diversity, equity, and inclusion (DEI) metrics in ESG and how are they measured?","DEI metrics in ESG: Step 1: Diversity, equity, and inclusion (DEI) metrics are a core component of the 'S' in ESG, measuring whether companies have a workforce and leadership team that reflects gender, racial, ethnic, and other forms of diversity — and whether the company's culture treats all employees equitably. Step 2: Key DEI metrics tracked by ESG frameworks: (a) Gender representation: percentage of women on the board (target: 30-40%+), in senior management, in the total workforce. EU Gender Balance on Corporate Boards Directive requires 40% female representation. (b) Racial and ethnic diversity: U.S. companies are increasingly disclosing EEO-1 data showing workforce composition by race/ethnicity and job category. (c) Pay equity: gender pay gap (adjusted and unadjusted), racial pay gap — measured as difference in median or mean compensation between groups. (d) Inclusion: employee belonging surveys, psychological safety scores. Step 3: Business case evidence: McKinsey's 'Diversity Wins' studies consistently show that companies in the top quartile for gender and ethnic diversity outperform peers by 25-36% on profitability — diversity correlates with better decision-making, talent attraction, and market insight. Step 4: Data challenges: race/ethnicity data is particularly inconsistent globally — legal restrictions in France, Germany, and other countries prohibit collection of race data, limiting comparability. Gender pay gap calculation methodologies vary (controlled vs. uncontrolled gap). Step 5: Activist pressure: investors (CalPERS, TIAA, Vanguard) have filed shareholder resolutions requiring board diversity disclosure and voted against nominating committees that fail to achieve gender and racial representation targets. Therefore, DEI metrics are becoming standard ESG data points with real business performance correlations — companies lagging on diversity face increasing proxy pressure, reputational risk, and potential valuation discounts from ESG-mandate investors."
"What is ESG whistleblowing and how does it interact with sustainable finance regulation?","ESG whistleblowing explained: Step 1: ESG whistleblowing refers to employees, contractors, or insiders who report suspected greenwashing, fraudulent ESG claims, or ESG-related misconduct at companies or financial institutions — playing a critical role in enforcing ESG integrity as mandatory disclosure frameworks expand. Step 2: The landmark case: Desiree Fixler, former DWS sustainability chief, blew the whistle in 2021 alleging that DWS overstated the proportion of assets it managed according to ESG criteria. This triggered regulatory investigations in Germany and the U.S., led to a BaFin-ordered $19M fine, and caused significant reputational damage to Deutsche Bank. The case highlighted that ESG greenwashing carries real legal consequences. Step 3: Regulatory protections: the EU Whistleblower Protection Directive (2021) requires companies with 50+ employees to establish internal reporting channels and prohibits retaliation against whistleblowers reporting breaches of EU law — explicitly covering sustainable finance regulations (SFDR, EU Taxonomy). The SEC's whistleblower program offers 10-30% of sanctions exceeding $1M to qualifying whistleblowers. Step 4: Types of ESG whistleblowing: (a) Fund-level greenwashing (fund doesn't hold what it claims). (b) Corporate greenwashing (misleading net-zero pledges, exaggerated sustainability metrics). (c) Supply chain abuses (labor violations hidden from corporate disclosures). (d) Governance failures (board-level ESG oversight non-compliance). Step 5: Investment implications: the rise of ESG whistleblowing increases the risk of regulatory enforcement and reputational damage for financial institutions with weak ESG governance — due diligence on manager ESG claims is essential for institutional investors. Therefore, ESG whistleblowing is a critical enforcement mechanism for sustainable finance regulation — its effectiveness depends on strong legal protections for whistleblowers and credible regulatory follow-through on enforcement actions."
