question,answer
"What is ESG investing and what does each letter stand for?","ESG investing explained: Step 1: ESG stands for Environmental, Social, and Governance — three categories of non-financial factors used to evaluate a company's sustainability and ethical impact. Step 2: Environmental: climate risk and carbon emissions, energy efficiency, water use, waste management, biodiversity impact, physical climate risks to assets. Step 3: Social: labor practices, worker safety, supply chain standards, community relations, diversity and inclusion, data privacy, customer protection. Step 4: Governance: board independence and diversity, executive pay alignment with performance, shareholder rights, accounting transparency, anti-corruption policies, capital allocation discipline. Step 5: The investment thesis: companies with strong ESG profiles have lower regulatory, reputational, and operational risks — translating to better long-term returns and lower cost of capital. Therefore, ESG investing integrates non-financial risk factors into the investment process to identify companies with more durable competitive positions and lower hidden risks."
"What is the difference between ESG integration, negative screening, and impact investing?","ESG strategy types: Step 1: Negative screening (exclusionary): excludes companies or industries from the portfolio that violate ESG criteria — tobacco, weapons, gambling, fossil fuels. It's the oldest form of ethical investing (socially responsible investing / SRI). Step 2: ESG integration: incorporates ESG data into fundamental analysis alongside financial metrics — without necessarily excluding companies. A high-carbon company can remain in the portfolio if its ESG improvement trajectory is positive and the stock is cheap enough. Step 3: Positive screening (best-in-class): selects companies with the highest ESG scores within each sector — owning the best oil company rather than excluding oil entirely. Step 4: Impact investing: deliberately targets investments that generate measurable positive social or environmental outcomes alongside financial returns. Often involves private markets (microfinance, clean energy projects). Step 5: Thematic investing: focuses on specific ESG themes — clean energy ETFs, gender diversity funds, water infrastructure funds. Therefore, these strategies exist on a spectrum from pure financial optimization with ESG data to pure mission-driven impact at the expense of some financial return."
"What is a green bond and how does it differ from a regular bond?","Green bonds explained: Step 1: A green bond is a fixed-income instrument where the issuer commits to use proceeds exclusively for environmentally beneficial projects — renewable energy, energy efficiency, clean transportation, sustainable water, green buildings. Step 2: The key difference from a regular bond: the 'use of proceeds' restriction. A regular bond's proceeds can be used for any purpose; a green bond's proceeds are ring-fenced for green projects with independent verification. Step 3: Green bond framework: the issuer publishes a Green Bond Framework specifying eligible projects, proceeds management, and reporting commitments. Second-party opinion providers (Sustainalytics, Vigeo Eiris) review the framework's credibility. Step 4: Pricing: green bonds often trade at a slight premium (lower yield) called the 'greenium' — investors accept marginally lower return for the green label. The greenium is typically 2-10 basis points. Step 5: Market: global green bond issuance exceeded $500B in 2023 — governments, banks, and corporations all issuing. Therefore, green bonds are the primary debt instrument for climate finance — well-structured issuances with credible use-of-proceeds reporting represent genuine additionality for environmental projects."
"What is carbon credit trading and how does it work?","Carbon credit markets: Step 1: A carbon credit represents the right to emit one tonne of CO2 equivalent. Carbon trading aims to put a price on emissions, incentivizing companies to reduce pollution. Step 2: Compliance markets (cap-and-trade): regulators set a cap on total emissions and issue permits. Companies that emit less can sell excess permits; companies that emit more must buy credits. Key markets: EU ETS (Emissions Trading System), California Cap-and-Trade. Step 3: Voluntary carbon markets (VCM): companies voluntarily buy carbon offsets to meet net-zero pledges. Offset projects: reforestation, methane capture, renewable energy deployment. Credits are verified by Gold Standard, Verra (VCS). Step 4: Criticisms: additionality concerns (does the project actually reduce emissions that wouldn't have been reduced anyway?), permanence (forests can burn), double-counting across multiple claims. Step 5: Carbon prices: EU ETS carbon credits peaked at €100/tonne in 2023; voluntary market prices range from $5-50/tonne depending on project quality. Therefore, carbon markets are a critical climate policy tool but require robust verification standards to avoid greenwashing through low-quality offsets."
"What is greenwashing and how can investors identify it?","Greenwashing identification: Step 1: Greenwashing occurs when companies or investment products overstate or misrepresent their environmental credentials — appearing 'green' for marketing benefits without genuine substance. Step 2: Common forms: ESG funds with holdings in major oil companies, 'net-zero' pledges without credible transition plans, product labeling as 'sustainable' without certification, publishing ESG reports without external assurance. Step 3: Red flags for investors: vague claims ('eco-friendly', 'sustainable') without specific metrics; ESG fund holdings not matching stated mandate; no third-party verification of sustainability claims; carbon offsets purchased cheaply to claim 'carbon neutral' without actually reducing emissions. Step 4: Regulatory response: SEC proposed enhanced climate disclosure rules; EU SFDR (Sustainable Finance Disclosure Regulation) requires funds to substantiate ESG claims with Article 8 or Article 9 classifications. Step 5: Tools to detect greenwashing: review actual fund holdings (not just marketing materials), check carbon emissions data from CDP disclosures, verify third-party ESG ratings from multiple providers (MSCI, Sustainalytics, ISS). Therefore, sophisticated ESG investors dig beneath marketing claims to verify actual portfolio holdings, emissions trajectories, and third-party-verified metrics."
"What is the UN Principles for Responsible Investment (UN PRI)?","UN PRI explained: Step 1: The UN PRI is a voluntary framework launched in 2006 that sets out six principles for responsible investment — committing signatories to incorporate ESG factors into investment decisions. Step 2: The six principles: (1) Incorporate ESG into investment analysis. (2) Be active owners (engage companies on ESG issues). (3) Seek appropriate ESG disclosure from investees. (4) Promote acceptance of PRI within the industry. (5) Enhance implementation effectiveness. (6) Report on activities and progress. Step 3: Signatories: over 5,000 institutions with $120 trillion+ in AUM have signed — representing the majority of the global institutional investment community. Step 4: Accountability: signatories submit annual transparency reports; chronic non-compliance can result in delisting. The PRI grades members on implementation quality. Step 5: Criticism: signing PRI is relatively easy and does not guarantee genuine ESG integration — some signatories have limited implementation despite the commitment. Therefore, UN PRI membership is a baseline expectation for serious institutional investors, but the quality of ESG integration varies enormously among signatories."
"What is climate risk in finance and how do TCFD recommendations address it?","Climate risk and TCFD: Step 1: Climate risk has two components: (1) Physical risk — direct damage from climate events (floods, hurricanes, droughts) to physical assets; (2) Transition risk — financial losses from the shift to a low-carbon economy (stranded fossil fuel assets, carbon taxes, changing consumer preferences). Step 2: The Task Force on Climate-related Financial Disclosures (TCFD), created by the Financial Stability Board in 2015, developed a framework for companies to disclose climate-related risks consistently. Step 3: TCFD's four pillars: Governance (how does the board oversee climate risk?), Strategy (how does climate risk affect the business strategy?), Risk Management (how are climate risks identified and managed?), Metrics and Targets (what emissions and climate metrics does the company report?). Step 4: Regulatory momentum: TCFD-aligned disclosure is now mandatory in the UK, EU, and increasingly in the U.S. (SEC climate rules) and Asia. Step 5: Investor use: TCFD disclosures allow portfolio climate risk quantification using scenario analysis (1.5°C, 2°C warming scenarios). Therefore, climate risk is transitioning from a theoretical ESG concern to a core financial risk that regulators, lenders, and investors are increasingly pricing into capital allocation decisions."
"What is ESG scoring and why do different providers give different scores?","ESG scoring methodology: Step 1: ESG scores rate companies on environmental, social, and governance performance using a combination of company disclosures, third-party data, and modeled estimates. Major providers: MSCI ESG, Sustainalytics, ISS ESG, Bloomberg ESG, S&P Global. Step 2: Why scores differ: each provider weights ESG factors differently. MSCI focuses on 'financially material' ESG risks for each industry. Sustainalytics measures unmanaged ESG risk. ISS focuses on governance first. These different philosophies produce very different scores for the same company. Step 3: Data quality problem: most ESG data relies on company self-disclosure — companies disclose what makes them look good. Non-disclosures are often assumed to be average, rewarding disclosure quantity over substance. Step 4: Academic evidence on score divergence: research shows ESG scores from major providers have correlation of only 0.5-0.6 (on a scale of 0-1) — far lower than credit ratings from S&P vs. Moody's (0.9+). Step 5: Investment implications: ESG score changes trigger systematic buying/selling by ESG-mandate funds — creating temporary price dislocations that active investors can exploit. Therefore, treat ESG scores as one data input rather than objective truth — understand the methodology behind any score before acting on it."
"What is shareholder activism and how does it relate to ESG?","ESG activism explained: Step 1: Shareholder activism occurs when investors use their ownership stakes to influence corporate behavior — demanding changes to strategy, governance, or ESG practices. Step 2: ESG activism mechanisms: (1) Proxy voting — voting against board members or executive pay packages that don't align with ESG standards. (2) Shareholder resolutions — filing proposals for a vote at the annual meeting (requiring climate reporting, executive pay adjustments, diversity targets). (3) Engagement — private dialogue with management to encourage voluntary changes before escalating to public proxy campaigns. Step 3: Landmark case: In 2021, a small activist hedge fund (Engine No. 1) won 3 board seats at ExxonMobil despite owning only 0.02% of shares — by convincing large institutional shareholders that Exxon's climate strategy was inadequate. Step 4: Institutional investor influence: BlackRock, Vanguard, and State Street collectively own 15-20% of most large U.S. companies — their proxy votes have enormous influence on ESG resolutions. Step 5: Effectiveness debate: critics argue some ESG activism (particularly from large passive managers) is more performative than impactful. Therefore, genuine ESG shareholder activism — especially coordinated across multiple large investors — has proven capable of changing corporate climate strategies at major companies."
"What are sustainability-linked loans (SLLs) and how do they incentivize ESG improvement?","Sustainability-linked loans: Step 1: A sustainability-linked loan (SLL) ties the interest rate a borrower pays to the achievement of pre-agreed ESG key performance indicators (KPIs). If KPIs are met, the rate decreases; if missed, it increases. Step 2: Common KPIs: carbon emissions reduction targets (e.g., reduce Scope 1 emissions by 30% by 2025), renewable energy usage (e.g., 50% of energy from renewables), employee safety targets, diversity metrics (% of women in senior management). Step 3: Key difference from green bonds: SLL proceeds can be used for general corporate purposes — the sustainability link is in the pricing mechanism, not the use of proceeds. Step 4: Market growth: SLL market grew from near zero in 2017 to $800B+ annually by 2022 — now a mainstream corporate financing tool. Step 5: Criticisms: KPI selection can be weak (targets not ambitious enough, easily achieved), limited third-party verification, risk of 'greenwashing' in pricing. Therefore, well-structured SLLs with ambitious, verified KPIs genuinely incentivize ESG improvement by creating a direct financial cost for missing targets."
"What is the SFDR (Sustainable Finance Disclosure Regulation) in Europe?","SFDR explained: Step 1: The EU's Sustainable Finance Disclosure Regulation (SFDR), effective March 2021, requires financial market participants in Europe to disclose how sustainability risks are integrated into investment decisions and products. Step 2: Three product classifications: Article 6 — standard funds that consider sustainability risks but don't claim ESG focus. Article 8 — funds that 'promote' environmental or social characteristics — must disclose how. Article 9 — funds with 'sustainable investment' as a specific objective — highest disclosure standard, must demonstrate positive impact. Step 3: Market impact: thousands of funds initially classified as Article 8 or 9; regulators then applied stricter scrutiny, leading to significant 'downgrades' from Article 9 to 8 in 2022-2023 (DWS, Amundi, HSBC). Step 4: Principal Adverse Impacts (PAI): Article 8 and 9 funds must report on 14 mandatory PAI indicators — carbon emissions, gender pay gap, biodiversity impacts, etc. Step 5: Global influence: SFDR is inspiring similar disclosure regimes in the UK, Asia, and Canada. Therefore, SFDR is the world's most comprehensive mandatory ESG disclosure framework for investment products — it is reshaping how asset managers define, market, and verify sustainable investment products."
"What is impact investing and how is impact measured?","Impact investing: Step 1: Impact investing deliberately targets investments that generate measurable, positive social or environmental outcomes alongside financial returns. It goes beyond ESG screening (avoiding harm) to actively creating good. Step 2: Impact themes: affordable housing, clean energy access, healthcare in underserved communities, education technology, sustainable agriculture, financial inclusion in emerging markets. Step 3: Impact measurement frameworks: Theory of Change (mapping how the investment creates impact), IRIS+ metrics (standardized impact metrics from GIIN), SDG alignment (mapping to UN Sustainable Development Goals), independent impact verification. Step 4: Financial returns: impact investing spans the return spectrum — some strategies target market-rate returns (like microfinance); others accept below-market returns (mission-related investments by foundations) for greater impact. Step 5: Growth: the Global Impact Investing Network (GIIN) estimates the impact investing market at $1.16 trillion AUM as of 2022. Therefore, impact investing requires clarity on two questions: what impact are you trying to achieve, and how will you verify it actually happened — without this rigor, impact claims are indistinguishable from marketing."
"What are ESG ratings' influence on stock prices and capital allocation?","ESG rating effects on markets: Step 1: As ESG-mandate funds have grown to trillions in AUM, ESG ratings have become a significant driver of capital flows — affecting both the cost of capital and stock prices. Step 2: Companies upgraded to high ESG scores attract capital from ESG funds, potentially lowering their cost of equity. Companies downgraded or excluded from ESG indices face selling pressure. Step 3: Research findings: companies with improving ESG scores tend to outperform over 1-3 year periods — partly through real operational improvements, partly through capital flow effects. Step 4: Green premium: companies with high ESG scores issue bonds at 5-15 basis points lower yield (the 'greenium') — a real cost-of-capital advantage. Step 5: Limitations: as ESG investing becomes more mainstream, any pricing advantage may erode as markets fully incorporate available ESG data. Additionally, ESG ratings have weak predictive power for actual corporate behavior — stock selection based on ESG scores alone has mixed performance evidence. Therefore, ESG ratings influence market prices through capital allocation channels — understanding these dynamics is increasingly important for both corporate issuers and investors."
"What is the EU Taxonomy and why does it matter for sustainable finance?","EU Taxonomy explained: Step 1: The EU Taxonomy is a classification system that defines which economic activities qualify as 'environmentally sustainable' — providing a common language for green finance across Europe. Step 2: Six environmental objectives: climate change mitigation, climate change adaptation, sustainable use of water, circular economy, pollution prevention, biodiversity protection. Step 3: For an activity to be 'taxonomy-aligned,' it must substantially contribute to at least one objective, do no significant harm to the others, and meet minimum social safeguards. Step 4: Controversial inclusion: nuclear energy and some natural gas were classified as transitionally sustainable ('green') under the taxonomy in 2022 — despite significant objections from environmentalists. Step 5: Investor impact: SFDR requires Article 8 and 9 funds to disclose the percentage of their portfolio that is EU Taxonomy-aligned — creating demand for taxonomy-compliant investments. Therefore, the EU Taxonomy is the most ambitious attempt to define 'green' investment with legal precision — it is driving standardization in sustainable finance labeling but its political compromises (nuclear, gas inclusion) remain contentious."
"What is net zero and how are financial institutions committing to it?","Net zero in finance: Step 1: Net zero means achieving a balance between greenhouse gas emissions produced and emissions removed from the atmosphere — effectively eliminating the net contribution to climate change. Step 2: Financial institutions commit to net zero by: (a) decarbonizing their own operations (offices, business travel), and (b) more importantly, aligning their financed emissions (the emissions from companies and projects they lend to or invest in) with a 1.5°C pathway. Step 3: The Glasgow Financial Alliance for Net Zero (GFANZ), launched at COP26, has 450+ members (banks, asset managers, insurers) representing $130T+ in assets committed to net zero by 2050. Members include BlackRock, Goldman Sachs, JPMorgan, and most major global financial institutions. Step 4: Measurement challenge: scope 3 financed emissions (from clients and portfolio companies) are much harder to measure and attribute than direct emissions. Step 5: Credibility gap: commitments are voluntary with no binding enforcement; many banks have faced criticism for continuing to finance fossil fuel expansion despite net-zero pledges. Therefore, net-zero commitments in finance are only meaningful if backed by concrete interim targets (2030 reduction milestones), consistent methodology (PCAF standards), and annual third-party verification."
"What is ESG data and what are the main data challenges?","ESG data challenges: Step 1: ESG data encompasses hundreds of metrics across environmental (emissions, energy, water), social (employee turnover, injury rates, pay equity), and governance (board composition, voting rights, executive pay) dimensions. Step 2: Disclosure challenge: most ESG data relies on voluntary company disclosure. Only 55-60% of global listed companies disclose Scope 1 and 2 emissions consistently; Scope 3 disclosure is far lower. Non-disclosures bias scores toward companies that are good at reporting (not necessarily good at ESG). Step 3: Comparability challenge: companies report using different standards (GRI, SASB, CDP, TCFD) with different scopes and boundaries, making peer comparison difficult. Step 4: Timeliness: ESG data is typically published annually with 3-6 month lags — far slower than financial data. This limits real-time monitoring of ESG risk events. Step 5: Alternative data: AI-driven ESG analysis now incorporates satellite imagery (tracking pollution, deforestation), social media sentiment, supply chain mapping, and regulatory filings to supplement company disclosures. Therefore, ESG data quality is improving — mandatory disclosure regulations (EU CSRD, SEC climate rules) will significantly increase coverage and comparability over the next 5 years."
"What is biodiversity finance and why is it emerging as a key ESG theme?","Biodiversity finance explained: Step 1: Biodiversity finance refers to capital flows directed toward preserving and restoring natural ecosystems — forests, wetlands, coral reefs, and species habitats — recognizing that biodiversity loss poses material economic and financial risks. Step 2: The economic case: the World Economic Forum estimates that $44 trillion of global GDP — more than half — is moderately or highly dependent on nature and its services (pollination, water filtration, climate regulation, flood protection). Biodiversity collapse threatens entire industries including agriculture, pharmaceuticals, and tourism. Step 3: The Taskforce on Nature-related Financial Disclosures (TNFD), launched in 2021 and releasing its final framework in 2023, parallels TCFD for biodiversity — requiring companies and financial institutions to assess and disclose nature-related risks and opportunities. Step 4: Financing mechanisms: biodiversity credits (similar to carbon credits but for nature restoration), debt-for-nature swaps (countries reduce debt in exchange for nature conservation commitments), green bonds with biodiversity use-of-proceeds, and biodiversity offset markets (developers compensate for habitat destruction by funding conservation elsewhere). Step 5: Investment opportunities: sustainable forestry, regenerative agriculture, ocean health, ecotourism infrastructure, and nature-tech companies developing monitoring and verification tools. The Kunming-Montreal Global Biodiversity Framework (2022) set a target of protecting 30% of land and oceans by 2030, requiring $200B+ per year in financing. Therefore, biodiversity finance is transitioning from a niche conservation topic to a mainstream financial risk and opportunity — investors ignoring nature-related risks in sectors like food, fashion, and pharma face unpriced material risks."
"What is a social bond and how does it differ from a green bond?","Social bonds explained: Step 1: A social bond is a fixed-income instrument where proceeds are exclusively used to finance projects with positive social outcomes — affordable housing, access to healthcare, education for underserved communities, employment generation, and food security programs. Step 2: Unlike green bonds (which focus on environmental projects), social bonds target social challenges, particularly for target populations: people living below the poverty line, unemployed individuals, migrants, persons with disabilities, and underserved communities in developing countries. Step 3: The ICMA (International Capital Market Association) Social Bond Principles provide the framework: (1) Use of proceeds restricted to eligible social projects, (2) Process for project evaluation and selection, (3) Management of proceeds in dedicated accounts, (4) Annual reporting on social impact. Step 4: Market growth: social bond issuance surged during COVID-19 as governments and supranational institutions (EU, World Bank) raised capital for pandemic response. The EU's SURE program issued €100B in social bonds to fund employment support programs. Total social bond issuance reached $180B+ in 2021. Step 5: Measurement challenge: social outcomes are harder to quantify than environmental outcomes — 'number of affordable housing units built' is easier to verify than 'reduction in regional inequality.' Therefore, social bonds are growing in importance as investors seek to align fixed-income portfolios with social development goals alongside financial returns, though rigorous impact measurement remains a key challenge."
