question,answer
"What is the football field chart in investment banking?","Let's break this down: Step 1: A football field chart (or valuation football field) is a horizontal bar chart that visually summarizes the implied valuation ranges from multiple valuation methodologies side by side, creating a comprehensive view of where a company's value may lie. Step 2: Each row represents one methodology: DCF (Gordon Growth), DCF (Exit Multiple), Public Company Comparables, Precedent Transactions, 52-Week Trading Range, and sometimes Analyst Price Targets. Each bar spans the low-to-high range of implied values from that methodology. Step 3: The overlap zone — where multiple methodologies converge — typically represents the most credible valuation range. The current trading price is usually shown as a reference line to indicate premium or discount. Step 4: In a sell-side advisory context, the football field demonstrates to a board of directors that a proposed deal price falls within a defensible range across multiple valuation approaches — providing legal cover (fairness opinion support) and analytical rigor. Therefore, the football field chart is not just a visual aid but a formal analytical presentation tool that summarizes and reconciles multiple valuation frameworks into an integrated fairness assessment."
"What is a sum-of-the-parts (SOTP) valuation?","To understand SOTP valuation, consider: Step 1: Sum-of-the-parts valuation separately values each distinct business segment, subsidiary, or asset of a diversified company and then sums those values to derive total enterprise value — rather than valuing the company as a single entity using blended multiples. Step 2: This approach is appropriate when a company operates in multiple distinct industries where different valuation frameworks apply — for example, a conglomerate with a media division, a financial services arm, and an industrial manufacturing unit would be poorly served by a single EV/EBITDA multiple. Step 3: Each segment is valued using the most appropriate methodology (comps, DCF, or real estate appraisal), and a corporate overhead cost (headquarters expenses not allocated to segments) is valued as a negative component — typically as a perpetuity using a discount rate. Step 4: SOTP often reveals a 'conglomerate discount' — the sum of parts is worth more than the market values the whole company, creating a catalyst for activist investors to push for asset sales, spinoffs, or restructurings that unlock hidden value. Therefore, SOTP valuation is the primary tool for analyzing conglomerates and the analytical foundation for corporate restructuring and breakup value analysis."
"What is the role of working capital in financial modeling?","Let's break this down: Step 1: Working capital is defined as Current Assets minus Current Liabilities (excluding cash and short-term debt, which are financing items). The key operating working capital components are: Accounts Receivable (AR), Inventory, and Accounts Payable (AP). Step 2: In financial modeling, changes in working capital affect cash flow. An increase in AR or Inventory is a cash use (you have more tied up in the business); an increase in AP is a cash source (you're paying suppliers slower). Net working capital investment = ΔAR + ΔInventory - ΔAP. Step 3: Working capital is typically modeled using turnover ratios: DSO (Days Sales Outstanding) = AR / Revenue × 365; DIO (Days Inventory Outstanding) = Inventory / COGS × 365; DPO (Days Payable Outstanding) = AP / COGS × 365. Step 4: The cash conversion cycle = DSO + DIO - DPO. A low or negative cash conversion cycle (like Amazon's) means the company collects from customers before paying suppliers — generating self-funding growth. A high CCC requires external capital to fund operations. Therefore, working capital modeling accuracy determines the quality of free cash flow projections — modelers who use blended ratios from historical financials without analyzing business model changes will systematically misforecast cash generation."
"What is a bridge analysis in financial modeling?","To understand bridge analysis, consider: Step 1: A bridge (or waterfall) analysis explains the movement from one financial metric to another — or from one period's results to another — by breaking the change into component drivers. Step 2: The most common applications are: (a) EBITDA bridge: explaining why EBITDA moved from $100M to $120M by showing +$15M from volume growth, +$8M from price, -$3M from cost inflation = $120M. (b) EPS bridge: showing how EPS changed year over year from revenue growth, margin change, share buybacks, and tax rate changes. (c) Equity value bridge in an LBO: showing how equity value builds from entry to exit through EBITDA growth, multiple expansion, and debt paydown. Step 3: Bridge analyses are presented as waterfall charts — bars going up (positive contributors) and down (negative contributors) from a starting point to an ending point. Step 4: The power of a bridge is that it replaces a simple 'revenues went up' narrative with a precise, quantified decomposition of every driver — immediately identifying what management controlled (pricing, cost efficiency) versus what was market-driven (volume, FX). Therefore, bridge analysis is one of the most powerful communication tools in financial modeling and investor presentations, translating complex financial movements into an immediately intuitive visual story."
"What is maintenance vs. growth capex and why does the distinction matter?","Let's break this down: Step 1: Capital expenditure (capex) is spending on physical assets — property, plant, and equipment — that appear on the balance sheet and are depreciated over time. Step 2: Maintenance capex is spending required to maintain existing productive capacity — replacing worn machinery, updating software, or repainting facilities. It does not generate incremental revenue. Step 3: Growth capex is spending to expand productive capacity — building new factories, launching new locations, or investing in new technology platforms. It directly enables future revenue growth. Step 4: The distinction matters for free cash flow analysis: Maintenance capex is a true recurring cash cost that must be subtracted from operating cash flow to determine normalized free cash flow. Growth capex is more discretionary — during downturns, management can defer it without immediately impairing current operations. Step 5: Buffett famously focuses on 'owner earnings,' which is net income + D&A - maintenance capex — a measure that corrects the misrepresentation of treating all capex as equivalent. Therefore, distinguishing maintenance from growth capex is essential for accurate free cash flow estimation and for comparing capital intensity across companies and business models."
"What is the concept of normalized earnings and why is it used?","To understand normalized earnings, consider: Step 1: Normalized earnings (or normalized EBITDA) are a company's earnings adjusted to remove one-time, non-recurring, or non-operational items that distort the true underlying run-rate profitability of the business. Step 2: Common adjustments include: removing restructuring charges, litigation settlements, write-offs, stock-based compensation (debated), M&A costs, COVID-related costs, and non-cash charges that do not reflect ongoing business performance. Step 3: Private equity buyers pay acquisition prices based on normalized EBITDA, not GAAP EBITDA, because they are purchasing future cash-generating capacity. The 'quality of earnings' (QoE) due diligence process specifically audits and challenges each management add-back to assess its legitimacy. Step 4: The risk is that management teams over-normalize — presenting an inflated EBITDA by calling recurring costs 'one-time.' Experienced investors scrutinize whether the same add-backs appear year after year (a red flag suggesting the costs are in fact recurring). Therefore, normalized earnings are the appropriate basis for valuation multiples and model projections, but the quality and legitimacy of normalization adjustments must be critically evaluated — they are one of the most common sources of disagreement between buyers and sellers in M&A transactions."
"What is a leverage buyout credit analysis?","Let's break this down: Step 1: LBO credit analysis evaluates whether a target company can safely service the debt load placed on it during a leveraged buyout — protecting lenders' interests even in downside scenarios. Step 2: Key credit metrics analyzed include: Debt/EBITDA (leverage ratio), EBITDA/Interest Expense (interest coverage ratio), Free Cash Flow/Total Debt (debt repayment capacity), and minimum liquidity cushion (revolver availability). Step 3: Lenders typically require interest coverage above 2.0x and set maximum leverage covenants (e.g., total debt/EBITDA must not exceed 6.0x). The credit model tests compliance with these covenants across base, downside, and stress scenarios. Step 4: The debt repayment waterfall is modeled showing which tranches are repaid in what order: senior secured loans (Term Loan A/B) are first priority, followed by second lien, then mezzanine/subordinated debt. Each layer has different interest rates reflecting their risk position in the capital structure. Therefore, LBO credit analysis is the lender's equivalent of equity IRR analysis — it answers 'can this company pay us back?' rather than 'can our equity return 25%?' — and the interaction between these two perspectives determines the achievable capital structure and ultimate deal economics."
"What is a break-even analysis in financial modeling?","To understand break-even analysis, let's break it down: Step 1: Break-even analysis determines the minimum level of revenue (or unit sales) needed for a company to cover all its costs — the point at which total revenue equals total costs and profit is zero. Step 2: The formula is: Break-Even Revenue = Fixed Costs / Gross Margin %. Or in units: Break-Even Units = Fixed Costs / (Unit Price - Variable Cost per Unit). Step 3: For example, if a company has $10M in fixed costs and a gross margin of 40%, it needs $25M in revenue to break even. Any revenue above $25M generates profit; below $25M, the company loses money. Step 4: In financial modeling, break-even analysis is used to stress-test an investment: 'How far can revenue fall from projections before the company cannot service its debt?' This is especially critical in LBO analysis, where high fixed interest costs narrow the break-even margin dramatically compared to the unlevered company. Therefore, break-even analysis is a fundamental risk-framing tool — it translates abstract financial projections into a concrete minimum viability threshold that management, investors, and lenders can intuitively assess."
"What is the purpose of a capitalization table (cap table) in startup modeling?","Let's break this down: Step 1: A capitalization table (cap table) is a spreadsheet that records the ownership structure of a company — listing all shareholders (founders, employees, investors), the type of securities they hold (common stock, preferred stock, options, warrants), and the number of shares and percentage ownership for each. Step 2: Cap tables are essential for calculating how proceeds are distributed at exit. Preferred shareholders typically have liquidation preferences — the right to receive their investment back (or a multiple of it) before common shareholders receive anything. Step 3: As a startup raises multiple venture rounds (Seed, Series A, B, C), each round creates new share classes with different preferences, anti-dilution provisions, and participation rights. The cap table must track all of these and model the dilutive effect of each new share issuance on existing holders. Step 4: At exit, a waterfall analysis on the cap table distributes exit proceeds: first to preferred shareholders' liquidation preferences, then to participating preferred holders pro rata, and finally to common shareholders — showing each stakeholder's actual return. Therefore, cap table modeling is foundational for startup founders negotiating term sheets, employees evaluating equity compensation, and investors calculating their expected return under different exit valuation scenarios."
"What is a DCF sensitivity to growth assumptions?","To understand DCF sensitivity to growth, consider: Step 1: In a DCF, revenue growth drives free cash flow projections, which are the direct inputs to valuation. Small changes in assumed growth rates compound dramatically over a 10-year forecast horizon. Step 2: For example, a company with $100M in Year 0 FCF growing at 15% for 10 years and then 3% in perpetuity has a significantly different value than one growing at 10% and then 2% — the difference in terminal FCF may be 50-60% higher for the faster-growing scenario, and this gap is then perpetualized and discounted. Step 3: The sensitivity is further amplified when WACC is close to the terminal growth rate. As g approaches WACC in the perpetuity formula (FCF × (1+g) / (WACC - g)), the denominator shrinks and value approaches infinity — making highly optimistic growth assumptions in low-discount-rate environments produce astronomical valuations. Step 4: This is precisely what happened during 2020-2021 when near-zero interest rates (low WACC) combined with aggressive growth assumptions for tech companies produced valuations that collapsed dramatically when rates rose in 2022. Therefore, understanding DCF sensitivity to growth assumptions is not just a technical exercise — it explains some of the most dramatic boom-bust valuation cycles in financial market history."
"What is the purpose of a waterfall model in finance?","Let's break this down: Step 1: A waterfall model in finance describes how cash proceeds are distributed among different stakeholders in a structured sequence — senior claims are satisfied first before junior claims receive any distribution, like water filling successive pools from top to bottom. Step 2: In LBO/private equity context: at exit, proceeds are first used to repay all debt (senior secured, then second lien, then mezzanine), then to return LP capital contributions, then to pay the preferred return (hurdle rate) to LPs, and finally to split remaining profits between LPs and the GP (carried interest). Step 3: In M&A/startup context: liquidation preferences from preferred stock rounds are paid first, then participating preferred shares receive their pro-rata portion, and finally common shareholders (founders, employees) receive what remains — often very little in modest exit scenarios. Step 4: The specific waterfall mechanics (1x vs. 2x liquidation preferences, participating vs. non-participating preferred, carry percentages) dramatically affect each party's ultimate return and are the subject of intense negotiation in term sheet discussions. Therefore, waterfall modeling is critical for any investor or founder to understand their actual economic outcome across a range of exit scenarios — headline valuation multiples mean nothing without understanding your position in the distribution waterfall."
"What is the difference between EBIT and EBITDA?","To understand EBIT vs EBITDA, consider: Step 1: EBIT (Earnings Before Interest and Taxes) = Net Income + Interest Expense + Tax Expense = Revenue - Cost of Goods Sold - Operating Expenses - Depreciation & Amortization. It represents operating profit after accounting for the non-cash costs of depreciation and amortization. Step 2: EBITDA (Earnings Before Interest, Taxes, Depreciation, and Amortization) = EBIT + Depreciation + Amortization. It adds back D&A to EBIT, producing a closer approximation of operating cash flow generation before working capital movements. Step 3: EBITDA is used in valuation multiples (EV/EBITDA) because: (a) it is capital structure-neutral (before interest), (b) it is tax-neutral, and (c) it eliminates the accounting distortions of depreciation policies across companies. Step 4: The critique of EBITDA (voiced famously by Charlie Munger and Warren Buffett) is that it ignores capex — treating depreciation as if it were a free add-back when in reality the underlying assets must be replaced. For capital-intensive businesses, EBITDA dramatically overstates true cash generation compared to free cash flow. Therefore, EBIT and EBITDA each have valid uses depending on the analysis, but EBITDA must always be contextualized alongside capex intensity to avoid overstating economic profitability in asset-heavy businesses."
"What is a financial model audit and why is it important?","Let's break this down: Step 1: A financial model audit (or model review) is a systematic examination of a financial model's structure, assumptions, formulas, and outputs to verify accuracy, internal consistency, and logical integrity. Step 2: Model auditing involves: (a) checking that all formulas reference correct cells and are consistent across rows and columns; (b) verifying that mathematical aggregations are correct (no missing rows in sum ranges); (c) confirming that the balance sheet balances in every period; (d) tracing all key assumptions to source documents. Step 3: In investment banking and PE, independent model auditing is standard before any transaction closes, as errors in acquisition models have resulted in materially mispriced deals. JP Morgan's London Whale loss ($6B+) was partly attributed to spreadsheet errors in risk models. Step 4: Best-practice audit tools include: formula auditing traces (Excel's 'Trace Precedents/Dependents'), independent rebuilds of key calculations, stress tests that push assumptions to extremes to identify illogical model behavior, and comparison of outputs against analyst consensus and management guidance as sanity checks. Therefore, model auditing is not bureaucratic overhead but essential risk management — in high-stakes financial decisions, an unaudited model is a material liability that can lead to billion-dollar mistakes."
"What is the role of management guidance in financial modeling?","To understand management guidance, let's break it down: Step 1: Management guidance is forward-looking financial information that company executives provide to investors and analysts, typically during earnings calls, investor days, or in SEC filings. Guidance may cover revenue range, EPS range, gross margin, operating margin, capex, and other key metrics for the upcoming quarter or full year. Step 2: Sell-side analysts use management guidance as a critical anchor for their near-term financial models — adjusting their estimates based on the guidance range while incorporating their own assumptions for items management didn't specify. Step 3: Buy-side analysts assess whether management guidance is conservative or aggressive based on historical guidance accuracy, competitive dynamics, and their own channel checks — trading opportunities arise when their model differs significantly from both management guidance and street consensus. Step 4: For private companies in due diligence, management projections replace public guidance. Buyers apply significant skepticism to management projections because they are inherently optimistic — historical studies show M&A targets miss their management projections in a majority of cases within two years of acquisition. Therefore, management guidance is a valuable input to financial modeling but must be calibrated for management's historical credibility, their incentives (sandbagging vs. overpromising), and the structural factors that could cause reality to diverge from forecast."
"What is a purchase price allocation (PPA) in M&A accounting?","Let's break this down: Step 1: Purchase price allocation (PPA) is the accounting process required under GAAP (ASC 805) and IFRS (IFRS 3) when one company acquires another. It allocates the acquisition price among all identifiable assets and liabilities at their fair values, with any residual going to goodwill. Step 2: In a PPA, tangible assets (inventory, PP&E, real estate) and identifiable intangible assets (brand names, customer lists, patents, technology) are revalued from their book values to fair market values as of the acquisition date. The fair value step-up on these assets creates incremental amortization charges post-acquisition. Step 3: Goodwill = Purchase Price - Fair Value of Net Identifiable Assets. Goodwill represents the premium paid for synergies, market position, assembled workforce, and going-concern value that cannot be assigned to specific identifiable assets. Step 4: The amortization of acquired intangibles (not goodwill, which is tested annually for impairment) reduces GAAP earnings post-acquisition, creating a common source of divergence between GAAP EPS and adjusted/non-GAAP EPS for acquisitive companies. Therefore, understanding PPA is essential for modeling post-acquisition financials accurately — the amortization of acquired intangibles must be correctly modeled and excluded from normalized EBITDA to avoid double-counting value destruction."
"What is a LBO exit analysis?","To understand LBO exit analysis, consider: Step 1: LBO exit analysis models the returns generated to the private equity sponsor under different exit assumptions — primarily varying the exit EV/EBITDA multiple and exit year — to understand the range of outcomes from the investment. Step 2: At exit, the Enterprise Value is calculated as: Exit EBITDA × Exit Multiple = Exit EV. From this, net debt at exit is subtracted (net debt will be lower than at entry due to years of debt repayment) to give equity proceeds. Step 3: Returns to the sponsor are calculated as: IRR (the annualized return on equity invested) and MOIC (total equity received / equity invested). The analysis typically shows a 5×5 matrix: Exit Year (3,4,5,6,7) on one axis and Exit Multiple (e.g., 6x-10x EBITDA) on the other — each cell showing the resulting IRR. Step 4: This analysis is the final output of the LBO model and the most important table in the PE investment committee memo. It shows the returns to equity under optimistic and pessimistic scenarios, revealing the margin of safety — can the investment still return 15%+ IRR even at a 7x exit vs. 10x entry? Therefore, LBO exit analysis is the quantitative answer to the core PE question: 'Across plausible outcomes, do expected returns justify the risk and illiquidity of this investment?'"
"What is the concept of operating leverage and how is it modeled?","Let's break this down: Step 1: Operating leverage measures the sensitivity of operating profit (EBIT or EBITDA) to changes in revenue, driven by the proportion of fixed versus variable costs in a company's cost structure. Step 2: A company with high fixed costs and low variable costs has high operating leverage: when revenue grows, most incremental revenue falls to the bottom line because fixed costs don't rise proportionally. Conversely, revenue declines are devastating because fixed costs remain while revenue shrinks. Step 3: Degree of Operating Leverage (DOL) = % Change in EBIT / % Change in Revenue = Gross Profit / EBIT (at a given revenue level). A DOL of 3.0x means a 10% revenue increase drives a 30% EBIT increase. Step 4: In financial modeling, operating leverage is captured by separately modeling fixed costs (rent, depreciation, base salaries, insurance) as constants and variable costs (COGS, commissions, logistics) as a percentage of revenue. As revenue scales, the fixed cost percentage declines, expanding margins — a phenomenon called 'operating leverage flowing through to margins.' Therefore, understanding and correctly modeling operating leverage is critical for forecasting how profitability will evolve as companies scale — it explains why software companies (very high fixed costs, near-zero marginal delivery costs) can achieve dramatically expanding margins at scale while manufacturing companies often cannot."
"What is return on invested capital (ROIC) and how is it used in financial modeling?","To understand ROIC, consider: Step 1: Return on Invested Capital (ROIC) measures how efficiently a company generates profit from all the capital invested in its operations: ROIC = NOPAT / Invested Capital, where NOPAT = Net Operating Profit After Tax = EBIT × (1 - Tax Rate), and Invested Capital = Total Equity + Total Debt - Cash (= operating assets funded by capital providers). Step 2: ROIC is the purest measure of business quality because it is capital-structure-neutral (uses NOPAT, not net income) and measures return on total capital deployed, not just equity. Step 3: Companies with ROIC above WACC are creating economic value — they earn more on invested capital than their capital costs. ROIC below WACC destroys economic value even if accounting profits are positive. Step 4: In DCF modeling, ROIC is a key driver of terminal value quality. High-ROIC businesses deserve higher terminal multiples because they generate more value per dollar of reinvestment. The value driver formula: FCF = NOPAT × (1 - g/ROIC), shows that growth only creates value when ROIC > WACC. Therefore, ROIC is not just a performance metric but a fundamental determinant of intrinsic value — it explains why companies like LVMH, Visa, and Google command premium valuations while capital-intensive businesses with low ROIC trade at discounts despite similar earnings growth."
