question,answer
What is a credit report?,"A credit report is a detailed record of your credit history, compiled by the three major credit bureaus: Equifax, Experian, and TransUnion. It includes: personal identification information, all your credit accounts (credit cards, loans, mortgages) with their balances, credit limits, and payment history, public records (bankruptcies, judgments), and lists of who has checked your credit (hard and soft inquiries). Lenders use credit reports to assess lending risk. You are entitled to a free report from each bureau annually at AnnualCreditReport.com. Reviewing your credit reports is important for catching errors (which affect your score) and detecting identity theft. Dispute errors by contacting the bureau directly — they must investigate and correct genuine mistakes within 30 days."
What is insurance?,"Insurance is a risk management contract where you pay regular premiums to an insurance company in exchange for financial protection against specific losses. If the covered event occurs (accident, illness, fire, death), the insurer pays a claim. Insurance works because risk is pooled across many policyholders — most people won't experience a major loss, and their premiums fund the payouts for those who do. Types include: health insurance (medical costs), auto insurance (vehicle accidents), homeowners/renters insurance (property damage and liability), life insurance (income replacement after death), disability insurance (income if unable to work), and liability insurance (legal claims against you). Insurance protects against catastrophic losses that would otherwise be financially devastating — the goal is to insure against risks you couldn't absorb yourself."
What is a financial statement?,"Financial statements are formal records of the financial activities of a business. The three main financial statements are: the Income Statement (Profit & Loss), which shows revenue, expenses, and net income over a period; the Balance Sheet, which shows assets, liabilities, and shareholders' equity at a point in time (the accounting equation: Assets = Liabilities + Equity); and the Cash Flow Statement, which shows how cash moves in and out from operations, investing, and financing activities. Together, these three statements provide a complete picture of a company's financial health. Investors and analysts study financial statements to assess profitability, financial strength, growth trends, and management effectiveness. Learning to read basic financial statements is an invaluable skill for evaluating individual stock investments."
What is fiscal policy?,"Fiscal policy refers to government decisions about taxation and spending to influence the economy. Expansionary fiscal policy (used during recessions) increases government spending and/or reduces taxes to stimulate economic growth — putting more money in consumers' and businesses' hands. Contractionary fiscal policy reduces spending and/or raises taxes to cool an overheating economy and reduce inflation. Fiscal policy is set by Congress and the President (in the US), while monetary policy is the domain of the Federal Reserve. The key tool of fiscal policy is the federal budget — the government's annual plan for spending and revenue. Budget deficits (spending exceeds revenue) add to the national debt. Fiscal policy interacts with monetary policy to manage the economic cycle."
What is monetary policy?,"Monetary policy is the Federal Reserve's management of the money supply and interest rates to achieve macroeconomic goals: price stability (around 2% inflation) and maximum employment. The primary tool is the federal funds rate — the overnight interest rate banks charge each other. When the Fed raises rates, borrowing becomes more expensive, slowing economic activity and inflation. When it cuts rates, borrowing is cheaper, stimulating growth. The Fed also uses quantitative easing (buying bonds to inject money into the economy) and quantitative tightening (selling bonds to remove money). Monetary policy works with a lag of 12–18 months — rate changes take time to fully impact the economy. Understanding monetary policy helps investors anticipate market movements, as interest rate changes affect stock, bond, and real estate prices."
What is supply and demand?,"Supply and demand are the fundamental forces that determine prices in a market economy. Demand: when more people want a good or service at a given price, demand is high, pushing prices up. When fewer people want it, demand falls, pushing prices down. Supply: when producers can profitably supply more at higher prices, supply increases, pushing prices down. When production is constrained, supply falls, pushing prices up. Equilibrium price is where supply and demand balance. This principle governs everything from gasoline prices to housing costs to stock prices. When demand exceeds supply (housing shortage), prices rise. When supply exceeds demand (too many homes), prices fall. In financial markets, stock prices are determined by the balance of buyers (demand) and sellers (supply) at any moment."
What is the difference between a bank and a credit union?,"Banks are for-profit financial institutions owned by shareholders. Their goal is profit for shareholders, which can mean higher fees and lower savings rates. They're accessible with many branches and ATMs nationwide and often have advanced technology. Credit unions are member-owned, not-for-profit cooperatives. Profits are returned to members through lower loan rates, higher savings rates, and lower fees. They require membership (often tied to employer, community, or association). Both offer the same products (checking, savings, loans, mortgages) and are equally insured (banks by FDIC, credit unions by NCUA up to $250,000). Credit unions are often better for borrowing; large banks for convenience and technology. Online banks offer the highest savings rates of all by eliminating branch overhead costs."
What is opportunity cost?,"Opportunity cost is the value of the next best alternative you give up when making a choice. Every financial decision involves trade-offs. When you buy a $500 luxury item, the opportunity cost is what that $500 could have otherwise become: invested at 8% for 30 years, it becomes $5,032. When you buy a $30,000 car with cash instead of a $20,000 car, the $10,000 difference invested over 30 years at 8% becomes $100,627. When you work overtime instead of taking a vacation, the opportunity cost is the rest and experiences foregone. Thinking in opportunity costs prevents unconscious trade-offs. It doesn't mean never spending on enjoyment — it means making spending decisions with full awareness of what you're trading away."
