question,answer
"What is a Discounted Cash Flow (DCF) valuation?","To understand DCF valuation, let's break it down step by step: Step 1: A DCF values a company by estimating all future free cash flows it will generate and discounting them back to the present using a discount rate that reflects the riskiness of those cash flows. Step 2: The formula is: Intrinsic Value = Sum of (FCF_t / (1 + WACC)^t) + Terminal Value / (1 + WACC)^n. Step 3: Free cash flow is typically defined as EBIT × (1 - Tax Rate) + D&A - CapEx - Change in Working Capital. Step 4: The output is the enterprise value of the business; subtracting net debt and preferred equity and dividing by shares outstanding gives intrinsic value per share. Therefore, DCF is the gold standard of intrinsic value analysis because it forces explicit assumptions about growth, margins, and risk — but its output is only as reliable as those assumptions, making sensitivity analysis essential."
"What is WACC and how is it calculated?","Let's break this down: Step 1: WACC (Weighted Average Cost of Capital) is the blended required return that a company must earn on its assets to satisfy all its capital providers — both equity holders and debt holders. Step 2: The formula is: WACC = (E/V) × Ke + (D/V) × Kd × (1 - Tax Rate), where E = equity value, D = debt value, V = total capital (E+D), Ke = cost of equity, and Kd = cost of debt (pre-tax). Step 3: The cost of equity (Ke) is typically estimated using CAPM: Ke = Rf + Beta × (Rm - Rf), where Rf is the risk-free rate, Beta is systematic risk, and (Rm - Rf) is the equity risk premium. Step 4: The cost of debt (Kd) is the interest rate the company pays on its borrowings, tax-effected because interest is tax-deductible (reducing its effective cost). Therefore, WACC represents the opportunity cost of capital — it is the minimum return that justifies any investment and is the critical discount rate in DCF models."
"What is a three-statement financial model?","To understand three-statement modeling, consider: Step 1: A three-statement model links together a company's Income Statement, Balance Sheet, and Cash Flow Statement into a single integrated model where changes in one statement automatically flow through to the others. Step 2: The Income Statement projects revenues, expenses, EBITDA, depreciation, interest, taxes, and net income. Net income flows to retained earnings on the balance sheet and to the cash flow statement as the starting point. Step 3: The Balance Sheet tracks assets (including PP&E, working capital), liabilities (debt, accounts payable), and equity (retained earnings, paid-in capital). The balance sheet must balance: Assets = Liabilities + Equity. The cash and revolver typically act as the 'plug' to enforce the balance. Step 4: The Cash Flow Statement reconciles net income to actual cash generation through operating, investing, and financing activities — ending cash balance feeds back to the balance sheet. Therefore, mastering the three-statement model is the prerequisite for all more advanced modeling (DCF, LBO, M&A) because it develops the ability to trace every assumption through the complete financial picture of a company."
"What is terminal value in a DCF and how is it calculated?","Let's break this down: Step 1: Terminal value (TV) represents the present value of all free cash flows beyond the explicit forecast period (usually 5-10 years), recognizing that businesses continue to generate cash indefinitely. Step 2: Two primary methods exist: The Gordon Growth Model (Perpetuity Growth Method) calculates TV = FCF_n × (1 + g) / (WACC - g), where g is the long-term sustainable growth rate (typically 2-3%, anchored to nominal GDP growth). Step 3: The Exit Multiple Method calculates TV = EBITDA_n × EV/EBITDA Multiple, where the multiple is derived from comparable public companies or historical transaction multiples. Step 4: Terminal value often represents 60-80% of total DCF value, making it the most sensitive — and therefore most scrutinized — component of the model. A 0.5% change in the perpetuity growth rate can swing valuation by 20% or more. Therefore, terminal value calculation requires disciplined assumption-setting and always demands sensitivity analysis across multiple growth rate and discount rate combinations to understand the range of outcomes."
"What is sensitivity analysis in financial modeling?","To understand sensitivity analysis, let's break it down: Step 1: Sensitivity analysis tests how the output of a model (e.g., DCF valuation, IRR) changes when one or two key input assumptions are varied, holding all other assumptions constant. Step 2: In practice, it is presented as a data table (often called a 'tornado chart' or '2-way sensitivity table') where rows represent one variable (e.g., WACC) and columns represent another (e.g., terminal growth rate), and each cell shows the resulting valuation. Step 3: For a DCF, a standard sensitivity table might show implied share price across a 5×5 matrix of WACC (ranging 7-11%) and terminal growth rates (ranging 1-3%). This immediately reveals which combination of assumptions supports or destroys the investment thesis. Step 4: Sensitivity analysis is distinct from scenario analysis: sensitivity changes one or two variables at a time, while scenario analysis changes all variables simultaneously to reflect coherent narratives (bull case, base case, bear case). Therefore, sensitivity analysis is not optional decoration on a financial model — it is the essential communication tool that shows readers which assumptions drive value and where uncertainty is concentrated."
"What is scenario analysis and how does it differ from sensitivity analysis?","Let's break this down: Step 1: Scenario analysis creates multiple internally consistent versions of a financial model representing different future states of the world — typically a Base Case, Bull Case, and Bear Case — where multiple variables change simultaneously in a coherent, narrative-driven way. Step 2: For example, a Bear Case might assume: GDP contracts 2%, company revenue falls 15%, margins compress 300bps as fixed costs lever negatively, and management delays capex — all simultaneously, because these outcomes naturally co-occur in a recession. Step 3: This contrasts with sensitivity analysis, which might separately show the impact of revenue falling 15% while holding margins constant — an internally inconsistent scenario that is unlikely to reflect reality. Step 4: Scenario analysis forces analysts to think narratively about what worlds could plausibly unfold and their second-order effects on all financial line items. It produces probability-weighted valuation ranges when scenario probabilities are assigned. Therefore, scenario analysis is superior to sensitivity analysis for investment decision-making because it captures the realistic correlations between variables, while sensitivity analysis is more useful for identifying which individual assumptions are the largest value drivers."
"What is an LBO model and how does it work?","To understand LBO modeling, let's break it down: Step 1: A Leveraged Buyout (LBO) model analyzes the acquisition of a company using significant debt financing (typically 60-80% of purchase price), with the goal of generating strong equity returns for the private equity buyer by repaying debt over time and exiting at a profit. Step 2: The model structure: (a) Entry — define purchase price, debt/equity split, and sources of financing. (b) Operations — project the company's financials over the holding period (typically 5-7 years), modeling revenue growth, margin improvement, and free cash flow generation. (c) Debt repayment — cash flow sweeps are used to pay down debt according to the capital structure's waterfall. (d) Exit — assume a sale at a specific EV/EBITDA multiple in year 5 or 7. Step 3: The output metrics are IRR (internal rate of return) and MOIC (multiple on invested capital) on the PE sponsor's equity. A typical target is 20-25% IRR and 2-3x MOIC. Step 4: Value creation in an LBO comes from three sources: EBITDA growth, margin improvement, and multiple expansion (buying cheap and selling at a higher multiple). Therefore, an LBO model is fundamentally an exercise in understanding how financial leverage amplifies returns — and risks — from operational improvements."
"What is comparable company analysis (comps) and how is it performed?","Let's break this down: Step 1: Comparable company analysis (comps) values a target company by comparing it to similar publicly traded companies using market-derived valuation multiples. Step 2: The process: (a) Screen for comparable companies using criteria like industry, revenue size, geography, growth profile, and business model. (b) Calculate market-derived multiples for each comp: EV/EBITDA, EV/Revenue, P/E, P/FCF. (c) Summarize the comps set showing mean, median, and quartile ranges for each multiple. (d) Apply the relevant multiple range to the target company's metrics to derive an implied valuation range. Step 3: EV/EBITDA is the most commonly used multiple because it is capital-structure-neutral (useful for comparing companies with different leverage levels) and relatively robust to accounting differences. Step 4: The key limitation of comps is that public market multiples embed the liquidity premium of public stocks — applying them to private companies typically requires a 10-30% illiquidity discount. Therefore, comparable company analysis provides a market-anchored valuation range that is most credible when the peer set is truly comparable — size, growth, margins, and business model must align or multiples must be adjusted accordingly."
"What are precedent transactions and how do they differ from comps?","To understand precedent transactions, consider: Step 1: Precedent transaction analysis values a target company by looking at the prices paid in prior M&A transactions involving similar companies, using the same multiple framework as comps (EV/EBITDA, EV/Revenue, P/E). Step 2: The critical difference from public comps is that transaction multiples include a control premium — the additional price paid above public market value to acquire control of the target, typically ranging from 20-40%. Step 3: Transaction multiples tend to be higher than trading multiples for this reason, and they also reflect deal-specific dynamics: synergy expectations, strategic necessity, competitive auction processes, and prevailing credit market conditions at the time of the deal. Step 4: A limitation is that precedent transactions are historical — multiples paid in 2021 (peak cheap money era) may be irrelevant to current market conditions, and strategic rationale differs across transactions making true comparability rare. Therefore, precedent transactions establish a 'full acquisition value' ceiling for valuation, while public comps establish a 'standalone public market value' floor — investment bankers typically present both to bracket the target's value in sell-side processes."
"What is Monte Carlo simulation in financial modeling?","Let's break this down: Step 1: Monte Carlo simulation is a computational technique that models uncertainty in financial projections by running thousands of simulations, each time randomly sampling input variables from defined probability distributions, to generate a probability distribution of outcomes. Step 2: The process: (a) Identify key uncertain inputs (revenue growth rate, margin, churn rate). (b) Define a probability distribution for each input (normal, triangular, log-normal). (c) Run 1,000-10,000 simulations, sampling from each distribution simultaneously. (d) Analyze the distribution of output results (e.g., DCF value, IRR) — showing the mean, median, standard deviation, and percentile ranges. Step 3: The output is not a single point estimate but a probability curve showing the likelihood of different outcomes — e.g., 'there is a 75% probability that IRR exceeds 15% and a 25% probability it exceeds 25%.' Step 4: Monte Carlo is superior to simple sensitivity analysis because it captures the joint probability of multiple variables moving simultaneously and reveals non-linear interactions. Therefore, Monte Carlo simulation is the gold standard for communicating investment uncertainty to sophisticated investors, transforming a single-point DCF output into a full probability-weighted outcome landscape."
"What are the best practices for building financial models in Excel?","To understand Excel modeling best practices, let's break them down: Step 1: Structural discipline — inputs (assumptions) must be clearly separated from calculations and outputs, typically on separate tabs. Every hardcoded assumption should be colored (traditionally blue) to distinguish it from calculated cells (black font). Step 2: Formula consistency — each row should use consistent formulas across all periods. Avoid mixed hardcodes and formulas in the same row, which makes auditing nearly impossible. Use named ranges or structured references to make formulas self-documenting. Step 3: Error-checking — build in integrity checks: balance sheet must balance (Assets = Liabilities + Equity), cash flow statement ending balance must match balance sheet cash, and sum checks should confirm line items add up correctly. Flag errors in red using conditional formatting. Step 4: Auditability — any assumption should be traceable back to a source document (10-K, management guidance, industry report). Document sources in comments or a dedicated assumptions sheet. Step 5: No circular references (except for intentional interest/debt circularity, resolved with iteration settings or a 'plug' structure). Therefore, a well-built financial model is not just analytically correct but structured so that any trained analyst can open it cold, understand its logic, audit its assumptions, and run scenarios without guidance."
"What are financial projections and how are they built?","Let's break this down: Step 1: Financial projections are forward-looking estimates of a company's income statement, balance sheet, and cash flow statement, typically covering 3-10 years depending on the purpose (3-5 years for near-term analysis, 10 years for long-term DCF). Step 2: Revenue projections are the starting point and foundation — typically driven by a combination of unit economics (price × volume), market size and penetration assumptions, or historical growth rates adjusted for expected changes. Step 3: Expense projections follow, typically modeled as a percentage of revenue (variable costs) or as absolute amounts growing at inflation rates (fixed costs). EBITDA, D&A, EBIT, interest expense, and taxes are then derived sequentially. Step 4: Balance sheet items are typically modeled using operating ratios: receivables as days sales outstanding (DSO), inventory as days inventory outstanding (DIO), and payables as days payable outstanding (DPO). Capex is modeled as a percentage of revenue or tied to growth capex and maintenance capex separately. Therefore, financial projections are only as credible as their revenue and margin assumptions — the single most important skill in financial modeling is building a defensible, management-aligned revenue build that can withstand rigorous questioning in an investment committee or client meeting."
"What is an earnings model and how is it different from a full DCF?","To understand earnings models, consider: Step 1: An earnings model (or earnings per share model) focuses primarily on projecting a company's near-term earnings — typically 1-3 years forward — with the goal of estimating EPS and comparing it to consensus analyst estimates and market expectations. Step 2: Earnings models are the primary tool for equity research analysts making buy/sell/hold recommendations based on whether their EPS estimate is above or below street consensus. If you model $3.00 EPS vs. consensus $2.70, you see a potential positive earnings surprise catalyst. Step 3: Unlike a DCF, an earnings model does not necessarily incorporate a terminal value or a discount rate — it outputs a near-term EPS estimate that is then multiplied by a P/E multiple to derive a price target. Step 4: The P/E multiple is itself subjectively determined by the analyst, based on historical trading ranges, peer multiples, and qualitative factors like management quality and competitive moat strength. Therefore, earnings models are pragmatic tools for near-term catalysts and stock trading around earnings events, while DCF models are the right framework for long-term intrinsic value investing — both are essential and complementary tools in an equity analyst's toolkit."
"What is the difference between enterprise value and equity value?","Let's break this down: Step 1: Enterprise Value (EV) represents the total value of a business to all capital providers — both equity and debt holders. It is the price a buyer would pay to acquire the entire business free of its capital structure: EV = Market Cap + Total Debt + Preferred Stock + Minority Interest - Cash. Step 2: Equity Value (or Market Capitalization) represents the value attributable only to common shareholders: Equity Value = EV - Net Debt (Total Debt - Cash) - Preferred Stock - Minority Interest. Step 3: The distinction matters for multiples: EV-based multiples (EV/EBITDA, EV/Revenue, EV/EBIT) are capital-structure-neutral and allow comparison across companies with different levels of leverage. Equity-based multiples (P/E, P/Book, P/FCF) are leverage-affected and can be distorted for highly levered companies. Step 4: A common error is applying equity multiples to operating metrics or EV multiples to equity metrics — these cross-contamination errors produce meaningless valuations. Therefore, always match the metric level: EV multiples pair with pre-debt metrics (EBITDA, Revenue, EBIT) and equity multiples pair with post-debt metrics (Net Income, EPS, Book Value per Share)."
"What is a merger model (M&A model) and what does it analyze?","To understand merger models, let's break it down: Step 1: An M&A model (merger model or accretion/dilution model) analyzes the financial impact of one company acquiring another — specifically whether the acquisition increases (accretive) or decreases (dilutive) the acquirer's EPS in the first year post-close. Step 2: The model combines the two standalone financial models, adds synergies (cost savings and revenue synergies), subtracts deal costs (transaction fees, restructuring charges), adjusts for new debt interest expense, incremental depreciation from asset write-ups, and additional shares issued (in stock deals). Step 3: Accretion occurs when the combined company's EPS exceeds the acquirer's standalone EPS — typically when synergies are large, the acquisition multiple is lower than the acquirer's own P/E, or the deal is funded with cheap debt. Dilution occurs in the reverse scenario. Step 4: Beyond accretion/dilution, merger models analyze: implied acquisition premium, contribution analysis (what each company contributes in revenue/EBITDA/equity), pro forma credit metrics, and synergy sensitivity. Therefore, M&A models are the primary analytical framework for evaluating deal rationale and pricing, and accretion/dilution analysis is the standard quantitative hurdle that acquirer management teams must clear to justify a transaction to their shareholders."
"What are the key assumptions in an LBO model?","Let's break this down: Step 1: Entry assumptions — purchase price multiple (EV/EBITDA at entry), debt/equity split, financing structure (senior debt, mezzanine, PIK notes), and transaction fees. These determine the starting capital structure and cost basis. Step 2: Operating assumptions — revenue growth rate, EBITDA margin trajectory, capex intensity, and working capital dynamics. These drive free cash flow available for debt repayment and ultimately exit proceeds. Step 3: Debt assumptions — interest rates on each tranche (floating vs. fixed), amortization schedules, covenant thresholds, and cash sweep provisions. How quickly debt is repaid fundamentally affects equity value at exit. Step 4: Exit assumptions — exit multiple (EV/EBITDA at sale) and holding period (typically 5-7 years). Exit multiple assumption is the single most impactful variable — buying at 8x and selling at 10x dramatically boosts returns through multiple expansion even without operational improvement. Therefore, LBO model sensitivity around entry multiple, exit multiple, and EBITDA growth rate invariably produces the most important table in any PE investment committee presentation — showing the breakeven and base/bull/bear IRR outcomes across these key variables."
"What is the difference between revenue-based and unit-economics-based projections?","To understand these approaches, consider: Step 1: Revenue-based projections start from historical revenue and apply a top-down growth rate — e.g., 'revenue grew 20% last year, we project 15% this year due to market maturation.' This is fast and simple but provides limited insight into the drivers of growth or its sustainability. Step 2: Unit-economics-based projections build revenue from the ground up using underlying business drivers: New customers acquired × Average contract value + Existing customers × Retention rate × Upsell rate = Total ARR. This approach is more laborious but reveals whether growth is driven by new customer acquisition, expansion, or price increases — each with different durability and margin implications. Step 3: For SaaS companies, the unit-economics approach uses Annual Recurring Revenue (ARR), Net Revenue Retention (NRR), and Customer Acquisition Cost (CAC) payback period to build projections. For retail, it might be same-store sales growth plus new store count. For banks, it might be loan book growth plus net interest margin. Step 4: Unit-economics models are superior for early-stage or rapidly scaling companies where historical growth rates are not indicative of future potential. Therefore, the choice between approaches should be driven by the nature of the business and the reliability of historical data as a guide to future unit-level economics."
"What is a leverage ratio and why does it matter in financial modeling?","Let's break this down: Step 1: Leverage ratios measure the proportion of debt in a company's capital structure relative to its earnings or assets. The most common is Net Debt / EBITDA — a ratio of 1.0x means total net debt equals one year of EBITDA. Step 2: In LBO models, leverage ratios are critical because: (a) they determine how much debt can be raised at closing (lenders typically impose maximum leverage constraints, e.g., 5-6x for sponsored buyouts), and (b) they set the covenant thresholds that must be maintained during the holding period. Step 3: As a company generates free cash flow and pays down debt, its leverage ratio falls. The LBO model tracks this deleveraging — from say 6x at entry to 3x at exit — which represents a major source of equity value creation. Step 4: For credit analysis, leverage ratios above 4-5x EBITDA start to raise concern about a company's ability to service debt in a downturn; above 6-7x EBITDA is considered high-yield territory with meaningful default risk. Therefore, leverage ratios are both a financial statement output (tracking capital structure health) and a model constraint (setting the boundaries of feasible financing structures in any leveraged transaction)."
"What is the concept of model circularity and how is it resolved?","To understand model circularity, let's break it down: Step 1: A circular reference in financial modeling occurs when a cell's formula refers (directly or indirectly) back to itself. The most common intentional circularity in three-statement models is the interest expense calculation: Interest = Average Debt Balance × Interest Rate. But Debt balance depends on cash (the plug), which depends on net income, which depends on interest expense — creating a true circularity. Step 2: Excel resolves intentional circularity by enabling iterative calculations (File → Options → Formulas → Enable Iterative Calculations). This allows Excel to recalculate the circular chain repeatedly until it converges to a stable solution. Step 3: Alternatively, a 'beginning of period' approach can break the circularity by using the prior period's debt balance to calculate current period interest, which introduces a small inaccuracy but avoids circular references entirely — preferred for simpler models or shared with users unfamiliar with circularity settings. Step 4: Unintentional circular references (model errors) must be eliminated — they typically arise from copy-paste errors or linking to wrong cells and can cause the entire model to produce #REF or erratic outputs. Therefore, intentional circularity management is a mark of advanced modeling skill, while unintentional circularity is a red flag that requires immediate debugging."
