question,answer
What is money?,"Money is a medium of exchange, a store of value, and a unit of account that a society agrees to use for transactions. It replaces the inefficiency of barter (directly trading goods and services). Modern money is fiat currency — its value isn't backed by gold but by government decree and public trust. Money serves three functions: enabling transactions (medium of exchange), measuring value (unit of account), and preserving purchasing power over time (store of value). Money exists in physical form (coins and notes) and digital form (bank balances, electronic transfers). The value of money erodes over time through inflation, which is why storing all wealth in cash is financially unwise. Understanding money's nature is foundational to all financial decision-making."
How do banks make money?,"Banks make money primarily through the spread between interest rates. They pay depositors a low interest rate (e.g., 2% on savings accounts) and charge borrowers a higher interest rate (e.g., 6% on mortgages, 20% on credit cards). The difference — the net interest margin — is the bank's core profit. Banks also earn fees: monthly account fees, overdraft fees, wire transfer fees, ATM fees, and loan origination fees. Investment banking divisions earn advisory fees and trading revenues. Banks can lend out significantly more than they hold in deposits through fractional reserve banking — if required reserves are 10%, a bank with $1 million in deposits can lend out up to $9 million, multiplying profits but also concentrating risk."
What is the Federal Reserve?,"The Federal Reserve (the Fed) is the central bank of the United States, created by Congress in 1913. Its primary mandates are to maximize employment, stabilize prices (target 2% inflation), and moderate long-term interest rates. The Fed's most powerful tools are: setting the federal funds rate (the overnight interest rate between banks), conducting open market operations (buying/selling government bonds to control money supply), and setting reserve requirements for banks. When the Fed raises rates, borrowing becomes more expensive throughout the economy, cooling inflation but slowing growth. When it cuts rates, borrowing is cheaper, stimulating spending and investment. The Fed also supervises banks and serves as the lender of last resort during financial crises."
What is GDP?,"GDP (Gross Domestic Product) is the total monetary value of all goods and services produced within a country's borders during a specific period, typically measured quarterly and annually. It is the most widely used measure of an economy's size and health. Growing GDP means the economy is expanding — businesses are producing more, employment typically rises, and living standards generally improve. Shrinking GDP for two consecutive quarters is the technical definition of a recession. GDP per capita (GDP divided by population) is a better measure of living standards. The US GDP is approximately $27 trillion annually, making it the world's largest economy. GDP growth of 2–3% annually is considered healthy for a developed economy."
What is a recession?,"A recession is a significant decline in economic activity spread across the economy lasting more than a few months. The technical definition is two consecutive quarters of negative GDP growth. During a recession: businesses produce less, unemployment rises, consumer spending falls, investment declines, and credit tightens. Recessions are a normal part of the economic cycle — the US has experienced 12 recessions since 1945, each lasting an average of about 10 months. Causes include financial crises, oil price shocks, interest rate increases, demand shocks, or bursting asset bubbles. The government responds with fiscal stimulus (increased spending, tax cuts) and the Federal Reserve lowers interest rates to encourage borrowing and investment. Most recessions are followed by recoveries that eventually surpass previous highs."
What is inflation?,"Inflation is the rate at which the general price level of goods and services rises over time, reducing the purchasing power of money. If the inflation rate is 3%, something that cost $100 last year costs $103 today. The Federal Reserve targets 2% annual inflation. Inflation is measured by the Consumer Price Index (CPI) and Producer Price Index (PPI). Causes include too much money chasing too few goods (demand-pull inflation), rising production costs passed to consumers (cost-push inflation), or monetary policy that expands the money supply faster than economic growth. Moderate inflation is normal and even desired — it encourages spending rather than hoarding. Hyperinflation (rapid, extreme inflation) is devastating, as seen in historical examples like Weimar Germany and Zimbabwe. Deflation (falling prices) can also be harmful, leading to spending delays and economic contraction."
What is unemployment?,"Unemployment refers to people who are actively looking for work but unable to find a job. The unemployment rate is calculated as the percentage of the labor force that is unemployed. The US unemployment rate is reported monthly by the Bureau of Labor Statistics. Types include: cyclical unemployment (due to economic downturns), structural unemployment (skills don't match available jobs), frictional unemployment (between jobs), and seasonal unemployment. A healthy economy has some level of unemployment — typically 4–5% is considered natural or full employment. Zero unemployment is undesirable and unrealistic. High unemployment signals economic distress and reduces consumer spending. The Fed considers unemployment alongside inflation when setting interest rate policy."
What is the stock market?,"The stock market is a collection of exchanges and markets where shares of publicly traded companies are bought and sold. Companies raise capital by issuing shares to the public (IPO — initial public offering), and investors then trade those shares among themselves on exchanges like the NYSE or NASDAQ. Stock prices are determined by supply and demand — when more people want to buy than sell, prices rise, and vice versa. The overall health of the market is tracked by indices like the S&P 500 (500 largest US companies), Dow Jones Industrial Average (30 large companies), and NASDAQ Composite (technology-heavy). Historically, the stock market has been one of the most powerful wealth-building tools available to ordinary investors over long time periods."
What is a bond?,"A bond is a debt instrument — essentially an IOU. When you buy a bond, you're lending money to the issuer (a government or corporation) in exchange for regular interest payments (the coupon) and the return of your principal at maturity. For example, a 10-year US Treasury bond with a 4% coupon pays 4% of face value annually for 10 years, then returns the principal. Bonds are generally safer than stocks because they have fixed payments and return of principal at maturity. However, bond prices move inversely with interest rates — when rates rise, existing bond prices fall. Bonds play an important role in portfolios, providing stability and income, especially as investors approach retirement."
What is a mutual fund?,"A mutual fund pools money from many investors to purchase a diversified portfolio of stocks, bonds, or other securities. Each investor owns shares in the fund proportional to their investment. A professional fund manager makes investment decisions. Types include: actively managed funds (manager tries to beat the market, higher fees) and passively managed index funds (track a benchmark index, very low fees). Mutual funds are priced once per day after market close. Benefits: instant diversification, professional management, and low minimum investment requirements. The main consideration is the expense ratio (annual fee) — even small differences in fees compound significantly over decades. A 1% vs 0.1% expense ratio difference on $100,000 over 30 years at 7% returns costs over $200,000 in lost wealth."
What is an ETF?,"An ETF (Exchange-Traded Fund) is an investment fund that trades on a stock exchange throughout the day, just like individual stocks. Like mutual funds, ETFs hold a basket of securities — stocks, bonds, commodities, or other assets. Most ETFs track an index (S&P 500, total bond market, sector indexes). Key advantages: very low expense ratios (often 0.03–0.10%), tax efficiency (fewer capital gains distributions than mutual funds), intraday trading flexibility, and no minimum investment beyond one share (or fractional shares). ETFs have largely replaced traditional mutual funds for individual investors due to these advantages. The most popular ETFs track the S&P 500 (VOO, SPY, IVV) and total market (VTI) with tiny fees and broad diversification."
What is diversification?,"Diversification is the practice of spreading investments across different assets, sectors, geographies, and asset classes to reduce risk. The principle: not all investments move together, so losses in one area can be offset by gains in another. When you invest in 500 different stocks instead of one, the failure of any single company barely affects your portfolio. Diversification doesn't eliminate all risk (market-wide downturns affect everything), but it eliminates specific risk — the risk of any individual stock or sector. Beyond stocks, diversifying across asset classes (stocks, bonds, real estate, international) further reduces overall portfolio volatility. A simple portfolio of a total US stock market index fund, international index fund, and bond index fund is considered well-diversified for most investors."
What is compound interest?,"Compound interest is the process of earning returns on both your principal and previously accumulated returns — creating exponential growth over time. The formula is A = P(1+r)^n, where P is principal, r is rate, and n is time periods. The power of compounding becomes dramatic over long time periods. $10,000 at 8% annual return: 10 years → $21,589. 20 years → $46,610. 30 years → $100,627. 40 years → $217,245. The key insight: time is the most powerful variable. Starting 10 years earlier roughly doubles your final wealth. This is why even small amounts invested young outperform much larger amounts invested late. Compound interest works identically against you with debt — a $5,000 credit card balance at 20% doubles in under 4 years if unpaid."
What is net worth?,"Net worth is your total financial position — everything you own minus everything you owe. Assets include: cash, savings, investment accounts, retirement accounts, real estate value, vehicle value, and valuable personal property. Liabilities include: mortgage balance, car loan, student loans, credit card balances, personal loans, and any other debts. Net worth = Total Assets - Total Liabilities. A positive net worth means you own more than you owe. Many young people have negative net worth due to student loans — this is normal and temporary. The goal is to grow net worth steadily over time through saving, investing, and paying down debt. Tracking net worth periodically (monthly or quarterly) is one of the best ways to measure overall financial progress."
What is cash flow?,"Cash flow refers to the movement of money in and out of your financial life — income flowing in and expenses flowing out. Positive cash flow means you earn more than you spend, creating surplus to save and invest. Negative cash flow means expenses exceed income, requiring debt or drawing down savings. Personal cash flow management involves: maximizing income through career growth and side income, minimizing necessary expenses, eliminating wasteful spending, and directing surplus to goals (debt payoff, emergency fund, investments). In business, cash flow is critically important — even profitable businesses can fail if they run out of cash to pay bills. Cash flow statement is one of three core financial statements, alongside the income statement and balance sheet."
What is income?,"Income is money received on a regular basis from work or investments. Active income requires continuous effort: wages and salaries from employment, self-employment income, and freelance or contract work. Passive income requires minimal ongoing effort: dividends from stocks, rental income, interest from bonds and savings, royalties, and business income where you're not actively working. Most people start with only active income and gradually build passive income streams over time. In personal finance, growing your income is as important as managing expenses — increasing the gap between income and expenses accelerates wealth building. In tax terms, income types are taxed differently: ordinary income (wages) is taxed at your marginal rate, while long-term capital gains and qualified dividends are taxed at lower rates."
What is a budget?,"A budget is a financial plan that allocates your income to different spending and saving categories. It tells your money where to go before the month begins, preventing unintentional overspending. Common budgeting methods: 50/30/20 rule (50% needs, 30% wants, 20% savings/debt), zero-based budgeting (every dollar assigned a purpose), and envelope method (cash envelopes for each category). Benefits of budgeting: visibility over where money goes, intentional spending aligned with values, progress toward financial goals, and early warning of financial stress. Even simple budgeting — tracking income vs. expenses monthly — transforms financial decision-making. The goal isn't restriction; it's intentionality. A budget aligned with your values often increases financial satisfaction by cutting spending on things you don't care about and increasing spending on what matters."
What is an asset?,"An asset is anything you own that has monetary value. In personal finance, assets include: financial assets (cash, savings, checking accounts, investments, retirement accounts, stocks, bonds, mutual funds), physical assets (real estate, vehicles, jewelry, collectibles), and business assets (ownership stakes in businesses). Assets are categorized by liquidity: liquid assets (cash and cash equivalents, easily converted to cash), and illiquid assets (real estate, private business interests, that take time to sell). Your total assets form one side of your net worth calculation. Building assets over time is the fundamental path to wealth. Income-generating assets — investments, rental properties, dividend stocks — are especially valuable because they continue producing returns without active effort."
What is a liability?,"A liability is any financial obligation — money you owe to others. Personal liabilities include: mortgage balance, car loan balance, student loan debt, credit card balances, personal loan debt, medical debt, and any other money owed. Liabilities subtract from your net worth. Not all liabilities are bad: a mortgage enables homeownership, student loans fund education, and business loans fund growth. The key measure is whether the liability is being used to acquire an asset that appreciates in value or generates income. Problematic liabilities are high-interest consumer debts (credit cards, payday loans) used for consumption — they accumulate interest while providing no return. Managing and reducing liabilities over time, especially high-interest ones, is essential to building wealth."
What is risk tolerance?,"Risk tolerance is your ability and willingness to endure fluctuations in your investment portfolio's value. Two components: capacity for risk (objective — based on time horizon, income stability, financial goals, and emergency fund size) and appetite for risk (subjective — your emotional comfort with seeing portfolio values fall). Someone who loses sleep over a 20% portfolio decline has low risk tolerance. Someone who views declines as buying opportunities has high risk tolerance. Younger investors generally have higher capacity for risk because they have decades for portfolios to recover from downturns. Investment allocation should align with your risk tolerance — too much risk leads to panic selling at bottoms, locking in losses. Most financial advisors recommend a simple questionnaire to assess risk tolerance before setting an investment strategy."
What is liquidity?,"Liquidity refers to how quickly and easily an asset can be converted to cash without significantly affecting its price. Cash is the most liquid asset. Savings accounts and money market accounts are highly liquid (accessible in 1–2 days). Stocks are highly liquid (can be sold in seconds during market hours, with cash available in 2 days). Real estate is illiquid (selling takes months and involves significant transaction costs). Private business interests are very illiquid. In personal finance, maintaining adequate liquidity (your emergency fund) ensures you can meet unexpected expenses without selling investments at bad times or taking on high-interest debt. The liquidity premium: less liquid assets typically offer higher returns to compensate investors for accepting the reduced flexibility."
What is the time value of money?,"The time value of money is the principle that a dollar today is worth more than a dollar in the future. Why? Because money available today can be invested to earn returns, making it grow over time. If you can earn 5% on money, $1,000 today becomes $1,050 in one year. Conversely, $1,000 promised one year from now is only worth $952 today (its present value). This concept underpins all of finance: loan pricing, investment valuation, retirement planning, and savings calculations. When choosing between taking money now or later, the time value of money determines which is better. This is also why paying off high-interest debt is valuable — every dollar of debt costs you future dollars in compounding interest."
What is return on investment?,"Return on investment (ROI) measures the gain or loss generated relative to the cost of the investment, expressed as a percentage. ROI = (Net Profit / Cost of Investment) × 100. Example: you buy $1,000 of stock, it grows to $1,200, so ROI = ($200 / $1,000) × 100 = 20%. ROI helps compare the efficiency of different investments. A 20% ROI on stock looks better than 5% on a savings account, but it doesn't account for risk or time period. Annualized ROI (adjusting for time) and risk-adjusted return (Sharpe ratio) give more complete pictures. In personal finance, consider ROI on paying off debt (guaranteed return equal to the interest rate), education (higher lifetime earnings), and home improvements (percentage added to resale value)."
What is a portfolio?,"A portfolio is your entire collection of investments, viewed as a whole. It may include stocks, bonds, mutual funds, ETFs, real estate, cash, and other assets. Portfolio management involves deciding how to allocate money across different asset classes (asset allocation), selecting specific investments within each class, and periodically rebalancing to maintain your target allocation as market movements shift the proportions. Portfolio design should reflect your investment goals, time horizon, and risk tolerance. Common portfolios: aggressive (80–100% stocks for long time horizons), moderate (60% stocks / 40% bonds), conservative (40% stocks / 60% bonds for near-term needs). The most important decision is asset allocation — research shows it accounts for the majority of portfolio performance variation."
What is a dividend?,"A dividend is a payment made by a company to its shareholders, distributing a portion of profits. Companies that consistently pay dividends tend to be mature, profitable businesses (utilities, consumer staples, banks). Dividends are typically paid quarterly. The dividend yield is the annual dividend divided by stock price (e.g., $2 annual dividend on a $50 stock = 4% yield). Benefits: dividends provide regular income, a sign of company health, and partial return on investment regardless of stock price movement. Total return = price appreciation + dividends. Dividend growth stocks — companies that consistently raise dividends over decades — are valued by income investors. In retirement, a portfolio of dividend-paying stocks and bonds can provide steady income without needing to sell assets."
What is a bear market versus a bull market?,"A bull market is a period of rising stock prices — typically defined as a 20%+ rise from recent lows — characterized by investor optimism, economic growth, and strong corporate earnings. A bear market is the opposite: prices fall 20%+ from recent highs, driven by economic contraction, fear, or systemic problems. Since 1926, the US stock market has spent about 78% of the time in bull markets and 22% in bear markets. The average bull market lasts about 4 years; the average bear market about 10 months. Key insight: bear markets are temporary but opportunities for long-term investors who don't panic sell. The worst investing mistake is selling during a bear market and missing the recovery, which typically comes suddenly and strongly."
What is an IPO?,"An IPO (Initial Public Offering) is when a private company offers shares to the public for the first time on a stock exchange. Companies go public to raise capital for growth, allow early investors to realize profits, and gain increased visibility. During an IPO, investment banks underwrite and price the offering. IPO investing carries unique risks: limited historical public financial data, early price volatility as the market discovers the stock's true value, and potential that the IPO price already reflects optimistic expectations. Research shows IPOs underperform the broader market on average in the years following their debut. High-profile IPOs (tech companies especially) generate media excitement that often leads to overpricing. Most individual investors are better served by purchasing shares of public companies after their IPO period stabilizes."
What is market capitalization?,"Market capitalization (market cap) is the total market value of a company's outstanding shares, calculated as share price × total shares outstanding. Market cap categorizes companies by size: large-cap (over $10 billion) — established companies like Apple, Microsoft, Amazon. Mid-cap ($2–10 billion) — growing companies. Small-cap (under $2 billion) — smaller, often faster-growing but more volatile companies. Index funds are typically weighted by market cap — larger companies have larger weights. Large-cap stocks are generally more stable; small-cap stocks are more volatile but have historically delivered higher returns over long periods (the small-cap premium). Market cap differs from a company's actual worth or book value — it reflects what investors collectively believe the business is worth right now."
What is the difference between revenue and profit?,"Revenue (also called sales or top line) is the total amount of money a business receives from its customers before any costs are deducted. Profit is what remains after subtracting all costs from revenue. Gross profit = Revenue minus cost of goods sold. Operating profit = Gross profit minus operating expenses (rent, salaries, marketing). Net profit (bottom line) = Operating profit minus interest, taxes, and all other expenses. A company can have massive revenue but zero or negative profit if costs are too high (common with fast-growing startups). Investors track both: revenue shows growth and market share; profit shows efficiency and sustainability. Profit margin (profit / revenue) indicates how much of each dollar of revenue becomes profit — a key measure of business efficiency."
What is a tax?,"A tax is a mandatory financial charge imposed by a government on individuals and businesses to fund public services and government operations. Types of taxes: income tax (federal and state tax on earnings), payroll tax (Social Security and Medicare), capital gains tax (on investment profits), sales tax (on purchases), property tax (on real estate), inheritance tax, and corporate tax. The US uses a progressive income tax system — higher income is taxed at higher marginal rates. Understanding taxes is essential to financial planning: tax-advantaged accounts (401k, IRA) reduce taxable income. Long-term capital gains rates are lower than ordinary income rates. Tax efficiency — maximizing after-tax returns — can significantly boost wealth over time. Working with a tax professional for complex situations pays for itself in tax savings."
What is financial independence?,"Financial independence means having enough assets and passive income to cover your living expenses without needing employment income. It's the point where work becomes optional. The most common framework is the 4% rule: if your investment portfolio is 25x your annual spending, you can theoretically withdraw 4% per year indefinitely, adjusted for inflation, based on historical market returns. For example, if you spend $50,000/year, you need a $1.25 million portfolio. Financial independence doesn't mean stopping work — it means having the freedom to choose. Building toward financial independence requires: consistent high savings rate, investing in index funds, keeping expenses below income, and maximizing tax-advantaged accounts. Every percentage point increase in savings rate dramatically shortens the time to reach financial independence."
