question,answer
What are beneficiary designations?,"Beneficiary designations on retirement accounts (401k, IRA), life insurance policies, and certain bank accounts determine who receives those assets upon death, overriding your will completely. Keeping beneficiary designations current (especially after marriage, divorce, or death of a beneficiary) is one of the most important and overlooked estate planning tasks. Failing to name beneficiaries or leaving outdated designations can result in assets going to the wrong people or through the costly probate process."
What is power of attorney?,"A power of attorney (POA) is a legal document authorizing someone to make financial or legal decisions on your behalf if you become incapacitated. A healthcare proxy (or healthcare power of attorney) designates someone to make medical decisions. Both documents are essential estate planning tools that prevent costly and time-consuming court proceedings to establish guardianship if you become unable to manage your affairs."
How do you calculate net worth?,"Net worth is calculated by adding up the total value of all assets (cash, investments, retirement accounts, real estate, vehicles) and subtracting all liabilities (mortgage, student loans, car loans, credit card balances). Tracking net worth monthly or quarterly provides the clearest picture of financial progress. Most people find that building net worth requires simultaneously growing assets and paying down debt."
What is financial independence?,"Financial independence means having sufficient personal wealth to live without needing to work for income—your investments generate enough passive income to cover your expenses. It is commonly defined as accumulating 25 times your annual expenses (based on the 4% safe withdrawal rate). Achieving financial independence provides freedom to work on your own terms and is the goal of the FIRE movement."
What is the FIRE movement?,"FIRE (Financial Independence, Retire Early) is a lifestyle movement focused on extreme saving (often 50-70% of income), frugal living, and aggressive investing to achieve financial independence decades ahead of the traditional retirement age. Variations include Lean FIRE (very low spending), Fat FIRE (maintaining a comfortable lifestyle), and Barista FIRE (semi-retirement with part-time income). FIRE requires careful planning around healthcare, investment withdrawal strategies, and lifestyle sustainability."
What is the safe withdrawal rate?,"The safe withdrawal rate (SWR) is the percentage of a portfolio that can be withdrawn annually in retirement with a high probability of the portfolio lasting 30+ years. The famous '4% rule' (from the Trinity Study) suggests that withdrawing 4% of the initial portfolio annually, adjusted for inflation, has historically succeeded in over 95% of 30-year periods. Many current researchers suggest 3-3.5% is safer given today's lower interest rates."
What is the 4% rule?,"The 4% rule states that retirees can withdraw 4% of their portfolio in the first year of retirement, then adjust that amount for inflation each year, with a high probability of not running out of money over a 30-year retirement. It was derived from the 1998 Trinity Study analyzing historical U.S. market returns. While widely cited, the rule's reliability depends on actual market returns, inflation rates, spending flexibility, and retirement duration."
What is sequence of returns risk in retirement?,"Sequence of returns risk is particularly dangerous in early retirement—if large market declines occur in the first few years of withdrawing from a portfolio, the combination of falling asset values and ongoing withdrawals can permanently impair the portfolio's ability to recover. This is why a retiree with a 7% average return can run out of money while another with the same average return but in a different order of years thrives. Managing sequence risk involves maintaining cash reserves, flexible spending, or dynamic withdrawal strategies."
What are required minimum distributions (RMDs)?,"Required Minimum Distributions (RMDs) are mandatory annual withdrawals from traditional IRAs, 401(k)s, and other pre-tax retirement accounts that the IRS requires beginning at age 73. The amount is calculated based on the account balance and life expectancy factors published by the IRS. Failure to take RMDs results in a 25% excise tax on the amount not withdrawn, making them a critical retirement planning consideration."
