question,answer
How do I create a budget?,"Creating a budget starts with tracking all income sources and listing every expense—fixed (rent, insurance) and variable (food, entertainment). Categorize spending, compare total expenses to income, and identify areas where you are overspending or could cut back. Review and adjust the budget monthly, treating it as a living document rather than a one-time exercise."
What is the 50/30/20 rule?,"The 50/30/20 budget rule allocates 50% of after-tax income to needs (housing, food, utilities, minimum debt payments), 30% to wants (dining out, entertainment, hobbies), and 20% to savings and debt repayment. It provides a simple, flexible framework for managing finances without detailed category-by-category budgeting. The percentages can be adjusted based on individual circumstances and financial goals."
What is zero-based budgeting?,"Zero-based budgeting assigns every dollar of income a specific purpose so that income minus all allocated expenses equals zero. Unlike traditional budgeting that adjusts the previous period's budget, zero-based budgeting requires justifying every expenditure from scratch each period. It forces intentional spending decisions and is particularly effective for people who want to maximize savings or pay off debt aggressively."
What does 'pay yourself first' mean?,"Paying yourself first means automatically setting aside savings for investments, retirement, and emergency funds at the beginning of each pay period before spending on anything else. By automating savings, you remove the temptation to spend first and save what's left over. This behavioral approach is one of the most effective habits for building long-term wealth regardless of income level."
How large should an emergency fund be?,"Most financial advisors recommend maintaining 3-6 months of essential living expenses in an emergency fund, though those with variable income or higher job insecurity may target 6-12 months. The fund should cover rent, utilities, food, transportation, insurance, and minimum debt payments. Keeping the emergency fund in a high-yield savings account ensures accessibility while earning some return."
What are high-yield savings accounts?,"High-yield savings accounts (HYSAs) offer significantly higher interest rates than traditional savings accounts, typically available through online banks. They provide FDIC insurance (up to $250,000), high liquidity, and returns that partially offset inflation's erosion of purchasing power. HYSAs are ideal for emergency funds and short-term savings goals where capital preservation and accessibility are priorities."
What are money market accounts?,"Money market accounts (MMAs) are interest-bearing deposit accounts at banks or credit unions that typically offer higher yields than regular savings accounts in exchange for higher minimum balance requirements. They are FDIC-insured and provide check-writing privileges, offering more flexibility than savings accounts. MMAs are suitable for larger cash reserves that need to remain liquid but earn higher yields."
What are Certificates of Deposit (CDs)?,"Certificates of Deposit (CDs) are time deposit accounts offered by banks that pay a fixed interest rate for a specified term (typically 3 months to 5 years) in exchange for leaving the money untouched. CDs generally offer higher yields than savings accounts as compensation for the reduced liquidity. Early withdrawal penalties apply if funds are accessed before maturity."
What are I bonds?,"I bonds (Series I Savings Bonds) are U.S. government savings bonds designed to protect against inflation, with an interest rate that adjusts every six months based on the CPI. They can be purchased directly from TreasuryDirect up to $10,000 per year per person and are state tax-exempt and federally tax-deferred. I bonds became extremely popular in 2021-2022 when their rates exceeded 9% due to high inflation."
What are Series EE bonds?,"Series EE Savings Bonds are U.S. government savings bonds purchased at face value with a fixed interest rate, guaranteed to double in value if held for 20 years (implying a 3.5% annual return). They earn interest for up to 30 years and are federal tax-deferred with no state taxes. EE bonds are popular for education savings when the education exclusion allows for tax-free interest if used for qualified education expenses."
What is a 401(k)?,"A 401(k) is an employer-sponsored tax-advantaged retirement savings plan that allows employees to contribute pre-tax income (traditional) or after-tax income (Roth), with contribution limits set annually by the IRS. Earnings grow tax-deferred (or tax-free in the Roth version), and withdrawals in retirement are taxed as ordinary income for traditional 401(k)s. In 2024, the contribution limit is $23,000 ($30,500 for those 50 and older)."
What is an employer match in a 401(k)?,"An employer match is a contribution your employer makes to your 401(k) account based on your own contributions, often matching 50-100% of contributions up to a percentage of your salary. It represents an immediate guaranteed 50-100% return on your contribution (before any investment gains) and is widely considered the best first investment anyone should make. Failing to contribute enough to capture the full employer match is one of the most costly personal finance mistakes."
What is the difference between traditional and Roth 401(k)?,"A traditional 401(k) uses pre-tax contributions, reducing taxable income today but requiring taxes to be paid on withdrawals in retirement. A Roth 401(k) uses after-tax contributions, providing no current tax deduction but allowing tax-free withdrawals in retirement. The choice depends primarily on whether you expect your tax rate to be higher or lower in retirement compared to today."
What is a 403(b) plan?,"A 403(b) is a tax-advantaged retirement savings plan similar to a 401(k) but designed for employees of public schools, non-profit organizations, and certain government entities. It offers similar contribution limits and traditional/Roth options as a 401(k). Some 403(b) plans have additional catch-up provisions for employees with 15+ years of service."
What is an IRA?,"An Individual Retirement Account (IRA) is a personal tax-advantaged savings account allowing individuals with earned income to save for retirement independently of any employer plan. Traditional and Roth IRAs each have their own tax treatment, contribution limits, and eligibility rules. In 2024, the IRA contribution limit is $7,000 ($8,000 for those 50 and older)."
What is a traditional IRA?,"A traditional IRA allows contributions that may be tax-deductible depending on income and whether you have a workplace retirement plan, with earnings growing tax-deferred. Withdrawals in retirement are taxed as ordinary income, and required minimum distributions (RMDs) must begin at age 73. It is beneficial if you expect to be in a lower tax bracket in retirement."
What is a Roth IRA?,"A Roth IRA is funded with after-tax dollars, meaning no current tax deduction, but qualified withdrawals in retirement are completely tax-free, including all earnings. There are no required minimum distributions, making Roth IRAs excellent for wealth transfer and flexible retirement planning. Income limits apply—in 2024, eligibility phases out for single filers earning above $146,000 ($230,000 for married filing jointly)."
What is a SEP IRA?,"A Simplified Employee Pension (SEP) IRA is a retirement plan for self-employed individuals and small business owners that allows much higher contribution limits than a traditional IRA—up to 25% of compensation or $69,000 in 2024. Contributions are tax-deductible and earnings grow tax-deferred. SEP IRAs are easy to set up, have no annual filing requirements, and are popular among freelancers and small business owners."
What is a SIMPLE IRA?,"A SIMPLE (Savings Incentive Match Plan for Employees) IRA is a retirement savings plan for small businesses (100 or fewer employees) that requires employer contributions and has lower administrative costs than a 401(k). Employees can contribute up to $16,000 in 2024, with employers required to either match contributions up to 3% of compensation or contribute 2% of all eligible employees' compensation. It is simpler and cheaper to administer than a 401(k)."
What is a backdoor Roth IRA?,"A backdoor Roth IRA is a strategy allowing high-income earners who exceed Roth IRA income limits to still contribute to a Roth by making a non-deductible traditional IRA contribution and then immediately converting it to a Roth IRA. While legal, it requires careful attention to the pro-rata rule if you have other pre-tax IRA funds. The strategy effectively circumvents income limits for Roth contributions."
What is a 529 college savings plan?,"A 529 plan is a tax-advantaged savings account designed for education expenses, offering tax-free growth and tax-free withdrawals for qualified education costs at colleges, universities, and K-12 schools. Contributions are not federally tax-deductible, though many states offer state income tax deductions. Starting in 2024, unused 529 funds can be rolled over to a Roth IRA (subject to limits), significantly increasing the plan's flexibility."
What is the HSA triple tax advantage?,"A Health Savings Account (HSA) offers three distinct tax benefits: contributions are tax-deductible, earnings grow tax-free, and qualified medical withdrawals are tax-free. This triple tax advantage makes HSAs the most tax-efficient savings vehicle available. After age 65, HSA funds can be withdrawn for any purpose (taxed like a traditional IRA), making them also serve as a stealth retirement account."
What are FSA accounts?,"A Flexible Spending Account (FSA) is an employer-sponsored benefit allowing employees to set aside pre-tax money for eligible medical or dependent care expenses. The FSA use-it-or-lose-it rule requires funds to be used within the plan year (with some grace period or rollover provisions). Unlike HSAs, FSAs are not portable when you change jobs and cannot be invested."
What are the basics of Social Security?,"Social Security is a federal program providing retirement, disability, and survivor benefits funded by payroll taxes. Benefits are based on your 35 highest-earning years, and the amount increases for each year you delay claiming beyond age 62 up to age 70. Claiming at full retirement age (66-67 depending on birth year) provides your standard benefit; claiming early reduces it, while delaying increases it by 8% per year."
What is Medicare?,"Medicare is the federal health insurance program primarily for Americans aged 65 and older. Part A covers hospital care; Part B covers outpatient medical services; Part C (Medicare Advantage) is an alternative provided through private insurers; and Part D covers prescription drugs. Medicare does not cover long-term care, which requires separate planning through long-term care insurance or Medicaid."
What are pension basics?,"A pension (defined benefit plan) is a retirement plan that promises a specified monthly benefit in retirement based on salary history and years of service, funded and managed by the employer. Pensions have become rare in the private sector, largely replaced by defined contribution plans like 401(k)s that shift investment risk to employees. Government and public sector workers often still have defined benefit pensions."
What are annuities?,"Annuities are insurance contracts that provide a guaranteed income stream (immediately or in the future) in exchange for a lump sum payment or series of contributions. They come in various forms including fixed, variable, and indexed annuities. While annuities provide valuable longevity insurance (protection against outliving your money), they are often complex and carry high fees that reduce their net value."
What are the types of life insurance?,"The main types of life insurance are term life (pure death benefit protection for a set period, inexpensive), whole life (permanent coverage with a cash value component, expensive), universal life (flexible permanent coverage with investment component), and variable life (permanent coverage with investment risk borne by policyholder). Most financial advisors recommend term life for most people due to its simplicity and low cost."
What is term vs whole life insurance?,"Term life insurance provides coverage for a specific period (10, 20, or 30 years) and pays a death benefit only if the insured dies during the term—it is inexpensive and straightforward. Whole life insurance provides permanent coverage and builds cash value over time but costs 5-15 times more than comparable term coverage. Most financial planning experts recommend 'buy term and invest the difference' for the majority of households."
What is disability insurance?,"Disability insurance replaces a portion of your income (typically 60-70%) if you become unable to work due to illness or injury. Long-term disability insurance is one of the most underrated yet critically important insurance products, as you are statistically far more likely to become disabled than to die prematurely during your working years. Both employer-provided and individual policies are available, with individual policies more comprehensive and portable."
What is liability insurance?,"Liability insurance protects against claims resulting from injuries, damage, or negligence for which you are legally responsible. Homeowners and auto insurance policies include liability coverage, but limits are often insufficient for high-net-worth individuals or those in high-risk professions. Liability coverage is the foundation of protecting accumulated wealth from being wiped out by a single lawsuit."
What is an umbrella insurance policy?,"An umbrella policy provides an additional layer of liability coverage beyond the limits of your home, auto, and other policies, typically in increments of $1 million. It protects against large lawsuits and claims that exceed underlying policy limits and covers situations not covered by primary policies (like libel and slander). Umbrella policies are remarkably inexpensive relative to the protection they provide—often $200-400 annually for $1 million in coverage."
What factors affect your credit score?,"Credit scores (FICO) are determined by payment history (35%), amounts owed/credit utilization (30%), length of credit history (15%), new credit inquiries (10%), and credit mix (10%). Payment history and credit utilization are the most impactful factors, meaning paying on time and keeping balances low are the most effective ways to build and maintain good credit. Late payments can remain on your report for 7 years."
What is a FICO score?,"A FICO score is a three-digit credit score ranging from 300 to 850, calculated by Fair Isaac Corporation using data from your credit reports. Scores above 740 are considered very good to exceptional and typically qualify for the best interest rates. Lenders use FICO scores to assess creditworthiness when applying for mortgages, car loans, credit cards, and sometimes even apartment rentals."
How can you improve your credit score?,"Improving your credit score requires consistently paying all bills on time, reducing credit card balances to below 30% (ideally below 10%) of credit limits, keeping older accounts open, limiting new credit applications, and checking your credit report for errors. Building credit takes time; most people see significant improvement over 6-12 months of consistent positive behavior. Disputing inaccurate negative information can also provide a quick boost."
What are debt management strategies?,"Effective debt management strategies include paying more than the minimum payment, consolidating high-interest debts, negotiating lower interest rates, using balance transfer cards with 0% promotional periods, and following either the avalanche or snowball method for paying down multiple debts. The most important step is stopping the accumulation of new debt while aggressively paying down existing balances."
What is the debt avalanche method?,"The debt avalanche method prioritizes paying off the highest interest rate debt first while making minimum payments on all others, minimizing total interest paid over time. Once the highest-rate debt is eliminated, you redirect that payment to the next highest rate. Mathematically, it is the optimal strategy for minimizing total interest cost."
What is the debt snowball method?,"The debt snowball method pays off the smallest balance first regardless of interest rate, freeing up cash flow and creating psychological momentum as debts are eliminated one by one. Dave Ramsey popularized this approach, arguing that the behavioral motivation from early wins is worth the slightly higher interest cost compared to the avalanche method. Research supports that the snowball method leads to better actual debt payoff completion rates."
What is debt consolidation?,"Debt consolidation combines multiple debts into a single loan, ideally with a lower interest rate and simplified monthly payment. Common consolidation vehicles include personal loans, balance transfer credit cards (with 0% introductory rates), and home equity loans. Consolidation only makes sense if it reduces your interest rate; consolidating into a higher rate or extending repayment terms actually increases total cost."
What is refinancing?,"Refinancing involves replacing an existing loan with a new loan, typically to obtain a lower interest rate, reduce monthly payments, or change the loan term. Mortgage refinancing is the most common form, with the general rule that refinancing makes sense when rates drop at least 0.5-1% and you plan to stay in the home long enough to recoup closing costs. Student loan and auto loan refinancing can also generate significant savings."
What are student loan repayment strategies?,"Student loan strategies include income-driven repayment plans (IDR) that cap payments as a percentage of income, Public Service Loan Forgiveness (PSLF) for qualifying government and nonprofit employees, refinancing for lower rates (though this eliminates federal protections), and aggressive extra payments to minimize interest. Federal loans offer more protections and flexibility than private loans, making the decision to refinance federal loans carefully considered."
What are mortgage basics?,"A mortgage is a loan used to purchase real estate where the property itself serves as collateral. Key terms include the principal (loan amount), interest rate (fixed or adjustable), term (15 or 30 years), and monthly payment. Lenders evaluate creditworthiness, debt-to-income ratio, and down payment size when approving mortgages."
What is the difference between a 15 and 30 year mortgage?,"A 15-year mortgage has higher monthly payments but a lower interest rate and saves dramatically on total interest paid—often hundreds of thousands of dollars. A 30-year mortgage has lower monthly payments and more cash flow flexibility but costs significantly more in total interest over the life of the loan. Most financial advisors suggest choosing based on your cash flow needs and how long you plan to stay in the home."
What is a down payment on a home?,"A down payment is the upfront cash payment made when purchasing a home, representing the portion of the purchase price you pay out of pocket. Conventional mortgages typically require 20% down to avoid Private Mortgage Insurance (PMI); government-backed loans (FHA, VA, USDA) allow lower down payments. Larger down payments reduce your loan balance, monthly payment, and total interest cost."
What is PMI (Private Mortgage Insurance)?,"Private Mortgage Insurance (PMI) is insurance required by lenders when a borrower puts down less than 20% on a conventional mortgage, protecting the lender if the borrower defaults. PMI typically costs 0.5-1.5% of the loan amount annually and is added to monthly mortgage payments. Once you reach 20% equity through payments or appreciation, you can request PMI cancellation; it automatically terminates at 22% equity."
What is home equity?,"Home equity is the current market value of your home minus the outstanding mortgage balance—representing the portion of the property you actually own. Equity builds through mortgage principal payments and home price appreciation. Home equity is a significant component of many households' net worth and can be accessed through home equity loans or HELOCs for major expenses."
What is a HELOC?,"A Home Equity Line of Credit (HELOC) is a revolving line of credit secured by your home equity, functioning like a credit card with a variable interest rate. HELOCs typically have a draw period (usually 10 years) during which you can borrow and repay freely, followed by a repayment period. They offer flexible access to home equity at rates typically lower than personal loans or credit cards, but put your home at risk if you cannot repay."
What are the pros and cons of buying vs leasing a car?,"Buying a car builds equity and has lower total cost of ownership over time once the loan is paid off. Leasing provides lower monthly payments, access to newer vehicles, and no concern about resale value, but you never build equity and mileage limits can result in penalties. From a purely financial perspective, buying a reliable used car with cash is typically the optimal choice, as new car depreciation is extremely rapid."
What are tax brackets?,"Tax brackets are ranges of income taxed at specific rates under the U.S. progressive tax system, where only the income within each bracket is taxed at that bracket's rate—not all of your income. For example, in 2024 a single filer pays 10% on income up to $11,600, 12% on the next tier, and so on up to 37%. Your marginal rate is the rate on your last dollar of income; your effective rate is the average rate across all income."
What is the standard deduction?,"The standard deduction is a fixed dollar amount you can subtract from your adjusted gross income when filing taxes without itemizing individual deductions. In 2024, the standard deduction is $14,600 for single filers and $29,200 for married filing jointly. About 90% of taxpayers take the standard deduction because it exceeds the sum of their itemizable deductions."
What are itemized deductions?,"Itemized deductions allow taxpayers to deduct specific qualifying expenses from their taxable income instead of taking the standard deduction. Common itemized deductions include mortgage interest, state and local taxes (SALT, capped at $10,000), charitable contributions, and unreimbursed medical expenses above 7.5% of AGI. Itemizing makes sense only when the total exceeds the standard deduction."
What is the difference between tax credits and deductions?,"A tax deduction reduces your taxable income, while a tax credit directly reduces your tax bill dollar-for-dollar, making credits more valuable. For example, a $1,000 deduction for someone in the 22% bracket reduces their tax bill by $220, while a $1,000 tax credit reduces it by the full $1,000. Refundable tax credits can reduce your tax liability below zero, generating a refund."
What are capital gains tax rates?,"Long-term capital gains (assets held more than one year) are taxed at preferential rates of 0%, 15%, or 20% depending on taxable income. Short-term capital gains (held one year or less) are taxed as ordinary income, which is significantly higher for most taxpayers. The gap between long-term and short-term rates creates a strong incentive to hold investments for at least one year before selling."
What are qualified dividends?,"Qualified dividends are dividends that meet IRS requirements and are taxed at the lower long-term capital gains rates (0%, 15%, or 20%) rather than ordinary income rates. To qualify, dividends must be paid by a U.S. corporation or qualifying foreign corporation and the shares must have been held for a minimum period. Most regular stock dividends from U.S. companies are qualified."
What are tax-advantaged accounts?,"Tax-advantaged accounts reduce your tax burden in some way—either through pre-tax contributions (traditional 401k, IRA) that defer taxes until withdrawal, or through after-tax contributions (Roth) that allow tax-free growth and withdrawals. HSAs offer both pre-tax contributions and tax-free qualified withdrawals. Maxing out tax-advantaged accounts is the highest-priority investment strategy for most people."
What are estate planning basics?,"Estate planning involves arranging for the management and distribution of your assets during your lifetime and after death. Key components include a will or trust, beneficiary designations on retirement accounts and insurance policies, powers of attorney (financial and healthcare), and potentially strategies to minimize estate taxes. Without an estate plan, state laws determine how your assets are distributed, which may not align with your wishes."
What is the difference between a will and a trust?,"A will is a legal document specifying how assets should be distributed after death and must go through probate (court-supervised distribution process). A revocable living trust holds assets during your lifetime and transfers them directly to beneficiaries without probate, providing privacy, faster distribution, and often lower administrative costs. Trusts are particularly valuable for larger estates, blended families, or properties in multiple states."
