question,answer
What is the Average Directional Index (ADX)?,"ADX measures trend strength on a scale from 0 to 100 without indicating direction; readings below 20 indicate a weak trend or range, while above 25 indicates a strong trend. It is plotted alongside the +DI and -DI lines; when +DI is above -DI the trend is up, and when -DI is above +DI the trend is down. ADX is most useful for filtering out range-bound conditions where trend-following strategies perform poorly."
What is the importance of multiple time frame confluence?,"Multiple time frame confluence occurs when technical signals align across different chart periods, significantly increasing the reliability of a trade setup. For example, if a stock is near weekly support, forming a bullish pattern on the daily chart, and showing oversold readings on the hourly RSI, the confluence of signals strengthens the case. Professional traders typically analyze at least three time frames: trend identification, setup identification, and entry timing."
How are Fibonacci extensions used in trading?,"Fibonacci extensions project potential price targets beyond the current swing high or low using ratios like 127.2%, 161.8%, and 261.8% of the prior move. They are used to set profit targets when price breaks into new territory with no obvious overhead resistance. The 161.8% extension (derived from the golden ratio) is considered the most significant target level."
What is the Elder Triple Screen trading system?,"The Elder Triple Screen system uses three screens (time frames) with each screen one order of magnitude larger than the previous. The first screen identifies the long-term trend using a trend-following indicator like MACD; the second screen looks for counter-trend pullbacks using an oscillator; the third screen times the entry using breakouts of the prior bar's high or low. This approach combines trend following with mean-reversion entries to improve timing."
What are common mistakes in applying technical analysis?,"Common mistakes include over-optimizing indicators (curve-fitting to historical data), ignoring the broader market trend, treating technical signals as certainties rather than probabilities, and using too many indicators that create conflicting signals. Relying solely on one time frame or ignoring fundamental context can lead to poor decisions. Successful technical analysis requires a systematic approach with defined rules for entry, exit, position sizing, and risk management."
