question,answer
What is the Average Directional Index (ADX)?,"ADX measures trend strength on a scale from 0 to 100 without indicating direction; readings below 20 indicate a weak trend or range, while above 25 indicates a strong trend. It is plotted alongside the +DI and -DI lines; when +DI is above -DI the trend is up, and when -DI is above +DI the trend is down. ADX is most useful for filtering out range-bound conditions where trend-following strategies perform poorly."
What is the importance of multiple time frame confluence?,"Multiple time frame confluence occurs when technical signals align across different chart periods, significantly increasing the reliability of a trade setup. For example, if a stock is near weekly support, forming a bullish pattern on the daily chart, and showing oversold readings on the hourly RSI, the confluence of signals strengthens the case. Professional traders typically analyze at least three time frames: trend identification, setup identification, and entry timing."
How are Fibonacci extensions used in trading?,"Fibonacci extensions project potential price targets beyond the current swing high or low using ratios like 127.2%, 161.8%, and 261.8% of the prior move. They are used to set profit targets when price breaks into new territory with no obvious overhead resistance. The 161.8% extension (derived from the golden ratio) is considered the most significant target level."
What is the Elder Triple Screen trading system?,"The Elder Triple Screen system uses three screens (time frames) with each screen one order of magnitude larger than the previous. The first screen identifies the long-term trend using a trend-following indicator like MACD; the second screen looks for counter-trend pullbacks using an oscillator; the third screen times the entry using breakouts of the prior bar's high or low. This approach combines trend following with mean-reversion entries to improve timing."
What are common mistakes in applying technical analysis?,"Common mistakes include over-optimizing indicators (curve-fitting to historical data), ignoring the broader market trend, treating technical signals as certainties rather than probabilities, and using too many indicators that create conflicting signals. Relying solely on one time frame or ignoring fundamental context can lead to poor decisions. Successful technical analysis requires a systematic approach with defined rules for entry, exit, position sizing, and risk management."
What is support and resistance?,"Support is a price zone where buying interest has historically been strong enough to halt or reverse a declining price, while resistance is a price zone where selling pressure has capped advances. These levels are identified through prior price peaks, troughs, round numbers, moving averages, and high-volume trading areas. Role reversal is a key concept: once broken, former support becomes new resistance and former resistance becomes new support."
What is a trend line?,"A trend line is a straight line drawn on a chart connecting a series of at least two price lows in an uptrend (ascending trendline) or two highs in a downtrend (descending trendline). A third touch of the line confirms its validity and increases its significance. Trend lines serve as dynamic support and resistance levels; a definitive break of a validated trend line with increased volume is a significant signal of potential trend change."
What is a channel pattern?,"A price channel is formed by drawing two parallel trend lines—one connecting the highs and one connecting the lows of a trending move. Price oscillates between the upper and lower channel boundaries, with the upper line acting as resistance and the lower as support. Trading within a channel involves buying near the lower boundary and selling near the upper, while a break outside the channel signals a potential trend acceleration in the breakout direction."
What is a head and shoulders pattern?,"The head and shoulders is one of the most reliable bearish reversal patterns, consisting of three peaks: a left shoulder, a higher head, and a right shoulder roughly equal in height to the left. A neckline connects the troughs between the peaks. A closing break below the neckline confirms the pattern, with a measured target equal to the distance from the head to the neckline subtracted from the breakout point."
What is an inverse head and shoulders?,"The inverse head and shoulders is the bullish mirror image of the head and shoulders, consisting of three troughs where the middle trough (head) is lower than the two surrounding troughs (shoulders). A neckline connects the peaks between the troughs. A closing break above the neckline on increased volume confirms the pattern and signals a potential major bullish reversal, with a measured target equal to the head-to-neckline distance added to the breakout point."
What is a triple top pattern?,"A triple top is a bearish reversal pattern forming after an uptrend where price makes three roughly equal highs separated by two pullbacks. It signals strong resistance at the triple top level and exhaustion of buying momentum. Confirmation occurs when price closes below the support level connecting the two troughs between the peaks, with the measured target equal to the pattern height projected downward from the breakdown."
What is a cup and handle pattern?,"The cup and handle is a bullish continuation pattern where price forms a rounded U-shaped bottom (the cup) followed by a brief consolidation with slight downward drift on declining volume (the handle). William O'Neil popularized the pattern in his CANSLIM investing system. A breakout above the handle on strong volume signals the pattern's completion and projects a measured move equal to the depth of the cup added to the breakout level."
What is a wedge pattern (rising and falling)?,"A rising wedge forms when price makes higher highs and higher lows within converging trendlines that slope upward—despite the upward slope, it is a bearish pattern signaling distribution. A falling wedge has lower highs and lower lows within downward-converging trendlines and is bullish despite the downward slope. Unlike triangles where one boundary is horizontal, wedges have both boundaries sloping in the same direction, always breaking counter to the wedge's direction."
What is a flag pattern?,"A flag is a short-term bullish or bearish continuation pattern that forms after a sharp, nearly vertical price move (the flagpole), followed by a period of price consolidation within a parallel channel that slopes against the prior trend. The consolidation phase resembles a flag on a pole. A breakout from the flag in the original trend direction, accompanied by volume expansion, targets a move equal to the length of the flagpole."
What is a pennant pattern?,"A pennant forms after a sharp price move (flagpole), followed by a brief consolidation in a symmetrical triangle shape with converging trendlines. Unlike the parallel channel of a flag, pennant trendlines converge toward an apex. Pennants typically resolve quickly in the direction of the prior trend on expanding volume, with a measured move target equal to the flagpole length added to the breakout point."
What is a rectangle pattern?,"A rectangle is a consolidation pattern where price moves sideways between parallel horizontal support and resistance levels for an extended period, suggesting indecision between buyers and sellers. It can be either a continuation or reversal pattern depending on context. Volume typically contracts during the rectangle formation and expands on the eventual breakout, which is expected to produce a measured move equal to the rectangle's height."
What is a rounding bottom (saucer)?,"The rounding bottom (or saucer) is a long-term bullish reversal pattern where price gradually transitions from a downtrend to an uptrend in a smooth, curved U-shape rather than a sharp V-shaped reversal. It typically forms over months to years and represents a slow, gradual shift from selling pressure to buying accumulation. Confirmation occurs when price breaks above the resistance level at the rim of the saucer on significantly expanded volume."
What is a gap in stock charts (common, breakaway, runaway, exhaustion)?,"Gaps are areas on a chart where price jumps between sessions with no trading. Common gaps appear within a range and are quickly filled; breakaway gaps occur on high volume when price escapes a consolidation, signaling a new trend. Runaway (measuring) gaps appear mid-trend on moderate volume suggesting continuation; exhaustion gaps occur near trend ends and reverse quickly. The type of gap can only be identified with certainty in retrospect based on price behavior following the gap."
What is volume analysis?,"Volume is the number of shares or contracts traded in a given period and is a critical confirming indicator in technical analysis. The core principle is that volume should expand in the direction of the trend: rising price on rising volume is bullish conviction; rising price on declining volume suggests weakening momentum. Climax volume (extreme spikes far above average) can signal the exhaustion of a trend as the last buyers or sellers are absorbed."
What is on-balance volume (OBV)?,"On-balance volume (OBV) is a cumulative indicator developed by Joe Granville that adds a period's total volume when price closes up and subtracts it when price closes down. The absolute OBV level is less important than its trend and its relationship to price. When OBV rises while price is flat or declining, it signals accumulation and potential bullish reversal; when OBV falls while price rises, it warns of distribution and potential decline."
What is volume price trend (VPT)?,"The volume price trend (VPT) indicator is a cumulative volume-based indicator that multiplies each period's volume by the percentage price change and adds or subtracts it from a running cumulative total. Unlike OBV which adds or subtracts the full volume regardless of price change magnitude, VPT weights volume by price movement size, giving more credit to larger moves. VPT is useful for confirming trends and spotting divergences between price and volume-adjusted money flow."
What is accumulation/distribution line?,"The accumulation/distribution (A/D) line was developed by Marc Chaikin and measures the cumulative flow of money into and out of a security by combining price and volume. It calculates where within the period's range the closing price falls (the money flow multiplier) and multiplies by volume to determine whether the period represents net accumulation or distribution. Rising A/D line confirms uptrends; falling A/D line confirms downtrends; divergences from price signal potential reversals."
What is the Chaikin Money Flow indicator?,"Chaikin Money Flow (CMF) was also developed by Marc Chaikin and averages the accumulation/distribution values over a specified period (typically 20 or 21 days) to create an oscillator ranging from -1 to +1. Readings above zero indicate net accumulation (bullish); below zero indicate net distribution (bearish). CMF is particularly useful for confirming breakouts: a breakout with positive CMF has stronger institutional backing than one with negative CMF."
What is MACD divergence (bullish and bearish)?,"MACD divergence occurs when the MACD indicator moves in the opposite direction of price, signaling a potential trend reversal. Bullish divergence forms when price makes a lower low but MACD makes a higher low, indicating that downside momentum is weakening even as price falls. Bearish divergence occurs when price makes a higher high but MACD makes a lower high, warning that upside momentum is fading despite continued price appreciation."
What is RSI divergence?,"RSI divergence occurs when price moves in one direction while RSI moves in the opposite direction, signaling weakening momentum. Bullish RSI divergence (price lower lows, RSI higher lows) suggests selling pressure is exhausting and a rally may follow. Bearish RSI divergence (price higher highs, RSI lower highs) warns that buying momentum is declining and a reversal may be approaching. Divergences are most reliable on longer time frames (daily and weekly charts)."
What is stochastic oscillator?,"The stochastic oscillator, developed by George Lane, measures where the closing price falls within the recent high-low range, operating on the premise that prices close near their highs in uptrends and near lows in downtrends. The %K line shows current readings; %D is a 3-period smoothing of %K. Readings above 80 indicate overbought; below 20 indicate oversold. Crossovers between %K and %D lines generate buy and sell signals."
What is Williams %R?,"Williams %R, developed by Larry Williams, is a momentum oscillator ranging from -100 to 0 that measures where price closes relative to the high-low range over a look-back period (typically 14 periods). It is the inverse of the stochastic oscillator; readings from -80 to -100 indicate oversold conditions while -20 to 0 indicate overbought. Williams %R is particularly effective as a short-term overbought/oversold indicator when combined with a trend-following filter."
What is the commodity channel index (CCI)?,"The Commodity Channel Index (CCI), developed by Donald Lambert in 1980, measures the deviation of price from its statistical mean over a specified period, oscillating above and below zero. Values above +100 suggest the security is in a strong uptrend and overbought; below -100 suggests a strong downtrend and oversold. Despite its name, CCI is widely applied to equities and other markets and is useful for identifying overbought/oversold conditions and momentum divergences."
What is average true range (ATR)?,"Average True Range (ATR), developed by J. Welles Wilder, measures market volatility by calculating the average of true ranges over a specified period (typically 14 periods). True range is the greatest of: current high minus current low, current high minus previous close, or previous close minus current low (accounting for gaps). ATR is essential for setting volatility-proportional stop-loss levels, position sizing, and identifying when volatility is compressing before a potential breakout."
What is Bollinger Band squeeze?,"A Bollinger Band squeeze occurs when the upper and lower bands narrow to unusually close proximity, indicating a period of historically low volatility. Squeezes typically precede significant price moves because volatility tends to expand after compression. The Bollinger Band Width indicator quantifies the degree of squeeze; when it reaches multi-year lows, it often signals an imminent explosive move. The direction of the breakout is not indicated by the squeeze itself—other indicators must be used to assess directional bias."
What is Bollinger Band walking?,"Bollinger Band walking occurs when price repeatedly closes at or beyond the upper (in an uptrend) or lower (in a downtrend) band for extended periods. Rather than signaling overbought or oversold conditions as conventional wisdom suggests, walking the bands indicates an exceptionally strong trend with sustained momentum. Attempting to fade (trade against) a market that is walking the bands can result in significant losses; trend-following tools should be used to identify when walking terminates."
What is Keltner channels?,"Keltner Channels place bands above and below an exponential moving average (typically 20-period) using average true range as the width measure (typically 2x ATR). They tend to be smoother than Bollinger Bands because ATR is less affected by single extreme price events. When Bollinger Bands contract inside Keltner Channels, the Bollinger Band squeeze signal is especially powerful, indicating an extremely compressed volatility state often preceding a very large directional move."
What is Donchian channels?,"Donchian Channels, developed by Richard Donchian (the father of trend following), plot the highest high and lowest low over a specified period (typically 20 days) as upper and lower bands. Price breaking above the upper band signals a new 20-day high (buy signal); breaking below the lower band signals a new low (sell signal). The famous Turtle Trading system used Donchian Channel breakouts as the primary entry signal, demonstrating that simple trend-following rules could generate extraordinary long-term returns."
What is the parabolic SAR indicator?,"The Parabolic SAR (Stop and Reverse), developed by J. Welles Wilder, plots trailing stop-and-reverse dots above or below price to indicate trend direction and potential stop placement. Dots below price signal an uptrend; dots above signal a downtrend. The acceleration factor causes the SAR to accelerate toward price as the trend extends, eventually causing a reversal signal. Parabolic SAR is most effective in trending markets but generates excessive whipsaws in choppy, sideways conditions."
What is the Ichimoku cloud?,"The Ichimoku Cloud (Ichimoku Kinko Hyo) is a comprehensive Japanese technical system providing trend direction, momentum, and support/resistance from five components: Tenkan-sen (9-period midpoint), Kijun-sen (26-period midpoint), Senkou Span A and B (forming the cloud, plotted 26 periods ahead), and Chikou Span (closing price plotted 26 periods back). Price above the cloud is bullish; below is bearish; within the cloud signals uncertainty. The system integrates multiple time horizons in a single view."
What is the ADX (Average Directional Index)?,"The Average Directional Index (ADX), also developed by Wilder, measures trend strength without indicating direction, ranging from 0 to 100. ADX below 20-25 indicates a weak trend or sideways market where trend-following strategies are ineffective; above 25 signals a developing trend; above 40-50 signals a very strong trend. The accompanying +DI and -DI lines indicate whether the trend is up or down. ADX is most valuable as a filter to determine when to use trend-following vs. mean-reversion strategies."
What is the aroon indicator?,"The Aroon indicator, developed by Tushar Chande in 1995, measures how many periods have passed since price achieved its highest high (Aroon Up) or lowest low (Aroon Down) over a specified lookback period (typically 25). Aroon Up above 70 indicates a strong uptrend; Aroon Down above 70 indicates a strong downtrend. Aroon Up crossing above Aroon Down signals a bullish trend change; the reverse signals bearish trend change."
What is the elder ray index?,"The Elder Ray Index, developed by Dr. Alexander Elder, consists of Bull Power (difference between the session high and a 13-period EMA) and Bear Power (difference between the session low and the same EMA). Bull Power above zero indicates that bulls are in control; Bear Power below zero indicates bears are in control. Elder used these in conjunction with the EMA trend direction to filter for high-quality entry signals in his triple-screen trading system."
What is Fibonacci retracement levels?,"Fibonacci retracement levels are horizontal lines drawn at the key Fibonacci ratios of 23.6%, 38.2%, 50%, 61.8%, and 78.6% of a prior price move, identifying potential support during pullbacks in an uptrend or resistance during rallies in a downtrend. The 61.8% level (derived from the golden ratio) is considered the most significant. These levels are widely used because their self-fulfilling nature—as many traders watch and react to them—makes them meaningful regardless of any intrinsic mathematical significance to markets."
What is Fibonacci extension targets?,"Fibonacci extensions project potential price targets beyond the end of a completed move, using ratios of 127.2%, 161.8%, 200%, and 261.8% of the prior measured move. They are applied after a pullback to estimate where the next impulse leg might end. The 161.8% extension (the golden ratio) is considered the most significant target. Fibonacci extensions are particularly useful when price breaks into new all-time high territory where there is no prior overhead resistance to use as a conventional target."
What is Elliott Wave theory?,"Elliott Wave theory, developed by Ralph Elliott in the 1930s, proposes that markets move in recurring fractal patterns of five impulse waves in the direction of the main trend (labeled 1-2-3-4-5) followed by three corrective waves (labeled A-B-C). Each wave is composed of the same pattern at a smaller scale, making the theory fractal across all time frames. While the theory has conceptual appeal, its practical application is difficult because wave counts are highly subjective and wave labels can often be redrawn in hindsight."
What is Gann theory?,"Gann theory, developed by legendary trader W.D. Gann in the early 20th century, uses geometric angles (Gann angles), time cycles, and price-time relationships to predict future price movements and turning points. The most famous concept is the Gann 1x1 angle (45 degrees), which represents price and time moving in equal units. Gann theory is controversial because of its complexity, mystical elements, and difficulty of independent verification, but dedicated practitioners argue it provides unique insight into market cycles."
What is market profile?,"Market profile is a charting method developed by J. Peter Steidlmayer that displays the distribution of trading activity (time and volume) at each price level over a defined period, creating a bell-curve-shaped distribution. The Point of Control (POC) is the price level with the most trading activity; the Value Area is the range containing roughly 70% of volume. Market profile reveals institutional buying and selling zones and provides context for understanding whether current price is at fair value or at an extreme."
What is volume profile (VPOC)?,"Volume Profile displays the total volume traded at each price level over a selected time period, creating a horizontal histogram overlaid on the price chart. The Volume Point of Control (VPOC) is the price level with the highest volume—representing the price at which the most trading agreement occurred. High-volume nodes act as support and resistance because they represent price areas where significant two-sided trading established value. Low-volume nodes are areas where price moved quickly and tends to pass through rapidly again."
What is point and figure charting?,"Point and figure (P&F) charts record price movements using Xs (rising prices) and Os (falling prices) without regard to time, filtering out minor fluctuations based on a predefined box size and reversal amount. P&F charts eliminate time, focusing purely on supply and demand dynamics. They are particularly effective for identifying classic chart patterns (triple tops, triple bottoms) and projecting price targets using column counts, and remain popular among technically oriented institutional analysts."
What is Renko charting?,"Renko charts display price movements as bricks or blocks of a fixed size, with a new brick plotted only when price moves by the predefined brick size, regardless of time elapsed. Like point and figure charts, Renko eliminates time from the chart, filtering minor noise and making trends visually clearer. The fixed brick size means trends appear as staircases and reversals are clear when bricks of the opposite color appear."
What is candlestick psychology (why candles work)?,"Candlestick patterns work because they capture the psychology and shifting balance of power between buyers and sellers within a period. A large bullish candle closing at the high indicates buyers were firmly in control throughout the session; a shooting star with a long upper shadow shows buyers initially dominated but sellers overwhelmed them by the close. Patterns are meaningful because they represent recurring emotional and behavioral dynamics—fear, greed, indecision, and capitulation—that repeat across markets and time periods."
What is intermarket analysis?,"Intermarket analysis examines the relationships between different asset classes—stocks, bonds, commodities, and currencies—to gain context for price trends in any single market. Classic relationships include bonds moving inversely to stocks during normal times, gold rising with inflation and falling dollar, and commodity prices leading inflation expectations. John Murphy's work on intermarket analysis demonstrated that understanding these cross-asset dynamics provides valuable context that single-market technical analysis misses."
What is sector rotation signals?,"Sector rotation signals in technical analysis involve monitoring the relative strength of different sector ETFs versus the broad market to identify which sectors are receiving institutional money flows. Classic rotation follows economic cycles: consumer discretionary and technology lead early expansion; industrials and materials lead mid-cycle; energy and staples lead late cycle; utilities and healthcare lead early recession. Monitoring sector relative strength charts on a weekly or monthly basis reveals which stage of the economic cycle the market is pricing."
What is the fear and greed index?,"The CNN Fear and Greed Index is a composite sentiment indicator combining seven market indicators including stock price momentum, stock strength, stock breadth, put-call options ratio, junk bond demand, market volatility (VIX), and safe haven demand. It produces a single score from 0 (extreme fear) to 100 (extreme greed). Extreme fear readings (below 20) have historically corresponded with market bottoms and buying opportunities, while extreme greed (above 80) has corresponded with market tops—serving as a contrarian indicator."
